number,value,datetime_start,datetime_complete,duration,params_alpha,params_colsample_bylevel,params_colsample_bytree,params_eta,params_gamma,params_grow_policy,params_lambda,params_max_depth,params_min_child_weight,params_subsample,user_attrs_n_estimators,state
0,0.7512456666666667,2021-08-08 16:13:03.767968,2021-08-08 16:13:07.342080,0 days 00:00:03.574112,0.006293576338238516,0.43492924550682777,0.5620953875096357,6.338684169940874e-08,0.10505322198210221,depthwise,9.78468202172845e-07,4,1.4960058082104137,0.8746494376618033,245,COMPLETE
1,0.7854726666666667,2021-08-08 16:13:07.342564,2021-08-08 16:13:13.364358,0 days 00:00:06.021794,0.007660670312242478,0.6564107350818065,0.8958795360320086,9.802940136387526e-06,6.786032175235716e-05,depthwise,1.0657436499983161e-05,8,2.008287242517422,0.5389431941376608,94,COMPLETE
2,0.7418566666666667,2021-08-08 16:13:13.364845,2021-08-08 16:13:14.910189,0 days 00:00:01.545344,0.0005004005893275175,0.7860063543137568,0.21428693001025165,2.3631086579209605e-06,0.007418380950864368,depthwise,0.21237308663497842,3,0.14929128843119668,0.7932045122808569,52,COMPLETE
3,0.7453436666666667,2021-08-08 16:13:14.910633,2021-08-08 16:13:16.440923,0 days 00:00:01.530290,4.578287283632816e-08,0.5918230218845661,0.9665444164956096,5.8966628824187795e-06,1.5010072304722653e-05,lossguide,0.013755521919467939,3,0.10205131693234225,0.31356842502308846,48,COMPLETE
4,0.801755,2021-08-08 16:13:16.441360,2021-08-08 16:13:19.041264,0 days 00:00:02.599904,5.788062934273779e-07,0.3117246805573589,0.9857231802346531,0.12706211210983226,5.7319885666761763e-08,lossguide,0.008136251660064271,5,0.028820883632282846,0.37293498935003505,133,COMPLETE
5,0.8087433333333333,2021-08-08 16:13:19.041692,2021-08-08 16:14:55.154263,0 days 00:01:36.112571,6.367245816077231e-05,0.3703274424696207,0.7173273743103654,0.0021739373115324603,0.0008126096021215142,lossguide,1.0526235753942713e-07,5,11.651495466841666,0.6007588690159618,10000,COMPLETE
6,0.7862026666666666,2021-08-08 16:14:55.154701,2021-08-08 16:14:59.669918,0 days 00:00:04.515217,3.216329775544995e-08,0.9760061962940914,0.8142704247016721,5.088677094307647e-07,4.3134720576189355e-06,lossguide,1.997980319564699e-05,8,0.2280646560817562,0.6350955867484098,47,COMPLETE
7,0.7507619999999999,2021-08-08 16:14:59.670341,2021-08-08 16:15:01.405808,0 days 00:00:01.735467,2.7095154769294085e-07,0.6962892243268188,0.32689261861326135,4.794438666508432e-08,6.913036639991793e-05,lossguide,4.146065558452979e-07,4,0.011411179340306379,0.9325188084000264,56,COMPLETE
8,0.8090670000000001,2021-08-08 16:15:01.406240,2021-08-08 16:15:57.963921,0 days 00:00:56.557681,0.4421429495071803,0.36666847972281735,0.9750377819890865,0.004656294564575446,0.10098348225376995,depthwise,1.3727491236299395e-07,6,1.7624476300103702,0.871585556180599,4342,COMPLETE
9,0.7871076666666666,2021-08-08 16:15:57.964362,2021-08-08 16:16:02.309256,0 days 00:00:04.344894,3.726769152861751e-05,0.6309617139051418,0.5043014076747198,8.21975187471065e-06,6.867208075788237e-08,lossguide,1.7273927804507484e-06,8,6.137075821223256,0.6339028633483026,65,COMPLETE
10,0.6827776666666666,2021-08-08 16:16:02.309730,2021-08-08 16:16:03.801906,0 days 00:00:01.492176,0.9743099984520666,0.21306883735566445,0.7129239123494122,0.0017964555287678077,0.8214293804471858,depthwise,1.1553859793676514e-08,1,0.9889625418101347,0.762224089089934,64,COMPLETE
11,0.811009,2021-08-08 16:16:03.802349,2021-08-08 16:17:49.046122,0 days 00:01:45.243773,1.9316063288781323e-05,0.42527169837197887,0.7038996179605238,0.0030210369510246804,0.005748176702728492,depthwise,1.6631548054788157e-08,6,17.99629250892507,0.5011174651045697,9441,COMPLETE
12,0.8107256666666668,2021-08-08 16:17:49.046583,2021-08-08 16:18:02.656803,0 days 00:00:13.610220,0.20188079546048598,0.4680437173142022,0.7395737344344314,0.027626861432780443,0.010029164314448698,depthwise,1.012128204852557e-08,7,18.859030543665067,0.47159360247157295,922,COMPLETE
13,0.7931506666666667,2021-08-08 16:18:02.657258,2021-08-08 16:18:04.286291,0 days 00:00:01.629033,7.128678283909589e-06,0.503972424171485,0.720626491571785,0.6987383225253405,0.002442558462867833,depthwise,1.7968848951745554e-08,7,19.474783633518406,0.4221331505868943,12,COMPLETE
14,0.809915,2021-08-08 16:18:04.286740,2021-08-08 16:18:18.354891,0 days 00:00:14.068151,0.024936059007437457,0.4980242243422589,0.48924185490063477,0.025865697121645454,0.019361940229217563,depthwise,0.0004976095732364598,9,5.281980148707627,0.23671207361484897,576,COMPLETE
15,0.7633393333333333,2021-08-08 16:18:18.355337,2021-08-08 16:18:20.292404,0 days 00:00:01.937067,0.0015367045877887977,0.20933758208656109,0.6425548164664976,0.00016688099133849502,0.0006291092025024735,depthwise,0.00014240209678178424,6,6.214605849195506,0.48393779031498974,33,COMPLETE
16,0.7814860000000001,2021-08-08 16:18:20.292861,2021-08-08 16:18:25.658991,0 days 00:00:05.366130,4.677452264746604e-06,0.5347451620272909,0.8251790876716821,0.00014320023802646736,0.6672588327417752,depthwise,3.818253086258326e-08,7,19.156751996925614,0.5085334288545326,177,COMPLETE
17,0.8058010000000001,2021-08-08 16:18:25.659449,2021-08-08 16:18:33.390150,0 days 00:00:07.730701,0.08010106516202568,0.7988661919844596,0.419899200280664,0.026781615954261845,2.0089506220679972e-06,depthwise,2.8707842446293664e-06,6,0.5397646715730123,0.20711454783495659,514,COMPLETE
18,0.781813,2021-08-08 16:18:33.390598,2021-08-08 16:18:35.578989,0 days 00:00:02.188391,0.0002516138883551518,0.3339415301145273,0.6051942685362078,0.9394553809026097,0.027526236094371177,depthwise,2.042402255073649e-07,9,3.776808236476716,0.7258238526515407,5,COMPLETE
19,0.7808146666666667,2021-08-08 16:18:35.579434,2021-08-08 16:18:37.698767,0 days 00:00:02.119333,3.854615996583679e-06,0.42664101587442943,0.8222371242068819,0.0005222528140292956,0.000776720905360326,depthwise,1.0246416268036497e-08,7,10.420949117885531,0.4108446194076575,18,COMPLETE
20,0.7861773333333334,2021-08-08 16:18:37.699210,2021-08-08 16:18:53.912671,0 days 00:00:16.213461,0.11630626865180305,0.27731900755185424,0.6496242542646528,0.027794929952301105,0.11181053016384068,depthwise,1.6989335386450074e-05,1,0.5330264665481875,0.30590463667662154,2699,COMPLETE
21,0.809803,2021-08-08 16:18:53.913124,2021-08-08 16:19:09.442997,0 days 00:00:15.529873,0.024353370220912354,0.5173862233527717,0.473420818830194,0.019863813817310637,0.009748455481202727,depthwise,0.0003539065822673432,9,3.809398016684734,0.22478277047525533,587,COMPLETE
22,0.8036153333333335,2021-08-08 16:19:09.443477,2021-08-08 16:19:12.260300,0 days 00:00:02.816823,0.12334231265146002,0.4446171455997504,0.38979967174133623,0.18548366191951052,0.01320185880112094,depthwise,0.0011561422311565258,9,8.383652043981684,0.31127250874537543,54,COMPLETE
23,0.8097696666666666,2021-08-08 16:19:12.260848,2021-08-08 16:19:33.264773,0 days 00:00:21.003925,0.001140891558625324,0.558430881359366,0.529977629255268,0.012210379488548381,0.002719141196567208,depthwise,0.001731180521867699,7,3.9370123213897967,0.46218790916542013,1255,COMPLETE
24,0.8084113333333334,2021-08-08 16:19:33.265232,2021-08-08 16:19:36.652106,0 days 00:00:03.386874,0.024359428938806032,0.46435225266778923,0.762230866735894,0.1378940427341883,0.00024706225029180116,depthwise,0.3435871326668267,8,15.781142549437801,0.5556176171618531,101,COMPLETE
25,0.8067026666666667,2021-08-08 16:19:36.652573,2021-08-08 16:21:37.781530,0 days 00:02:01.128957,0.004102440197639551,0.3980110140776484,0.6428151117272558,0.0008909851934485257,0.04146488984889584,depthwise,0.038633450416582824,6,6.355339932007877,0.37336613989012823,10000,COMPLETE
26,0.8098263333333334,2021-08-08 16:21:37.781997,2021-08-08 16:22:40.484024,0 days 00:01:02.702027,1.731453024431326e-05,0.6992298241474237,0.2940824199624987,0.005189176352475329,0.003318038705646273,depthwise,4.849295042551436e-05,9,2.80786993827424,0.27632944706838336,2404,COMPLETE
27,0.8102216666666667,2021-08-08 16:22:40.484528,2021-08-08 16:22:47.866503,0 days 00:00:07.381975,0.00018714695221922558,0.4878063737635391,0.5762593764943466,0.05269487097714742,0.40346306265509496,depthwise,5.886855184031605e-08,8,10.397711352141597,0.6658778506283848,310,COMPLETE
28,0.8090293333333333,2021-08-08 16:22:47.866952,2021-08-08 16:22:52.730148,0 days 00:00:04.863196,7.092199547817355e-07,0.282125023184589,0.897064014469481,0.08420846642722596,0.2906868438442085,depthwise,4.092983922505992e-08,7,10.825534481535508,0.6590298809975867,239,COMPLETE
29,0.7539093333333332,2021-08-08 16:22:52.730607,2021-08-08 16:22:54.823258,0 days 00:00:02.092651,0.00014140622014766053,0.5828502159712706,0.5822038455902244,3.611180229562202e-05,0.1462134849860378,depthwise,1.3419369877577259e-06,4,1.0068940741422432,0.6748365747587122,92,COMPLETE
30,0.7669846666666666,2021-08-08 16:22:54.823696,2021-08-08 16:22:56.685091,0 days 00:00:01.861395,1.384572792704815e-06,0.45370260344158936,0.6804272920128991,0.0003304363218157047,0.182728256595559,depthwise,5.083318389613719e-08,5,13.051131034311611,0.5792101293375422,52,COMPLETE
31,0.810696,2021-08-08 16:22:56.685533,2021-08-08 16:23:38.777651,0 days 00:00:42.092118,0.01556616897940398,0.49320327819700716,0.5628071528289249,0.00727213945070847,0.036542259114328436,depthwise,3.218192833727517e-07,8,6.752246862924776,0.7200320312106451,2010,COMPLETE
32,0.8116123333333333,2021-08-08 16:23:38.778119,2021-08-08 16:24:45.137580,0 days 00:01:06.359461,0.004339496625879885,0.4059555534677386,0.564214513321941,0.005009041027736097,0.048958533166881535,depthwise,4.564579379148936e-07,8,18.931346473896035,0.714347601020231,3899,COMPLETE
33,0.8116329999999999,2021-08-08 16:24:45.138056,2021-08-08 16:25:36.741949,0 days 00:00:51.603893,0.0018448215155045813,0.40226911466058163,0.5422012454714211,0.007153716123401237,0.028367128256669684,depthwise,5.339168935607958e-07,8,19.73976319439874,0.8241867534616443,2992,COMPLETE
34,0.8110583333333334,2021-08-08 16:25:36.742403,2021-08-08 16:27:59.970754,0 days 00:02:23.228351,0.0026600346396217656,0.40020599024470294,0.7644935649772577,0.0019686413424138036,0.004921939163519759,depthwise,1.0427728536125887e-06,7,19.99586155323593,0.8734307925576463,10000,COMPLETE
35,0.7741063333333332,2021-08-08 16:27:59.971218,2021-08-08 16:28:02.129041,0 days 00:00:02.157823,0.004454964140117009,0.3527486232162821,0.9054400818821122,4.3485612799618606e-05,0.0002396504272408883,depthwise,6.253977607865217e-06,6,2.1740520662808467,0.8381490012073209,45,COMPLETE
36,0.765529,2021-08-08 16:28:02.129491,2021-08-08 16:28:05.874610,0 days 00:00:03.745119,0.0023374337301564495,0.40671314762149063,0.7731559868642819,1.29390335183305e-08,0.004685747389567435,lossguide,6.872969667521604e-07,5,0.05892082782884293,0.9808567232493408,229,COMPLETE
37,0.811299,2021-08-08 16:28:05.875055,2021-08-08 16:31:00.269539,0 days 00:02:54.394484,0.0008134590763365867,0.26611710394625576,0.44148685077600863,0.0018387290479066345,2.737154811369238e-05,depthwise,2.9123674794959816e-06,8,13.123977981840486,0.8238243562341998,10000,COMPLETE
38,0.7751526666666667,2021-08-08 16:31:00.270000,2021-08-08 16:31:02.858955,0 days 00:00:02.588955,0.0005062689644324006,0.26179564661680205,0.44656097718005927,0.0013586946409355016,2.0179851768372832e-05,lossguide,5.065270314998098e-06,8,9.878607561307277,0.818385617981336,17,COMPLETE
39,0.7772856666666667,2021-08-08 16:31:02.859407,2021-08-08 16:31:07.760008,0 days 00:00:04.900601,0.0006182612262481443,0.3161291595897411,0.39135870531475125,0.0003953582983441209,9.03128731374527e-06,depthwise,6.208441460243518e-07,8,0.24731681917634846,0.9275739357887852,86,COMPLETE
40,0.7709413333333334,2021-08-08 16:31:07.760603,2021-08-08 16:31:10.410975,0 days 00:00:02.650372,0.008056414433216018,0.24664831069598073,0.31668671212191635,3.410220117643232e-05,3.0453793820622614e-07,lossguide,3.7342916813652255e-05,8,12.835831635283432,0.7791801525895015,32,COMPLETE
41,0.811192,2021-08-08 16:31:10.411445,2021-08-08 16:33:03.367864,0 days 00:01:52.956419,0.000995381980298245,0.3811147422441038,0.5405392686921544,0.0030975356762767067,4.7447225351364314e-05,depthwise,2.237174800639401e-06,7,14.879714401715468,0.8855003222153056,7845,COMPLETE
42,0.8107553333333333,2021-08-08 16:33:03.368329,2021-08-08 16:33:50.839100,0 days 00:00:47.470771,0.0010365500140693037,0.3836965574386085,0.518238648804484,0.0075936327839834054,3.345757347242662e-05,depthwise,2.971161491288495e-06,7,7.715402332793812,0.8794038290306865,3091,COMPLETE
43,0.7870526666666667,2021-08-08 16:33:50.839561,2021-08-08 16:33:56.252372,0 days 00:00:05.412811,6.44709118814446e-05,0.3131188355766886,0.5491016074028042,0.0009418817442146563,0.00015319162865372413,depthwise,1.091273099639122e-06,9,14.978451443577413,0.9238394503238729,75,COMPLETE
44,0.739667,2021-08-08 16:33:56.252887,2021-08-08 16:33:57.765664,0 days 00:00:01.512777,0.007893698967529632,0.36157508200911453,0.6134615788388103,1.2611233221047172e-06,5.111777428428595e-06,depthwise,8.62274551717933e-06,3,4.5241023223146,0.8673365648241885,47,COMPLETE
45,0.8107763333333334,2021-08-08 16:33:57.766143,2021-08-08 16:35:37.891582,0 days 00:01:40.125439,0.002732301520552598,0.9496635552432229,0.4539318538890572,0.0033489991612483923,1.4989061182813821e-06,depthwise,1.514766248708653e-07,8,13.235097598445327,0.9876409973487472,4615,COMPLETE
46,0.7699593333333333,2021-08-08 16:35:37.892050,2021-08-08 16:35:40.473397,0 days 00:00:02.581347,0.00028892491470204596,0.25238152912191836,0.35923929402985216,0.0021378706258042292,6.258907200374503e-05,lossguide,3.4761253990754734e-07,7,3.0126374787358214,0.7463492219599154,39,COMPLETE
47,0.8020146666666667,2021-08-08 16:35:40.473921,2021-08-08 16:36:44.811213,0 days 00:01:04.337292,1.0815209939142662e-08,0.29678766896286773,0.49481708696838916,0.010564835980013332,0.0014679582255814362,depthwise,2.491827493082128e-06,2,0.016398919176731225,0.8194822836311151,10000,COMPLETE
48,0.8048670000000001,2021-08-08 16:36:44.811673,2021-08-08 16:36:47.686351,0 days 00:00:02.874678,0.0006676874417901517,0.3474544732144334,0.236711566474959,0.3246337541447682,0.05502629493115857,depthwise,2.8476783304474865e-05,8,8.406662667015427,0.9007219922559739,76,COMPLETE
49,0.8094553333333332,2021-08-08 16:36:47.686809,2021-08-08 16:38:12.126365,0 days 00:01:24.439556,0.049403426398984616,0.40334638564416964,0.6736546835583159,0.0032380599685609282,2.059389434343717e-08,depthwise,8.813312339163398e-05,7,1.2055546664948449,0.7885785581028956,4857,COMPLETE
50,0.7619340000000001,2021-08-08 16:38:12.126907,2021-08-08 16:38:14.184248,0 days 00:00:02.057341,0.011468323508146005,0.223880946276749,0.4307758685278843,0.00020805038171852367,0.0005026383043805304,depthwise,1.3434061974771981e-05,6,18.88904788649119,0.8462971725388354,46,COMPLETE
51,0.781519,2021-08-08 16:38:14.184716,2021-08-08 16:38:17.240389,0 days 00:00:03.055673,3.068828813701782e-05,0.42455971701021805,0.690221616032434,0.0007833088940635057,0.0015569582317289758,depthwise,1.6703104959126873e-07,7,19.770382114314135,0.7040456040447922,70,COMPLETE
52,0.775216,2021-08-08 16:38:17.240839,2021-08-08 16:38:19.349009,0 days 00:00:02.108170,8.273690109284742e-05,0.3780304232625072,0.7853903058058843,7.330473002903182e-05,0.006627994906901627,depthwise,8.737987386860749e-08,6,14.3465435372587,0.9601596359041463,43,COMPLETE
53,0.7733276666666667,2021-08-08 16:38:19.349450,2021-08-08 16:38:21.648913,0 days 00:00:02.299463,0.0015084567502165135,0.3274613797562903,0.613789003354727,0.0021730928971595205,4.4592651408517516e-05,depthwise,2.603198006777459e-08,6,8.641293083867845,0.6059893980863874,61,COMPLETE
54,0.8103263333333334,2021-08-08 16:38:21.649353,2021-08-08 16:39:29.600575,0 days 00:01:07.951222,1.1466708682674667e-05,0.4250657305977248,0.5418738044250211,0.004023003549993995,0.017615526466929304,depthwise,8.173419916860144e-07,7,5.171196546308852,0.7986403360648358,4255,COMPLETE
55,0.8104746666666666,2021-08-08 16:39:29.601042,2021-08-08 16:40:03.405866,0 days 00:00:33.804824,0.00027220496113567643,0.540046436575796,0.4736476450496969,0.013259631070994468,0.0001105583767104493,depthwise,2.722342106569303e-07,5,19.9058873048809,0.8954615844512199,3447,COMPLETE
56,0.8102703333333334,2021-08-08 16:40:03.406321,2021-08-08 16:40:10.757563,0 days 00:00:07.351242,0.002687378093061672,0.6438297992577303,0.5154114329482495,0.05818477093703712,0.0002927692415293534,depthwise,4.632090270681966e-06,8,13.532300554484062,0.7590694324463014,314,COMPLETE
57,0.8096393333333335,2021-08-08 16:40:10.758038,2021-08-08 16:42:56.528593,0 days 00:02:45.770555,4.4891398282208233e-05,0.4807212014258353,0.858186051719692,0.001393715433380293,0.08076174933987294,lossguide,1.8703013521289846e-06,7,10.52156637755712,0.9560004581473336,10000,COMPLETE
58,0.8097046666666667,2021-08-08 16:42:56.529071,2021-08-08 16:47:53.898436,0 days 00:04:57.369365,0.0008552621136005626,0.4484957413144058,0.7307531631560878,0.000621234890304747,1.2170462187956763e-05,depthwise,1.0081747795288391e-07,9,6.815381380239097,0.5334195143157487,10000,COMPLETE
59,0.772268,2021-08-08 16:47:53.898909,2021-08-08 16:47:55.797172,0 days 00:00:01.898263,0.0003696351501963303,0.37150909048717073,0.5886430907253825,1.5683160793556244e-05,1.365678337258232e-06,depthwise,0.8954486611858168,6,0.08044753181848406,0.8487242901069315,31,COMPLETE
60,0.781358,2021-08-08 16:47:55.797602,2021-08-08 16:47:59.527413,0 days 00:00:03.729811,0.00011074648149031728,0.34056066935852125,0.9375232377596381,0.0002518763271001036,0.009707407034001928,depthwise,4.965919906256674e-07,7,14.531180161214369,0.7000406937575994,105,COMPLETE
61,0.7849933333333333,2021-08-08 16:47:59.527849,2021-08-08 16:48:02.617543,0 days 00:00:03.089694,0.0022149916528304107,0.9836161611934487,0.4504837322920419,0.003051018977902364,4.0094089835973745e-07,depthwise,1.651180553468465e-07,8,11.675687676571117,0.9915180617393108,20,COMPLETE
62,0.8113516666666666,2021-08-08 16:48:02.617975,2021-08-08 16:49:19.248125,0 days 00:01:16.630150,0.004037941888799418,0.9282261195057815,0.3792161146572606,0.004384319634300138,4.0053713040449056e-07,depthwise,2.0465895181487194e-08,8,16.175848301475295,0.9131823317988377,3912,COMPLETE
63,0.8110566666666666,2021-08-08 16:49:19.248567,2021-08-08 16:49:42.530594,0 days 00:00:23.282027,0.0057073508463351,0.9014549160062971,0.39955931709855674,0.015910143395190667,3.200230131250087e-07,depthwise,1.8329307210414588e-08,8,15.865175950491428,0.9054715403358503,1148,COMPLETE
64,0.8108126666666667,2021-08-08 16:49:42.531023,2021-08-08 16:49:52.757681,0 days 00:00:10.226658,0.05286165770837633,0.9081476050581687,0.4037419131946988,0.04219285370041925,1.2375101626549415e-07,depthwise,1.614580207555552e-08,9,15.443833153362828,0.9021439206331983,344,COMPLETE
65,0.8108296666666667,2021-08-08 16:49:52.758124,2021-08-08 16:50:40.311450,0 days 00:00:47.553326,0.0048375266076021075,0.8394992524204224,0.3538102737720881,0.007013636399064728,5.629875821608287e-07,depthwise,2.147302469325131e-08,8,9.329571138898675,0.9490440270824944,2220,COMPLETE
66,0.8103003333333333,2021-08-08 16:50:40.311891,2021-08-08 16:51:02.024186,0 days 00:00:21.712295,0.013828600327762362,0.88832052399724,0.256565021805933,0.01961871520469426,1.025359082835165e-08,depthwise,3.54972797895097e-08,9,5.091782195874797,0.8164792624446707,697,COMPLETE
67,0.8061263333333333,2021-08-08 16:51:02.024630,2021-08-08 16:51:04.662142,0 days 00:00:02.637512,0.006455679677435841,0.7430795487243657,0.36669221079962583,0.2770577641752927,6.996555840404621e-08,depthwise,6.505959915870372e-08,8,16.88596965675268,0.8685128495289093,61,COMPLETE
68,0.8075426666666666,2021-08-08 16:51:04.662567,2021-08-08 16:51:31.299964,0 days 00:00:26.637397,0.0014562048916343397,0.9287736279300491,0.2891240863604848,0.01600589432219775,1.9311541765061188e-07,depthwise,1.43115400440748e-06,9,0.34407593268674286,0.9159085667721221,551,COMPLETE
69,0.810905,2021-08-08 16:51:31.300397,2021-08-08 16:52:29.398749,0 days 00:00:58.098352,0.03955518721469319,0.8485103590545,0.4155255327811243,0.005530661178863495,8.573779065439134e-07,depthwise,3.700529084715063e-06,8,7.58857131603462,0.8815764794502251,2653,COMPLETE
70,0.8091566666666666,2021-08-08 16:52:29.399190,2021-08-08 16:52:34.407043,0 days 00:00:05.007853,0.0035635616923841364,0.7816660460496658,0.48532100047255355,0.08878792847643653,4.968857165801068e-06,lossguide,8.604831132996486e-06,8,10.920827087916042,0.8391650012515642,159,COMPLETE
71,0.8104603333333333,2021-08-08 16:52:34.407487,2021-08-08 16:55:05.125400,0 days 00:02:30.717913,0.0018365241380987665,0.6029146150495714,0.6348929789271164,0.0014078565162296062,0.01785000972269185,depthwise,1.7083827445947773e-08,7,17.196105499295715,0.740580925611967,10000,COMPLETE
72,0.8103386666666667,2021-08-08 16:55:05.125877,2021-08-08 16:55:45.536266,0 days 00:00:40.410389,0.010798291227782066,0.6891542555449243,0.7033121698375326,0.00863936830116767,0.06178913387526044,depthwise,2.581923823203262e-07,7,11.668755974856712,0.9369242725134884,2330,COMPLETE
73,0.8112716666666667,2021-08-08 16:55:45.536726,2021-08-08 16:55:58.353200,0 days 00:00:12.816474,2.2518004602734148e-06,0.3970114888400741,0.5640413004409622,0.028965767395950852,0.001364409546644945,depthwise,1.0868082134468326e-08,8,16.4632999262641,0.43053700409964335,736,COMPLETE
74,0.8110126666666666,2021-08-08 16:55:58.353855,2021-08-08 16:56:09.875374,0 days 00:00:11.521519,0.020043682695154587,0.402765583704492,0.5665676025530457,0.03357743044360536,0.0015118970111457372,depthwise,9.106706115431928e-08,8,15.647843166089677,0.7733951646708247,567,COMPLETE
