number,value,datetime_start,datetime_complete,duration,params_alpha,params_colsample_bylevel,params_colsample_bytree,params_eta,params_gamma,params_grow_policy,params_lambda,params_max_depth,params_min_child_weight,params_subsample,user_attrs_n_estimators,state
0,0.7894883333333333,2021-08-09 12:06:07.038119,2021-08-09 12:06:15.090792,0 days 00:00:08.052673,7.43872963360069e-05,0.9884078293691119,0.20043720158619777,0.06618292895065939,2.2179782664158115e-05,depthwise,6.410904720338437e-06,1,0.7587740664653736,0.2396214313873295,1090,COMPLETE
1,0.6922416666666665,2021-08-09 12:06:15.091286,2021-08-09 12:06:17.755187,0 days 00:00:02.663901,0.00375540084470774,0.2201076799676697,0.8409391718028889,5.686743728413804e-07,0.04609775084513245,lossguide,0.0005036313974256817,1,1.5700250865122267,0.5447893703710546,245,COMPLETE
2,0.7869793333333334,2021-08-09 12:06:17.755687,2021-08-09 12:07:22.191866,0 days 00:01:04.436179,2.48770170422572e-05,0.3600698658238199,0.48597116161128934,0.004270654823224336,2.967829454874663e-07,depthwise,6.952672093370166e-06,1,0.03890677455095916,0.7784606823379561,10000,COMPLETE
3,0.8095666666666667,2021-08-09 12:07:22.192322,2021-08-09 12:08:00.426439,0 days 00:00:38.234117,2.693487879666751e-06,0.3881907931788326,0.4457783739490017,0.01051916659967677,5.0947220279139215e-06,lossguide,8.611891192077335e-06,4,0.4125689555018418,0.24488303426738486,4341,COMPLETE
4,0.6889283333333333,2021-08-09 12:08:00.426885,2021-08-09 12:08:01.951658,0 days 00:00:01.524773,1.511266022063295e-08,0.39232264717577375,0.35612037392203916,1.6511255653071028e-05,4.071148912726498e-06,lossguide,0.003056024658651529,1,2.08064503356657,0.3273352296772828,61,COMPLETE
5,0.7281559999999999,2021-08-09 12:08:01.952092,2021-08-09 12:08:03.750376,0 days 00:00:01.798284,4.443694015894909e-06,0.7638781682297633,0.206685240627552,1.5793119672405754e-07,0.18206665615291442,depthwise,5.612100014153733e-08,2,0.09899947066588957,0.8819736387489461,80,COMPLETE
6,0.8124273333333333,2021-08-09 12:08:03.750817,2021-08-09 12:10:14.146065,0 days 00:02:10.395248,0.007697298603177289,0.6148147838077335,0.4560490944175832,0.001796520520295764,0.0005750036827844355,lossguide,1.2879164955808992e-07,6,4.256658826569493,0.33128108063225437,10000,COMPLETE
7,0.7290093333333333,2021-08-09 12:10:14.146500,2021-08-09 12:10:16.285431,0 days 00:00:02.138931,4.004862188787879e-08,0.7472739844634573,0.3881567729380291,2.5296168960784413e-07,9.31075988741986e-06,depthwise,2.6441967448555254e-05,2,15.974028102777169,0.2645211323730274,149,COMPLETE
8,0.7924039999999999,2021-08-09 12:10:16.285853,2021-08-09 12:10:35.469853,0 days 00:00:19.184000,0.001376395347005519,0.7376000916575125,0.8909673793479815,3.7109437997082287e-07,1.122193479730728e-05,lossguide,0.1188044094043332,9,4.282152552697459,0.6583367805983464,233,COMPLETE
9,0.7901746666666667,2021-08-09 12:10:35.470278,2021-08-09 12:10:50.904595,0 days 00:00:15.434317,0.00019919666604546204,0.6744703241184986,0.9864019407790428,5.211742951437981e-06,1.859746178270804e-08,lossguide,3.681901128150244e-05,9,17.660746547901958,0.47556736320156817,252,COMPLETE
10,0.8101596666666667,2021-08-09 12:10:50.905024,2021-08-09 12:14:36.913561,0 days 00:03:46.008537,0.5294644970206852,0.5590759331864508,0.6920080689402057,0.0006286999593120007,0.0026779086586162333,lossguide,1.5631362442545405e-08,7,0.012894216875382513,0.4184380859886519,10000,COMPLETE
11,0.8087436666666665,2021-08-09 12:14:36.914006,2021-08-09 12:18:26.016824,0 days 00:03:49.102818,0.47618150477624105,0.5642349439342083,0.6896850706017381,0.000502146974250522,0.0028854515762816264,lossguide,1.2939994933609049e-08,7,0.014588679793536079,0.41634661163365,10000,COMPLETE
12,0.7938483333333334,2021-08-09 12:18:26.017339,2021-08-09 12:18:27.759194,0 days 00:00:01.741855,0.4534737962135473,0.5471517227987052,0.6534569692638151,0.46441836100802214,0.0006720018386666964,lossguide,1.4338020994461503e-07,6,0.16525777494120147,0.4017109975806338,19,COMPLETE
13,0.783712,2021-08-09 12:18:27.759629,2021-08-09 12:18:30.371558,0 days 00:00:02.611929,0.02047654537187721,0.5033092263316595,0.5707417335279188,0.0003089391447367843,0.003988484480264919,lossguide,5.558263294394564e-07,7,0.011888141701950631,0.6303340042596739,34,COMPLETE
14,0.8102863333333333,2021-08-09 12:18:30.371960,2021-08-09 12:20:29.576017,0 days 00:01:59.204057,0.04214864487530216,0.9440546070955658,0.7400714482319567,0.0012472849524139335,0.00025298585245849394,lossguide,1.3607775853555804e-08,5,7.02601914434461,0.5077193166074581,10000,COMPLETE
15,0.7570413333333335,2021-08-09 12:20:29.576438,2021-08-09 12:20:31.380330,0 days 00:00:01.803892,0.02338045211039076,0.9916774855953607,0.8057769592238161,4.3173413974868337e-05,0.00020660339874034898,lossguide,6.337222023786858e-07,4,6.13351530566009,0.5442674556675284,60,COMPLETE
16,0.8129843333333332,2021-08-09 12:20:31.380738,2021-08-09 12:21:16.380843,0 days 00:00:45.000105,0.03669605194920851,0.8726285582887082,0.5427927791885755,0.00835696869750568,0.9639971089300927,lossguide,7.166991166186996e-07,5,6.674584656573298,0.6823027689960383,3990,COMPLETE
17,0.8115663333333334,2021-08-09 12:21:16.381269,2021-08-09 12:21:24.652120,0 days 00:00:08.270851,0.0004847359591683405,0.8424444778905421,0.536099083249441,0.04550997871023438,0.3565201620185899,lossguide,7.560116530194175e-07,5,2.108380232791434,0.716832989929875,623,COMPLETE
18,0.8040656666666667,2021-08-09 12:21:24.652523,2021-08-09 12:21:26.480032,0 days 00:00:01.827509,0.003987882438415984,0.8760083011402964,0.32277800877643775,0.46496753200446034,0.05891543293615272,depthwise,0.00038252265514197257,4,0.8607108182379608,0.9510613281153888,75,COMPLETE
19,0.7760716666666666,2021-08-09 12:21:26.480436,2021-08-09 12:21:33.141857,0 days 00:00:06.661421,0.07804609703149082,0.6498834686736641,0.5635489001550154,1.710789766426243e-08,0.020184215480604284,lossguide,0.013501988824722793,6,4.1940073133576465,0.8199699468212361,304,COMPLETE
20,0.8117103333333334,2021-08-09 12:21:33.142270,2021-08-09 12:21:59.544948,0 days 00:00:26.402678,0.00556311718212529,0.838131203179428,0.4514681552909624,0.014734510626046223,1.383900592752214e-07,lossguide,1.8490452234519696e-06,8,0.3302685967354184,0.7026660925264159,709,COMPLETE
21,0.8117346666666667,2021-08-09 12:21:59.545380,2021-08-09 12:22:24.386201,0 days 00:00:24.840821,0.006362205678503664,0.8407160207382126,0.46395376054278076,0.014519712609611463,1.224087757817004e-08,lossguide,1.5654904575893436e-06,8,0.31202923027330537,0.7026836775954984,656,COMPLETE
22,0.7736766666666667,2021-08-09 12:22:24.386609,2021-08-09 12:22:27.089475,0 days 00:00:02.702866,0.08025572469291047,0.9057612840404948,0.3060547298141463,0.0029020116376106335,1.0271546870288249e-08,lossguide,1.4201848560572542e-07,6,0.14084077221417043,0.7787827677470788,77,COMPLETE
23,0.8116343333333335,2021-08-09 12:22:27.089881,2021-08-09 12:22:31.879631,0 days 00:00:04.789750,0.0010162784625362483,0.7860648528079603,0.49671335446995774,0.09329911686942075,0.9873083657348738,lossguide,2.0362362694129326e-06,8,9.758553250252415,0.610106460481361,135,COMPLETE
24,0.7894736666666667,2021-08-09 12:22:31.880041,2021-08-09 12:22:39.797865,0 days 00:00:07.917824,0.0104278279097371,0.6555537680680837,0.5989509804525649,0.00014919389999530492,1.0512666837082779e-06,lossguide,1.2987605677677224e-07,8,0.9585725439146928,0.696311915317575,133,COMPLETE
25,0.810479,2021-08-09 12:22:39.798273,2021-08-09 12:23:23.319034,0 days 00:00:43.520761,0.07366223410603925,0.8137774702277522,0.4146979322113952,0.014803785435195968,4.389814230924468e-05,lossguide,0.00011858466192909728,3,3.332379940748044,0.5640515137487994,5541,COMPLETE
26,0.7731993333333333,2021-08-09 12:23:23.319478,2021-08-09 12:23:24.959905,0 days 00:00:01.640427,0.0014174376028532139,0.4735761991132956,0.5097954131925423,0.004837585628287334,2.1476375121777312e-07,depthwise,0.7621629552344495,6,0.2577913368791103,0.9927740033094605,10,COMPLETE
27,0.8043006666666667,2021-08-09 12:23:24.960316,2021-08-09 12:23:27.294637,0 days 00:00:02.334321,0.12898912372100926,0.7173181475659758,0.6262654216870771,0.1580474381267625,0.015089641770287456,lossguide,7.201876258969852e-08,5,0.6189614738211117,0.32964988585415955,96,COMPLETE
28,0.778059,2021-08-09 12:23:27.295045,2021-08-09 12:23:32.451411,0 days 00:00:05.156366,4.80869446298239e-05,0.9256943041150214,0.2973821989493388,0.0013733275701992983,3.790717656833678e-08,lossguide,3.885578281044643e-07,7,0.07859472625850852,0.8632976494693003,145,COMPLETE
29,0.811341,2021-08-09 12:23:32.451816,2021-08-09 12:23:43.568446,0 days 00:00:11.116630,0.00023124899360830862,0.9593503495622866,0.3911147011472186,0.04374753195845503,3.1898597941011644e-05,depthwise,2.633339728549289e-06,8,1.2503769919293566,0.7258806901213859,299,COMPLETE
30,0.7854770000000001,2021-08-09 12:23:43.568853,2021-08-09 12:23:45.554719,0 days 00:00:01.985866,7.037516324756704e-06,0.6180378544814762,0.25035626431752095,0.9804578957549663,1.1287026669661233e-06,lossguide,3.718260982791314e-08,9,11.685188690001166,0.6560182179875949,11,COMPLETE
31,0.8115006666666668,2021-08-09 12:23:45.555129,2021-08-09 12:24:06.358181,0 days 00:00:20.803052,0.006855953393802552,0.8498681320027799,0.4650486636073876,0.018286789823790128,3.023932857202178e-07,lossguide,2.0299364748895136e-06,8,0.37292413342855,0.7822110255634023,534,COMPLETE
32,0.8119313333333333,2021-08-09 12:24:06.358614,2021-08-09 12:24:25.607978,0 days 00:00:19.249364,0.008860147316788358,0.8773277730097908,0.4409252933294277,0.016500419570465795,7.602273987818053e-08,lossguide,2.2124376806766565e-05,7,0.28999925372697016,0.6871804341938281,783,COMPLETE
33,0.7712576666666666,2021-08-09 12:24:25.608399,2021-08-09 12:24:27.218900,0 days 00:00:01.610501,0.01555965385994782,0.24530657487302265,0.5286813629547712,0.003204551345720132,5.8562487320566724e-08,lossguide,2.4261441198145824e-05,6,0.0460018796241658,0.5754128333408655,9,COMPLETE
34,0.8114093333333333,2021-08-09 12:24:27.219320,2021-08-09 12:24:36.761378,0 days 00:00:09.542058,0.19222185917825052,0.8902782034490051,0.407233053132101,0.03785856184034296,9.744271617346699e-07,lossguide,8.898020842942093e-06,7,0.6361275757816767,0.748458872073438,358,COMPLETE
35,0.807658,2021-08-09 12:24:36.761868,2021-08-09 12:24:39.618260,0 days 00:00:02.856392,0.00207332059908763,0.7973925658831927,0.4443569340161484,0.1789594546034398,6.403760121029634e-08,lossguide,9.167798818071885e-05,4,0.20111212437105216,0.6642866373332051,186,COMPLETE
36,0.810955,2021-08-09 12:24:39.618672,2021-08-09 12:25:29.193294,0 days 00:00:49.574622,2.417798721819429e-07,0.28700586868681444,0.35440191222862893,0.008500739368953703,0.0008967020058869121,depthwise,7.300845461917399e-06,5,1.75732283789085,0.2012724646289188,4942,COMPLETE
37,0.775578,2021-08-09 12:25:29.193731,2021-08-09 12:25:33.037079,0 days 00:00:03.843348,0.0006511004994675571,0.70762276882453,0.4879447363850177,8.988749738282515e-05,0.09654047781054316,lossguide,3.3003076440886976e-07,6,0.4986701473326641,0.8439981938082572,134,COMPLETE
38,0.8010826666666667,2021-08-09 12:25:33.037498,2021-08-09 12:26:55.285587,0 days 00:01:22.248089,0.9865867081425892,0.9846189602259798,0.5802935822818178,0.0012304723129267755,2.6365411152541186e-06,lossguide,0.0002832010403223188,3,2.8446325750141677,0.9099951616820756,10000,COMPLETE
39,0.7564000000000001,2021-08-09 12:26:55.286034,2021-08-09 12:26:56.702376,0 days 00:00:01.416342,1.962839276152856e-05,0.4081914141048301,0.34132226618793415,1.1002707234691245e-05,1.33718575469771e-08,depthwise,0.0019717298848352218,5,0.05984303408361041,0.4916870712798672,12,COMPLETE
40,0.8122156666666666,2021-08-09 12:26:56.702795,2021-08-09 12:28:03.455846,0 days 00:01:06.753051,0.0033789309203407754,0.7745889126496717,0.43727449779039645,0.004889110255316345,9.273619603545117e-05,lossguide,1.69676747136471e-05,7,0.024011457557432694,0.8170434805113894,2876,COMPLETE
41,0.8121753333333332,2021-08-09 12:28:03.456265,2021-08-09 12:28:49.935153,0 days 00:00:46.478888,0.002917538614711572,0.7615059186164361,0.4442869467660925,0.007032990050925002,9.881674107363065e-05,lossguide,1.7479501892147203e-05,7,0.024079098857135366,0.8133398605887409,1975,COMPLETE
42,0.812192,2021-08-09 12:28:49.935581,2021-08-09 12:30:36.036975,0 days 00:01:46.101394,0.0028603680650473103,0.7649465881104781,0.36895552127054315,0.002812894315611515,1.3011081705518619e-05,lossguide,2.045345181157288e-05,7,0.023384567198154523,0.810046090692005,5026,COMPLETE
43,0.8118793333333333,2021-08-09 12:30:36.037441,2021-08-09 12:31:39.733193,0 days 00:01:03.695752,0.0003329687009101938,0.7548509912002175,0.26356033641823373,0.005170360211150934,8.373148558131252e-05,lossguide,4.756969187609473e-05,7,0.02505139759033375,0.8033907735252874,3021,COMPLETE
44,0.7725603333333333,2021-08-09 12:31:39.733621,2021-08-09 12:31:42.961603,0 days 00:00:03.227982,0.0027760321689508692,0.6959592236451873,0.3640954210037195,0.00027998741225238516,6.532053795036326e-06,lossguide,1.2511467229992435e-05,6,0.027398570771467075,0.893278019559755,111,COMPLETE
45,0.8121216666666666,2021-08-09 12:31:42.962013,2021-08-09 12:34:21.794081,0 days 00:02:38.832068,0.00011299212678428529,0.75968768889352,0.5386441342361536,0.0019681742888652248,1.6709653875154257e-05,lossguide,0.0011890961483854167,7,0.02510132989926257,0.9207217784784142,6763,COMPLETE
46,0.7704246666666666,2021-08-09 12:34:21.794509,2021-08-09 12:34:23.627808,0 days 00:00:01.833299,0.029801093174942225,0.6079519311983559,0.4174550035750688,0.0005933120144601867,0.00011759828967476914,lossguide,4.311646894198122e-06,6,0.017890917727446397,0.7556955815977426,22,COMPLETE
47,0.8116736666666666,2021-08-09 12:34:23.628257,2021-08-09 12:35:08.579758,0 days 00:00:44.951501,0.002490612925492225,0.7842631124721574,0.37693307455345987,0.007139845898741589,0.0006322260385353429,lossguide,9.693801114810879e-05,5,0.010028520534313176,0.8343999415181891,3996,COMPLETE
48,0.7849246666666666,2021-08-09 12:35:08.580239,2021-08-09 12:35:11.415280,0 days 00:00:02.835041,0.0008126763729268512,0.7245905409198815,0.6424406957169747,3.1361723174679225e-05,0.0003571973469739822,lossguide,4.673278241571468e-06,7,0.03702770700576654,0.3270186049639407,39,COMPLETE
49,0.7806476666666667,2021-08-09 12:35:11.415696,2021-08-09 12:35:18.175470,0 days 00:00:06.759774,0.1939835647604291,0.6751813527908955,0.24381729346430492,0.00015562846172410981,0.0013574054622881254,depthwise,0.006445950374978804,9,0.08622710303216576,0.8685056168477674,77,COMPLETE
50,0.7784846666666666,2021-08-09 12:35:18.175876,2021-08-09 12:35:20.614644,0 days 00:00:02.438768,0.044029921226625975,0.6315478501051306,0.701038364751778,0.0008422863960556415,3.8575769651134805e-05,lossguide,7.517677069700749e-07,6,0.017661810191766002,0.9420164131462988,52,COMPLETE
51,0.8121826666666667,2021-08-09 12:35:20.615060,2021-08-09 12:37:35.745228,0 days 00:02:15.130168,0.00011371079185809577,0.7610515555353331,0.5499489341469153,0.0022360953740849093,1.401753370884083e-05,lossguide,0.0007053140132130194,7,0.030843008753816282,0.914042662381515,5706,COMPLETE
52,0.8118789999999999,2021-08-09 12:37:35.745747,2021-08-09 12:39:40.171391,0 days 00:02:04.425644,7.249916105040895e-07,0.8113180832414942,0.5144744867242054,0.0023941248962095984,7.196588191466606e-05,lossguide,0.0007019941941888557,7,0.037133441416119364,0.9831530219627852,5228,COMPLETE
53,0.8116403333333334,2021-08-09 12:39:40.171815,2021-08-09 12:39:53.173758,0 days 00:00:13.001943,0.012928989589965228,0.5820558654511104,0.5590108128826101,0.02873288999994666,1.0734690889068528e-05,lossguide,0.00020158430879587652,7,0.054192553982107476,0.808111930716527,515,COMPLETE
54,0.7880933333333333,2021-08-09 12:39:53.174192,2021-08-09 12:40:04.402114,0 days 00:00:11.227922,9.808924230528695e-05,0.7632059450147152,0.48064286751017293,0.000333986035818686,0.006387131097009914,lossguide,5.8190911534181723e-05,8,5.867553780402394,0.4549073706728444,251,COMPLETE
55,0.8117693333333333,2021-08-09 12:40:04.402534,2021-08-09 12:40:44.396499,0 days 00:00:39.993965,1.6591954891311344e-05,0.5331855364783618,0.6039345238003309,0.00702931436852975,2.5500440614450216e-06,lossguide,1.521658173493849e-05,6,0.01743518946046451,0.9475059762581621,2495,COMPLETE
56,0.7859293333333334,2021-08-09 12:40:44.396923,2021-08-09 12:40:47.554903,0 days 00:00:03.157980,0.003903247172066458,0.6830172342812029,0.4276704054830143,1.7810612200914314e-06,0.0001668385498783938,lossguide,0.026607502154025534,8,0.03051849866717336,0.7515444926997766,21,COMPLETE
57,0.812126,2021-08-09 12:40:47.555331,2021-08-09 12:40:52.984231,0 days 00:00:05.428900,5.213496196611177e-05,0.7390765157625321,0.3859497264978946,0.09533898091503741,1.617868848015906e-05,lossguide,0.0006794233258848444,6,12.21501392565719,0.8920663620696649,323,COMPLETE
58,0.8117179999999999,2021-08-09 12:40:52.984653,2021-08-09 12:42:11.101813,0 days 00:01:18.117160,0.0018860908579507053,0.8433673169091804,0.5480819897459694,0.003778565712747833,0.000421624787365209,lossguide,3.836735325451276e-08,5,0.020728077686502616,0.852523849072914,6642,COMPLETE
59,0.8113453333333333,2021-08-09 12:42:11.102239,2021-08-09 12:46:07.817048,0 days 00:03:56.714809,0.00042456292307589883,0.47096400093492397,0.995157103121918,0.0009212659247057545,6.596325759612587e-05,lossguide,1.1792199133136023e-06,7,0.012678362887598365,0.8039187528497672,10000,COMPLETE
60,0.7800476666666666,2021-08-09 12:46:07.817489,2021-08-09 12:47:11.031834,0 days 00:01:03.214345,0.025339751100823364,0.9208435239779019,0.9056744430303599,0.0018528470482222317,4.194442419688836e-06,lossguide,0.00018802736450340243,1,0.07115109682886052,0.6239077250320869,10000,COMPLETE
61,0.8112376666666666,2021-08-09 12:47:11.032319,2021-08-09 12:47:14.663618,0 days 00:00:03.631299,5.181788762864683e-05,0.7477064226879966,0.391287652016657,0.13665970651197212,1.7216690526049988e-05,lossguide,0.0007660233080033178,6,13.904889341305202,0.8854329925097495,183,COMPLETE
62,0.813228,2021-08-09 12:47:14.664054,2021-08-09 12:47:21.097430,0 days 00:00:06.433376,2.8897815793266185e-06,0.7289947396246426,0.3340939546813625,0.08456862187765529,2.4171061516843648e-05,lossguide,0.0019431854003099862,7,16.686788136965777,0.9677607490348885,322,COMPLETE
63,0.812134,2021-08-09 12:47:21.097861,2021-08-09 12:47:55.613846,0 days 00:00:34.515985,1.2323451037045083e-06,0.7826958070584167,0.3326156693265135,0.009461056754964213,2.3594629668353108e-05,lossguide,0.0022555428425068665,7,0.10872307158610267,0.9857964586012049,1577,COMPLETE
64,0.8142776666666668,2021-08-09 12:47:55.614272,2021-08-09 12:48:15.449082,0 days 00:00:19.834810,6.3679561657363266e-06,0.6473401405089392,0.2928811321709691,0.02183616604920559,0.00018774035573861488,lossguide,0.007813168106504752,8,18.59468653712314,0.9251311162702798,950,COMPLETE
65,0.8090676666666666,2021-08-09 12:48:15.449624,2021-08-09 12:48:18.546937,0 days 00:00:03.097313,2.550014254392549e-06,0.6560582235136386,0.28732637332901395,0.2737000708892977,7.199256693474098e-06,lossguide,0.02265618237708113,8,15.981440949861181,0.9270858707508361,82,COMPLETE
66,0.8134036666666667,2021-08-09 12:48:18.547359,2021-08-09 12:48:26.594716,0 days 00:00:08.047357,1.738771778007011e-07,0.6381909796101393,0.31374925017466415,0.06436695540637848,0.4196414184956038,lossguide,0.0051952925870804014,9,19.989223424344058,0.9739392316895639,308,COMPLETE
67,0.8120083333333333,2021-08-09 12:48:26.595140,2021-08-09 12:48:34.652142,0 days 00:00:08.057002,1.4393991997034011e-07,0.5827410188764522,0.20499357059564519,0.07575059286455527,0.411153776327046,depthwise,0.10764468053002645,9,9.1250941843955,0.9764492720723646,313,COMPLETE
68,0.81364,2021-08-09 12:48:34.652568,2021-08-09 12:48:49.721028,0 days 00:00:15.068460,6.510831152893483e-08,0.6348383908511509,0.22917911074824232,0.03493517583369538,0.7458155740075756,lossguide,0.005697369585129124,9,17.822154841092924,0.9642193013616677,803,COMPLETE
69,0.8141533333333334,2021-08-09 12:48:49.721464,2021-08-09 12:49:13.135884,0 days 00:00:23.414420,1.6097190337764168e-08,0.6357931524038185,0.23262281662207912,0.02156647160237996,0.6079676981633213,lossguide,0.005368818547621489,9,18.47680064413918,0.9550211720740447,1172,COMPLETE
70,0.8088433333333334,2021-08-09 12:49:13.136315,2021-08-09 12:49:15.704906,0 days 00:00:02.568591,1.9612560808766894e-08,0.6267965092082485,0.22447918109258813,0.32487845477873467,0.7611179821774363,lossguide,0.00632601606124905,9,18.14712647827822,0.9638286088220348,74,COMPLETE
71,0.8138873333333333,2021-08-09 12:49:15.705344,2021-08-09 12:49:32.833925,0 days 00:00:17.128581,5.266249135731703e-08,0.5381537635965612,0.31461963510641133,0.025683150835297562,0.16910655547010278,lossguide,0.005491389019618932,9,8.319974817176996,0.9595524440146185,562,COMPLETE
72,0.813918,2021-08-09 12:49:32.834362,2021-08-09 12:49:51.161984,0 days 00:00:18.327622,7.522027561924183e-08,0.5707500751526068,0.2727021547322611,0.02787089315499837,0.1886824168465571,lossguide,0.0047715006883284755,9,19.970821094792413,0.9496488256210915,792,COMPLETE
73,0.8137663333333333,2021-08-09 12:49:51.162418,2021-08-09 12:50:06.976652,0 days 00:00:15.814234,7.31134591516738e-08,0.5213429262860881,0.27616044553327024,0.03423056479973351,0.1359711567591578,lossguide,0.004949976351052585,9,19.763198882463413,0.9580521676444114,679,COMPLETE
74,0.8140246666666666,2021-08-09 12:50:06.977082,2021-08-09 12:50:27.877815,0 days 00:00:20.900733,6.404435160071315e-08,0.5258997707254729,0.27694178910252876,0.024806103202621943,0.1726555660811839,lossguide,0.005066349227228312,9,19.950194895265433,0.9963356610466673,944,COMPLETE
