number,value,datetime_start,datetime_complete,duration,params_alpha,params_colsample_bylevel,params_colsample_bytree,params_eta,params_gamma,params_grow_policy,params_lambda,params_max_depth,params_min_child_weight,params_subsample,user_attrs_n_estimators,state
75,0.8141090000000001,2021-08-08 04:46:54.336019,2021-08-08 04:48:57.844100,0 days 00:02:03.508081,1.5964050927247112e-08,0.9458346218293647,0.6091564734993168,0.002725149061060532,1.1102806540433437e-07,depthwise,2.2974806610898797e-07,8,7.969657125212598,0.6503395534800056,5059,COMPLETE
76,0.7903383333333335,2021-08-08 04:48:57.844559,2021-08-08 04:49:03.586001,0 days 00:00:05.741442,3.2269594522169786e-07,0.8055695204357687,0.4654172829510217,0.0011580095652674559,5.826936260177288e-05,depthwise,6.843266825007549e-07,9,15.944293574140396,0.6848764285068834,66,COMPLETE
77,0.8144266666666667,2021-08-08 04:49:03.586440,2021-08-08 04:50:27.663408,0 days 00:01:24.076968,1.009927353486304e-08,0.8459910764446577,0.37143022382595736,0.0044151377887245,1.2761229379789065e-06,depthwise,5.5251458327179635e-08,8,10.195075042264458,0.6107766080205932,3903,COMPLETE
78,0.8141696666666668,2021-08-08 04:50:27.663863,2021-08-08 04:50:44.795122,0 days 00:00:17.131259,3.4343827006300384e-08,0.6946993802267285,0.3949374557788867,0.02375045590891894,3.937342112713905e-07,depthwise,1.335339497023463e-05,9,15.42287052694341,0.5598511384622051,713,COMPLETE
79,0.8142423333333334,2021-08-08 04:50:44.795587,2021-08-08 04:53:49.814417,0 days 00:03:05.018830,1.229637860505937e-07,0.7650435821147892,0.428826147153681,0.0017642305373738783,2.2195081970044662e-07,depthwise,2.3862325131134494e-08,8,8.062057577124136,0.7293783887368654,7895,COMPLETE
80,0.8129050000000001,2021-08-08 04:53:49.814882,2021-08-08 04:54:38.511107,0 days 00:00:48.696225,8.994110895859119e-07,0.6685620951032268,0.3367005423718073,0.006588784447564688,1.8127264947915417e-08,depthwise,1.8514895794669642e-06,7,1.5735477797625854,0.6288243890276071,2695,COMPLETE
81,0.8143920000000001,2021-08-08 04:54:38.511559,2021-08-08 04:54:57.161416,0 days 00:00:18.649857,1.1603832354116201e-07,0.875639546020682,0.2927029158675177,0.025712802941835155,3.0006631428280904e-07,depthwise,4.323106265558193e-07,8,18.53336320168954,0.5851051185947609,1007,COMPLETE
82,0.814461,2021-08-08 04:54:57.161863,2021-08-08 04:55:31.032786,0 days 00:00:33.870923,6.049397717025675e-08,0.8610638530187311,0.29958479697152013,0.010739398756143579,4.729187045133776e-07,depthwise,2.0540243884001518e-07,8,19.792642369022825,0.5235877402447893,1926,COMPLETE
83,0.8135186666666666,2021-08-08 04:55:31.033261,2021-08-08 04:55:42.649021,0 days 00:00:11.615760,1.8630597444410977e-08,0.7903165364163596,0.2650459265342508,0.044002656573128525,4.179452209765914e-08,depthwise,3.956788289553532e-06,9,11.865055655209483,0.5851023286554524,450,COMPLETE
84,0.8128376666666668,2021-08-08 04:55:42.649475,2021-08-08 04:55:48.483814,0 days 00:00:05.834339,1.4371806693603797e-07,0.8989113039505195,0.40095766289414575,0.08852211406393323,1.1395230814020635e-07,depthwise,9.394992675365384e-07,8,15.41581237412882,0.6920574542662248,200,COMPLETE
85,0.8139786666666667,2021-08-08 04:55:48.484291,2021-08-08 04:56:08.217848,0 days 00:00:19.733557,3.5318376391175154e-08,0.7439871402421308,0.35830207784045676,0.018475656368033565,9.00793078162063e-08,depthwise,9.480421262615778e-08,7,9.587400125476558,0.5394021078516057,1209,COMPLETE
86,0.7824433333333333,2021-08-08 04:56:08.218302,2021-08-08 04:56:17.818329,0 days 00:00:09.600027,6.560481794023477e-08,0.8168881470752295,0.3203480605640467,1.7575810828051753e-08,1.1813079435620518e-06,depthwise,3.406916170784945e-07,9,19.77623616428408,0.5042602174991302,232,COMPLETE
87,0.814018,2021-08-08 04:56:17.818774,2021-08-08 04:58:44.559025,0 days 00:02:26.740251,1.506666012156172e-08,0.9296753723777403,0.2275733478525175,0.002717549868137418,1.2587670583205641e-05,depthwise,0.002095957888266216,8,11.530878826104138,0.6148335690961396,7853,COMPLETE
88,0.8147806666666666,2021-08-08 04:58:44.559495,2021-08-08 04:59:51.277211,0 days 00:01:06.717716,2.9936822570606254e-08,0.8593367753726815,0.26951335963567913,0.006287728057055066,4.526911082622225e-08,depthwise,4.334215327193339e-08,9,15.956168199237892,0.7657801021002772,2834,COMPLETE
89,0.8138756666666667,2021-08-08 04:59:51.277671,2021-08-08 05:00:59.196184,0 days 00:01:07.918513,2.4264181464102818e-08,0.842103447661858,0.26869301782847904,0.006361732765903056,4.5613501540360735e-08,depthwise,4.2560849403051524e-08,9,4.973009297456076,0.7811424597013331,2234,COMPLETE
