number,value,datetime_start,datetime_complete,duration,params_alpha,params_colsample_bylevel,params_colsample_bytree,params_eta,params_gamma,params_grow_policy,params_lambda,params_max_depth,params_min_child_weight,params_subsample,user_attrs_n_estimators,state
75,0.7853633333333333,2021-08-08 08:51:21.640765,2021-08-08 08:51:24.873933,0 days 00:00:03.233168,3.3030369419359375e-08,0.674101015825793,0.45172112815447896,0.000693167720720079,0.044978769491737576,depthwise,6.075297834208119e-08,8,14.246908345194859,0.7498211481806798,38,COMPLETE
76,0.8084383333333333,2021-08-08 08:51:24.874368,2021-08-08 08:51:28.616422,0 days 00:00:03.742054,1.7225132431852263e-08,0.5357556933456521,0.48635844706824904,0.15723945116134977,0.709984451703615,depthwise,1.5192134885071952e-07,9,6.055525466012954,0.8923266051106808,72,COMPLETE
77,0.809792,2021-08-08 08:51:28.616860,2021-08-08 08:51:46.958240,0 days 00:00:18.341380,6.5234802757411555e-06,0.4404033675501381,0.3346333607436482,0.016199695697769488,0.32355506452897864,depthwise,2.6249122757064934e-08,8,2.215217381658411,0.2115588974446192,925,COMPLETE
78,0.786593,2021-08-08 08:51:46.958685,2021-08-08 08:51:52.380035,0 days 00:00:05.421350,1.4460652766742593e-07,0.3640538838681463,0.379587345310263,0.0016241223814415693,0.10294598676085809,depthwise,6.828964349489932e-08,9,15.361802753923321,0.9589185084643524,86,COMPLETE
79,0.7329706666666667,2021-08-08 08:51:52.380484,2021-08-08 08:51:53.899721,0 days 00:00:01.519237,0.047858477076066636,0.24499037993985467,0.4697193708134565,0.004152972678345027,0.038761526578358164,depthwise,4.855440587016844e-07,2,7.728709810021473,0.7732258524795611,72,COMPLETE
80,0.812036,2021-08-08 08:51:53.900164,2021-08-08 08:52:52.155352,0 days 00:00:58.255188,2.396387266113017e-06,0.5913043043900141,0.22545578759737997,0.008343763749991217,0.23962880009535575,depthwise,1.3297062980626782e-06,8,11.021985405202111,0.8362649242406821,3374,COMPLETE
81,0.8121490000000001,2021-08-08 08:52:52.155805,2021-08-08 08:53:18.959090,0 days 00:00:26.803285,3.3142950946435667e-06,0.6020494470122368,0.3038792747870435,0.015196143443564392,0.2490314579987567,depthwise,1.4119162863575936e-06,8,11.710937028148926,0.8405956610468465,1428,COMPLETE
82,0.81182,2021-08-08 08:53:18.959542,2021-08-08 08:53:53.585440,0 days 00:00:34.625898,1.506695546047042e-06,0.6112515517337765,0.22156241177098784,0.013367265175930287,0.24474701254997955,depthwise,1.728316889352704e-06,7,11.372190385844537,0.8387007273923709,2411,COMPLETE
83,0.8110186666666667,2021-08-08 08:53:53.585893,2021-08-08 08:54:03.553833,0 days 00:00:09.967940,3.4183708431951907e-06,0.6564615341971932,0.22677608086716983,0.05142854510988567,0.9930067147066506,depthwise,2.53119444024305e-07,8,9.651296563925781,0.8059681740166008,559,COMPLETE
84,0.812086,2021-08-08 08:54:03.554292,2021-08-08 08:54:25.500447,0 days 00:00:21.946155,8.108255957566171e-06,0.5835861232566334,0.2814521078242054,0.02125761927586686,0.5805147807558098,depthwise,9.430482633730144e-07,8,12.714123218552567,0.8721773106470084,1255,COMPLETE
85,0.8111653333333333,2021-08-08 08:54:25.500895,2021-08-08 08:54:32.313710,0 days 00:00:06.812815,1.3586130075137991e-05,0.5632211377198437,0.2792856976013608,0.0759360167289076,0.5395706414722762,depthwise,7.609917418014721e-07,8,16.005250651003173,0.9215615304434261,348,COMPLETE
86,0.811734,2021-08-08 08:54:32.314153,2021-08-08 08:54:53.555295,0 days 00:00:21.241142,6.608522206210899e-05,0.6123013485060397,0.3054147345962148,0.01903301973514535,0.016624937105307134,depthwise,1.60133971744877e-08,8,7.340952396465925,0.8739428683904791,994,COMPLETE
87,0.8093863333333333,2021-08-08 08:54:53.555859,2021-08-08 08:54:57.012921,0 days 00:00:03.457062,3.162772255652597e-05,0.5390623616280054,0.36162178427894287,0.16546328363252308,0.3539799548834048,depthwise,3.707885555362497e-07,7,12.981838788969007,0.9003022921796615,142,COMPLETE
88,0.8124723333333334,2021-08-08 08:54:57.013356,2021-08-08 08:55:15.465833,0 days 00:00:18.452477,4.10758892693918e-07,0.5764144484907205,0.34322875889343785,0.02156378942407322,0.6020783978294514,depthwise,1.8508975715882706e-07,9,16.042678038429482,0.7340462776935339,844,COMPLETE
89,0.7814196666666667,2021-08-08 08:55:15.466290,2021-08-08 08:55:28.299216,0 days 00:00:12.832926,3.9481836749407436e-07,0.5779246157606661,0.3968219678983865,1.7950914794630134e-08,0.0022451806589922,depthwise,1.8323187142668188e-07,8,16.86294951544169,0.7432956070300912,406,COMPLETE
90,0.8117553333333333,2021-08-08 08:55:28.299664,2021-08-08 08:55:37.563657,0 days 00:00:09.263993,3.772507354231846e-06,0.6507544074672597,0.3392911372037274,0.04722466599322359,0.07399853607403235,depthwise,8.254884627190909e-07,9,13.378654980530555,0.7727932025091458,333,COMPLETE
91,0.812035,2021-08-08 08:55:37.564100,2021-08-08 08:56:02.219163,0 days 00:00:24.655063,6.5200233723747425e-06,0.5262441773601823,0.2771096023232025,0.019253937715909747,0.5130554178733587,depthwise,3.981873940556652e-08,9,8.891180347971,0.679355706828813,1134,COMPLETE
92,0.7849240000000001,2021-08-08 08:56:02.219614,2021-08-08 08:56:05.721390,0 days 00:00:03.501776,1.1960144500988307e-06,0.6063491061894188,0.2972492435138921,0.0035655937288480125,0.6562103087258159,depthwise,8.150430357639323e-08,9,11.442333858291985,0.8087316742839034,33,COMPLETE
93,0.8123193333333333,2021-08-08 08:56:05.721834,2021-08-08 08:56:24.159306,0 days 00:00:18.437472,9.733843762507432e-06,0.6869415739801781,0.35447268884053285,0.022649118448853398,0.1980839734479145,depthwise,2.3788506874143906e-07,9,16.13299996626126,0.7852243006945683,772,COMPLETE
94,0.8125003333333334,2021-08-08 08:56:24.159752,2021-08-08 08:56:44.379030,0 days 00:00:20.219278,7.886074785752383e-06,0.681440446888589,0.351364768941862,0.021138152164877008,0.2663648666567513,depthwise,2.042500925442997e-06,9,17.246668981944037,0.7907325643136408,881,COMPLETE
95,0.80937,2021-08-08 08:56:44.379482,2021-08-08 08:56:48.607677,0 days 00:00:04.228195,3.212352600132422e-06,0.6813773489100171,0.415052968200001,0.1210310211885611,0.00016970706177436859,depthwise,2.6589600399128235e-06,9,17.273767582116946,0.654422145501223,118,COMPLETE
96,0.812052,2021-08-08 08:56:48.608131,2021-08-08 08:57:02.415780,0 days 00:00:13.807649,1.847788473079952e-06,0.7301826989205779,0.39187437097030947,0.0291322757547711,0.30343930822859755,depthwise,2.1602738053085226e-07,9,15.072144663383158,0.734923115042761,548,COMPLETE
97,0.808281,2021-08-08 08:57:02.416237,2021-08-08 08:57:05.047762,0 days 00:00:02.631525,1.0358314599754735e-05,0.6781594894865525,0.3339956126840614,0.26356560558081155,0.18207526859687675,depthwise,4.593219233522494e-07,9,17.5750259766082,0.7856622884626538,45,COMPLETE
98,0.8122876666666666,2021-08-08 08:57:05.048210,2021-08-08 08:57:46.662797,0 days 00:00:41.614587,2.127996462295e-05,0.7575531524546784,0.5276824607682893,0.008721324337226112,0.110280931586315,depthwise,1.4974334962479648e-07,9,10.29947577716922,0.765060212841251,1477,COMPLETE
99,0.81187,2021-08-08 08:57:46.663255,2021-08-08 08:58:17.308194,0 days 00:00:30.644939,4.299403745059159e-05,0.7639808961432237,0.5359240481653367,0.011605983495354601,0.1015432875007434,depthwise,1.189823694075384e-07,9,6.773715580458292,0.762381007706555,956,COMPLETE
100,0.8121260000000001,2021-08-08 08:58:17.308649,2021-08-08 08:58:58.796947,0 days 00:00:41.488298,4.734749825938399e-06,0.7093596515427718,0.5965179389052494,0.008832291331325822,0.030656624002742678,depthwise,1.3924118693058394e-08,9,8.555491270640534,0.6911604993450016,1441,COMPLETE
101,0.812251,2021-08-08 08:58:58.797485,2021-08-08 08:59:47.647993,0 days 00:00:48.850508,1.5905792470736617e-05,0.7210068132161961,0.5564271303826955,0.007343259261360946,0.02983976926503849,depthwise,1.5809918146880245e-08,9,10.278761415229836,0.6961114150660591,1790,COMPLETE
102,0.811713,2021-08-08 08:59:47.648444,2021-08-08 08:59:57.802450,0 days 00:00:10.154006,1.8876358142218376e-05,0.7397737820373492,0.3581086282235761,0.044047133118382875,0.014024095534089065,depthwise,3.2804332658803374e-08,9,9.832543880599507,0.7314577989174337,335,COMPLETE
103,0.8126479999999999,2021-08-08 08:59:57.802902,2021-08-08 09:02:50.015830,0 days 00:02:52.212928,2.7557389961235653e-05,0.7248533910058259,0.5331367475994708,0.0020784594590961226,0.06744771792992922,depthwise,2.48897277130714e-08,9,14.771203219881508,0.65151365122254,7306,COMPLETE
104,0.8124823333333332,2021-08-08 09:02:50.016292,2021-08-08 09:04:26.979361,0 days 00:01:36.963069,6.699022410235005e-05,0.7241630204380537,0.5161413753169651,0.003364763324449721,0.05640907067697536,depthwise,2.283570355467498e-08,9,14.532022290187653,0.6026398127047999,4084,COMPLETE
