number,value,datetime_start,datetime_complete,duration,params_alpha,params_colsample_bylevel,params_colsample_bytree,params_eta,params_gamma,params_grow_policy,params_lambda,params_max_depth,params_min_child_weight,params_subsample,user_attrs_n_estimators,state
75,0.8142866666666667,2021-08-08 08:58:26.021373,2021-08-08 08:59:29.757260,0 days 00:01:03.735887,4.881374253421748e-08,0.630168131679647,0.6996915246569384,0.00619601398897456,1.854339387931661e-05,depthwise,0.004147039083352277,9,11.023551171816928,0.7912179898047158,2127,COMPLETE
76,0.8141833333333334,2021-08-08 08:59:29.757806,2021-08-08 09:04:26.644753,0 days 00:04:56.886947,1.476352687877323e-08,0.6528268613888417,0.7226116568337302,0.0010234340997783665,1.9176590054352523e-05,depthwise,0.030727216343992544,9,13.717325751758414,0.7706959345126253,10000,COMPLETE
77,0.7890186666666666,2021-08-08 09:04:26.645225,2021-08-08 09:04:31.783996,0 days 00:00:05.138771,6.432402981111534e-08,0.5711224320672136,0.6827844654518574,5.174622467009545e-06,7.6122358739354096e-06,depthwise,0.007489145402848989,8,9.592485067362595,0.7012404147760272,77,COMPLETE
78,0.8117463333333333,2021-08-08 09:04:31.784435,2021-08-08 09:05:38.342023,0 days 00:01:06.557588,3.0907551404457955e-08,0.7321743750902033,0.722714695610251,0.0074749020925394035,0.00014960201464628352,depthwise,0.0029967839986239087,4,5.248096781660378,0.8800147587982075,7274,COMPLETE
79,0.8070749999999999,2021-08-08 09:05:38.342500,2021-08-08 09:13:24.223239,0 days 00:07:45.880739,1.0097520670975357e-08,0.6674393056242163,0.7757219863083604,0.0002847936841985666,1.9844035039570622e-05,depthwise,0.009272920536696282,9,10.95757349154562,0.9950743868805543,10000,COMPLETE
