number,value,datetime_start,datetime_complete,duration,params_alpha,params_colsample_bylevel,params_colsample_bytree,params_eta,params_gamma,params_grow_policy,params_lambda,params_max_depth,params_min_child_weight,params_subsample,user_attrs_n_estimators,state
75,0.812688,2021-08-08 06:00:04.212039,2021-08-08 06:00:10.773828,0 days 00:00:06.561789,6.450516208466944e-05,0.3350890310113952,0.86588280334678,0.0510849645055585,0.00041656696608101444,lossguide,0.0024829120052819722,9,19.435376213756488,0.20353507443110577,295,COMPLETE
76,0.8145899999999999,2021-08-08 06:00:10.774272,2021-08-08 06:01:08.570145,0 days 00:00:57.795873,0.0005019252874322328,0.37649639325236395,0.7116315625067763,0.005249897811248102,5.4389853420182664e-05,lossguide,0.000641796766014207,9,8.494443132213755,0.35413924195995106,2389,COMPLETE
