number,value,datetime_start,datetime_complete,duration,params_alpha,params_colsample_bylevel,params_colsample_bytree,params_eta,params_gamma,params_grow_policy,params_lambda,params_max_depth,params_min_child_weight,params_subsample,user_attrs_n_estimators,state
0,0.7281779999999999,2021-08-08 14:29:49.769711,2021-08-08 14:29:51.603535,0 days 00:00:01.833824,0.8186496141890444,0.8428042293809628,0.32197591998104147,6.336877578971705e-07,1.629311712256681e-05,depthwise,1.5731763448325418e-05,2,0.0272245434891816,0.9856040534778718,51,COMPLETE
1,0.8051,2021-08-08 14:29:51.604013,2021-08-08 14:31:45.444327,0 days 00:01:53.840314,0.2907016726471356,0.5246201722273387,0.528217694271228,0.0007542352692798532,0.12785470762081647,lossguide,0.12043095638354372,5,0.06667975677761853,0.9681922064750805,10000,COMPLETE
2,0.6419363333333333,2021-08-08 14:31:45.444790,2021-08-08 14:31:46.830827,0 days 00:00:01.386037,7.925490573808596e-06,0.4519079646374107,0.7851980021184015,2.6378671005361588e-08,6.304730759213023e-07,depthwise,1.3462399632503312e-05,1,1.5459301968471832,0.527442277726812,40,COMPLETE
3,0.7978930000000001,2021-08-08 14:31:46.831259,2021-08-08 14:32:55.302851,0 days 00:01:08.471592,0.2541670018463738,0.5426219333273696,0.3818800840954312,0.0024824999465888355,2.1369183940679787e-07,depthwise,9.481785190418358e-06,2,12.714093371560187,0.40293231738785046,10000,COMPLETE
4,0.8102336666666666,2021-08-08 14:32:55.303337,2021-08-08 14:34:08.367292,0 days 00:01:13.063955,3.748974073841819e-06,0.4231231278032171,0.8283620973168877,0.0050883471459610445,0.009492520922760669,lossguide,2.9591857044958023e-08,4,0.028212881210279157,0.7116457962658094,8022,COMPLETE
5,0.6084546666666667,2021-08-08 14:34:08.367749,2021-08-08 14:34:09.520582,0 days 00:00:01.152833,0.05340074957592687,0.8750902461644898,0.9443128853947378,2.555188585340036e-07,1.1662168721669635e-08,depthwise,0.022941918831796675,1,0.01759212935073102,0.43602232883006026,1,COMPLETE
6,0.8128046666666666,2021-08-08 14:34:09.521081,2021-08-08 14:34:41.738017,0 days 00:00:32.216936,3.871004886175142e-07,0.3025044685444356,0.38979898353052445,0.012904189523901042,0.005419908257091663,depthwise,2.730472407484652e-07,7,3.562650202590595,0.6718836055134495,1981,COMPLETE
7,0.8115009999999999,2021-08-08 14:34:41.738455,2021-08-08 14:35:11.578328,0 days 00:00:29.839873,4.6423915118245653e-07,0.8581852231981804,0.8775813281769758,0.011424544267844542,0.00375881499759793,lossguide,0.1019082874652218,8,1.104765499834551,0.4056862543223549,858,COMPLETE
8,0.7582099999999999,2021-08-08 14:35:11.578761,2021-08-08 14:35:14.721020,0 days 00:00:03.142259,2.687881718604975e-07,0.20424674571166276,0.43186713378232133,0.00015029324508198947,0.01069788144415849,lossguide,0.9428290397682689,5,1.3501731174845764,0.20958508836112336,170,COMPLETE
9,0.80835,2021-08-08 14:35:14.721450,2021-08-08 14:35:28.643914,0 days 00:00:13.922464,1.5078100793318807e-05,0.9564109507628413,0.48712990040976384,0.01831841720683534,0.06357793265610596,depthwise,2.9375184911336802e-08,8,0.020209595316618877,0.30692774348342183,393,COMPLETE
10,0.7980816666666666,2021-08-08 14:35:28.644342,2021-08-08 14:35:31.387640,0 days 00:00:02.743298,0.001270107459946001,0.2037783476808809,0.2024603722709955,0.6450555234371087,0.00018324529259349236,depthwise,2.998162266171532e-07,9,13.321381984652833,0.7175097994758958,78,COMPLETE
11,0.8062803333333334,2021-08-08 14:35:31.388089,2021-08-08 14:35:34.829018,0 days 00:00:03.440929,1.171295515427207e-08,0.7182222455030833,0.6750800322380656,0.14231533358141701,0.00033926760479880487,lossguide,0.001766384446890251,7,0.40133837432649705,0.6562616004220444,72,COMPLETE
12,0.7785206666666666,2021-08-08 14:35:34.829453,2021-08-08 14:35:38.904908,0 days 00:00:04.075455,8.62831404861103e-08,0.6555009540890329,0.9904631734640963,1.1489573236775218e-05,0.0016278286122387417,lossguide,0.00047165237214908236,7,3.405270397834554,0.8421983682158501,71,COMPLETE
13,0.8101456666666667,2021-08-08 14:35:38.905353,2021-08-08 14:35:46.734243,0 days 00:00:07.828890,0.00040798270965458644,0.3230000813357458,0.6689148990819477,0.04292049839099142,0.7690654614035584,lossguide,1.0656246577509142e-06,7,0.24211103620010357,0.5514795372937972,346,COMPLETE
14,0.778975,2021-08-08 14:35:46.734688,2021-08-08 14:35:55.331668,0 days 00:00:08.596980,5.226099409314541e-07,0.7314865310578609,0.25806674529974744,1.9916747853609193e-05,3.277887489112361e-05,lossguide,0.0033448631601776684,9,4.187739266563343,0.4374983595885201,150,COMPLETE
15,0.7721716666666666,2021-08-08 14:35:55.332110,2021-08-08 14:36:00.345315,0 days 00:00:05.013205,2.7647313037810293e-08,0.33623713281361445,0.5690303871472646,0.00038184084931845827,0.0024527908328031253,depthwise,0.00012790102412881568,6,0.9118679775455807,0.8038628615547005,233,COMPLETE
16,0.797739,2021-08-08 14:36:00.345765,2021-08-08 14:36:02.779161,0 days 00:00:02.433396,1.4327615661471027e-06,0.8072313698483178,0.8676463314702846,0.46702212129648996,5.2878693273094305e-06,depthwise,8.173481184493709e-07,8,4.482877431198052,0.5894654342498711,13,COMPLETE
17,0.8116976666666668,2021-08-08 14:36:02.779601,2021-08-08 14:36:22.709169,0 days 00:00:19.929568,5.545693198006593e-05,0.9899660376907599,0.6743284748607659,0.015471969836300533,0.0007957241545920927,lossguide,0.9871032344580548,6,0.14759566256191387,0.3268047875622231,1163,COMPLETE
18,0.8052163333333334,2021-08-08 14:36:22.709614,2021-08-08 14:36:27.182338,0 days 00:00:04.472724,6.115890998822728e-05,0.9857709891281206,0.6646143319384679,0.07471792225020991,0.00036428544439537965,lossguide,1.3484530653260906e-07,4,0.10362888107157216,0.22507360253057096,353,COMPLETE
19,0.7784740000000001,2021-08-08 14:36:27.182804,2021-08-08 14:36:35.637563,0 days 00:00:08.454759,0.0034314252667445705,0.6116879468493941,0.7382816235354057,4.1885355008822676e-05,0.08425756603171926,depthwise,0.00010466262525518305,6,0.1601989187094862,0.33786623668300136,437,COMPLETE
20,0.8050373333333333,2021-08-08 14:36:35.638012,2021-08-08 14:38:05.345297,0 days 00:01:29.707285,4.651706471875781e-05,0.31992240476086464,0.4418148249172108,0.0014216884302275295,0.7293825349312403,depthwise,3.199551274575753e-06,4,0.4344447443993532,0.8505018750179247,10000,COMPLETE
21,0.8118599999999999,2021-08-08 14:38:05.345753,2021-08-08 14:38:34.268430,0 days 00:00:28.922677,2.5824624314838117e-07,0.9066096310912276,0.6085947072970173,0.012459872215268515,0.0025084493168239623,lossguide,0.3979933227896963,8,0.6929192025334988,0.5173081024414309,892,COMPLETE
22,0.812102,2021-08-08 14:38:34.268890,2021-08-08 14:39:15.709783,0 days 00:00:41.440893,8.550785381917779e-08,0.9389718794156534,0.5978895614360431,0.00769970540686485,0.0008085976147206162,lossguide,0.7710349466930947,6,0.059751536637968776,0.5087762954036807,2662,COMPLETE
23,0.8045656666666666,2021-08-08 14:39:15.710240,2021-08-08 14:39:18.955877,0 days 00:00:03.245637,6.674081304848407e-08,0.9176334489095559,0.5957931431800035,0.12581649105895226,0.018528540423989683,lossguide,0.017564225475788935,7,0.04786508114210149,0.48870838042640335,62,COMPLETE
24,0.8117546666666667,2021-08-08 14:39:18.956330,2021-08-08 14:40:37.061772,0 days 00:01:18.105442,1.8312070262776155e-07,0.7960337021446571,0.327274740806457,0.004209719364995806,0.00013234525655744493,lossguide,0.13210291940881308,8,0.6988913187407703,0.6372610897317403,2852,COMPLETE
25,0.7765693333333333,2021-08-08 14:40:37.062232,2021-08-08 14:40:40.977599,0 days 00:00:03.915367,2.2943675603145203e-06,0.7670519997206521,0.5216059699371751,0.00029669788830039294,0.023185220791999934,lossguide,0.014739273689045868,6,0.010329204346534386,0.7163124565235637,138,COMPLETE
26,0.8114566666666666,2021-08-08 14:40:40.978052,2021-08-08 14:40:57.912823,0 days 00:00:16.934771,4.478144018405801e-08,0.9077781075904794,0.7428938809269434,0.025246484069323102,4.347947156808596e-05,lossguide,0.3249993228049991,9,2.797814720978292,0.5018546119381785,338,COMPLETE
27,0.7831799999999999,2021-08-08 14:40:57.913281,2021-08-08 14:41:03.480381,0 days 00:00:05.567100,8.146265799606358e-07,0.6604413543965775,0.614826340479206,2.8296412356382725e-06,0.0011179424294652598,lossguide,0.003479527015768644,7,7.874786770460592,0.5929743938259956,154,COMPLETE
28,0.8059113333333333,2021-08-08 14:41:03.480836,2021-08-08 14:41:06.437619,0 days 00:00:02.956783,8.296275550157329e-06,0.43463668665606525,0.4469613154151117,0.20094462973119506,7.423862044466458e-06,depthwise,0.000511352818632712,5,0.31830308676864827,0.6499707436417915,156,COMPLETE
29,0.8082059999999999,2021-08-08 14:41:06.438068,2021-08-08 14:42:24.104979,0 days 00:01:17.666911,1.031296838060637e-08,0.8355861710411642,0.3683475536830053,0.005080247283157257,0.005272600218264627,depthwise,0.059128990259271985,3,1.9781285189082456,0.7706909621371301,10000,COMPLETE
30,0.7818883333333334,2021-08-08 14:42:24.105445,2021-08-08 14:42:29.818919,0 days 00:00:05.713474,2.0808620478052434e-07,0.9363130213193791,0.3029962143729261,9.689292730912294e-05,0.039071077826057184,lossguide,3.289528925130045e-05,8,0.7894379529403891,0.5643268966743431,100,COMPLETE
31,0.8120996666666667,2021-08-08 14:42:29.819372,2021-08-08 14:45:38.747141,0 days 00:03:08.927769,1.0365494091717051e-07,0.8173739879027975,0.34385731988097423,0.0016917838720128023,5.8778344922720355e-05,lossguide,0.27167900887250995,8,0.6473879985722341,0.6441367086439492,6811,COMPLETE
32,0.7912336666666667,2021-08-08 14:45:38.747623,2021-08-08 14:45:44.690975,0 days 00:00:05.943352,1.3378011970741267e-07,0.8792554587800219,0.3906358746600639,0.0010276881528734998,5.39113044382173e-05,lossguide,0.1750454204551315,9,0.5833173523852172,0.6295015558163654,38,COMPLETE
33,0.782779,2021-08-08 14:45:44.691399,2021-08-08 14:45:47.350404,0 days 00:00:02.659005,2.7552087469619533e-08,0.7345603438488632,0.5400581038154951,0.0009228881871428876,2.318055990985319e-06,lossguide,0.4082221012900436,7,0.056069424803106144,0.5343051652976968,29,COMPLETE
34,0.8118353333333334,2021-08-08 14:45:47.350820,2021-08-08 14:46:51.929863,0 days 00:01:04.579043,1.3915427524524774e-06,0.5484769181232989,0.24790066116338907,0.007037789584132662,0.2608532655842593,lossguide,0.025144707609523632,5,6.2260970324056055,0.4824394722524954,6473,COMPLETE
35,0.7820640000000001,2021-08-08 14:46:51.930303,2021-08-08 14:46:56.298329,0 days 00:00:04.368026,5.288502390128153e-06,0.8270137583041535,0.32913782962322086,0.002115290816368223,0.0004371840971017788,lossguide,0.055955428566973796,8,2.329493185473478,0.9654292635182452,60,COMPLETE
36,0.8109756666666667,2021-08-08 14:46:56.298753,2021-08-08 14:47:04.010572,0 days 00:00:07.711819,2.1205659579442263e-05,0.8952026292217742,0.5067661247579498,0.047729096031078194,1.2456903524067291e-05,depthwise,0.3247334878237943,6,0.26228434615886237,0.6770594137713469,430,COMPLETE
37,0.788255,2021-08-08 14:47:04.011000,2021-08-08 14:47:19.435276,0 days 00:00:15.424276,4.3269371808380965e-07,0.47029143514836313,0.6165412539563362,1.2957137372655527e-08,4.632303938608972e-07,lossguide,1.2185021010390665e-08,8,0.09890270360201962,0.603126416289332,396,COMPLETE
38,0.7828996666666667,2021-08-08 14:47:19.435704,2021-08-08 14:47:25.268547,0 days 00:00:05.832843,2.8668314192790826e-08,0.9990369349228034,0.4630126884056841,0.0004087098174807804,0.00012702655261660653,lossguide,0.007317699945231948,7,1.420383840103071,0.7635899861146108,158,COMPLETE
39,0.8106770000000001,2021-08-08 14:47:25.268987,2021-08-08 14:49:34.738769,0 days 00:02:09.469782,2.840700839145477e-06,0.3869351369955492,0.4062477550364044,0.0021339134166056726,0.005612804119311881,depthwise,9.00028474605609e-06,6,0.03148122321525099,0.4409648591306533,9769,COMPLETE
40,0.8117359999999999,2021-08-08 14:49:34.739239,2021-08-08 14:50:07.894210,0 days 00:00:33.154971,0.0002601994058631823,0.26358541808499586,0.7589066939686675,0.011490308100443748,0.0011180462344104753,lossguide,0.9930704224791437,9,0.5589507006126014,0.38958248823421254,921,COMPLETE
41,0.8117613333333332,2021-08-08 14:50:07.894643,2021-08-08 14:51:21.305586,0 days 00:01:13.410943,1.0513816160547806e-06,0.552683063052941,0.2125522962621701,0.007040971368352777,1.2381345355861061e-08,lossguide,0.043534967916064524,5,7.857249757336024,0.45852492587984645,7390,COMPLETE
42,0.811856,2021-08-08 14:51:21.306031,2021-08-08 14:51:42.883076,0 days 00:00:21.577045,9.995293358553032e-08,0.49316294130017135,0.24455040114405258,0.025389907988723148,0.009557318397753247,lossguide,0.23907444120184126,5,18.081391450358556,0.48897401038701316,2134,COMPLETE
43,0.741718,2021-08-08 14:51:42.883514,2021-08-08 14:51:45.929977,0 days 00:00:03.046463,1.05430910429912e-07,0.4935289158470465,0.26683554358235595,1.1503104506752574e-07,0.0029319409889779,lossguide,0.3549215286460609,3,18.388831403159845,0.5122300417641484,250,COMPLETE
44,0.8119836666666668,2021-08-08 14:51:45.930409,2021-08-08 14:51:56.991971,0 days 00:00:11.061562,2.723904140914028e-07,0.37516888947273364,0.34730180467395283,0.03434480453544385,0.013237204159056798,lossguide,0.13910165608562827,7,10.44020166807164,0.37383465305727653,710,COMPLETE
45,0.793276,2021-08-08 14:51:56.992448,2021-08-08 14:51:58.765042,0 days 00:00:01.772594,3.3813618009048874e-07,0.26051981760804854,0.3637396466700347,0.44717681868897885,0.17424596403425321,lossguide,0.09622928454041325,7,1.7468804949451882,0.2712084135665983,18,COMPLETE
46,0.8113706666666666,2021-08-08 14:51:58.765530,2021-08-08 14:52:06.485927,0 days 00:00:07.720397,0.6651746917597929,0.35390344693105813,0.2969647818373554,0.07095332220228215,0.0006361399386031567,depthwise,0.5151471356371919,8,11.104308255335928,0.35626985092064256,417,COMPLETE
47,0.8123543333333333,2021-08-08 14:52:06.486351,2021-08-08 14:53:36.449177,0 days 00:01:29.962826,0.015662196100010257,0.26358610273841016,0.5507831701089919,0.003978266082567123,0.016763749506207345,lossguide,1.3997328513039864e-07,8,1.128366442427347,0.6843757989732837,3704,COMPLETE
48,0.7779616666666667,2021-08-08 14:53:36.449618,2021-08-08 14:53:38.778968,0 days 00:00:02.329350,0.010851639167262792,0.26879685460286823,0.4873257745311235,0.003466805504423276,0.031973708718812104,lossguide,1.576240885270624e-07,7,1.0925831965593258,0.7305875700224254,23,COMPLETE
49,0.7701370000000001,2021-08-08 14:53:38.779401,2021-08-08 14:53:41.742429,0 days 00:00:02.963028,0.034822392003340315,0.387867475925028,0.4113210107103089,0.00010282286331140465,0.00019856255178409284,depthwise,8.58784577349426e-08,6,4.639671974428903,0.5681944341877607,102,COMPLETE
50,0.8061133333333333,2021-08-08 14:53:41.742886,2021-08-08 14:53:44.940602,0 days 00:00:03.197716,0.0013196383987182266,0.2753259501743095,0.5576429378921325,0.23899943368530305,0.007530454596350568,lossguide,5.852831169107667e-07,9,2.8968017204000653,0.8180358313525526,36,COMPLETE
51,0.811661,2021-08-08 14:53:44.941035,2021-08-08 14:53:59.135916,0 days 00:00:14.194881,0.0797413414195291,0.21616552356871332,0.641118137854938,0.024724906635094215,0.0023048524794554333,lossguide,2.0661737516864e-06,8,0.9923590731555365,0.6886552398588596,505,COMPLETE
52,0.8105026666666667,2021-08-08 14:53:59.136351,2021-08-08 14:54:27.121959,0 days 00:00:27.985608,2.049118788807718e-08,0.9532203353847797,0.5800169160870359,0.011773757159444091,0.01312496472510506,lossguide,7.425257172016193e-08,8,0.3452592540883502,0.39965945121521884,819,COMPLETE
53,0.8108703333333334,2021-08-08 14:54:27.122392,2021-08-08 14:54:35.561353,0 days 00:00:08.438961,4.796003576522639e-08,0.22673627353487202,0.7068339429926092,0.04436569540463781,0.06104676419538065,lossguide,3.297833053322959e-08,7,1.2496211729189997,0.6115733701476933,406,COMPLETE
54,0.8123723333333333,2021-08-08 14:54:35.561774,2021-08-08 14:56:29.177228,0 days 00:01:53.615454,7.181719143684384e-07,0.299266854948924,0.5426251522261585,0.0026910700036855556,0.001739015466806842,lossguide,0.5616645555901763,7,0.572457118130122,0.7489150457826348,6244,COMPLETE
55,0.7715486666666665,2021-08-08 14:56:29.177675,2021-08-08 14:56:31.484602,0 days 00:00:02.306927,6.240650415713062e-07,0.301130248926851,0.35123202334715253,0.0005631760257282652,0.00025207321238591843,lossguide,3.347879821805626e-07,7,0.1765284268055224,0.8892228084794473,23,COMPLETE
56,0.811527,2021-08-08 14:56:31.485128,2021-08-08 14:58:44.976121,0 days 00:02:13.490993,1.5480323350459473e-05,0.2984717462192184,0.4901303988748517,0.00205219189658199,2.4477139827063417e-05,lossguide,0.10538773392590185,6,0.4954748870738448,0.7434675641872275,10000,COMPLETE
57,0.7887503333333333,2021-08-08 14:58:44.976571,2021-08-08 14:58:47.458809,0 days 00:00:02.482238,6.293965077823727e-08,0.3658263736799926,0.5497628105111912,0.9561226046045663,0.0015617448379929674,depthwise,0.0008612985161686484,1,9.669255058276148,0.6905421391303209,226,COMPLETE
58,0.7675806666666668,2021-08-08 14:58:47.459240,2021-08-08 14:58:49.321096,0 days 00:00:01.861856,2.971315091264794e-07,0.22997700797083823,0.4224867031386715,0.00016547431415146218,0.017353763329477353,lossguide,0.6885407085822254,7,4.111402542914764,0.6797199858831484,9,COMPLETE
59,0.8113886666666668,2021-08-08 14:58:49.321541,2021-08-08 14:59:30.614005,0 days 00:00:41.292464,0.000354350192782235,0.4096582915924955,0.5247971379910027,0.007184178917492054,7.015544786005257e-05,lossguide,0.009997691097591398,6,0.21388137686076583,0.7869378604487389,2916,COMPLETE
60,0.811262,2021-08-08 14:59:30.614450,2021-08-08 14:59:34.786606,0 days 00:00:04.172156,4.875704238422692e-06,0.333723431355537,0.45490790227429984,0.11700382149781971,0.0006659450777265008,depthwise,3.363576272651265e-05,7,6.374793491796578,0.8656837239446649,168,COMPLETE
61,0.8114536666666666,2021-08-08 14:59:34.787031,2021-08-08 14:59:53.918313,0 days 00:00:19.131282,2.3641981678785617e-07,0.9307931599379629,0.6390219789845956,0.01791474968627477,0.0037956654940081444,lossguide,0.04053519848713923,8,0.8141389964544626,0.535572218721632,541,COMPLETE
62,0.8118230000000001,2021-08-08 14:59:53.918750,2021-08-08 15:01:31.042968,0 days 00:01:37.124218,6.187326853654787e-07,0.8570509033782843,0.6977919269996883,0.003288912414992344,0.0018594877552594036,lossguide,0.22281437409867347,8,0.6022148827201446,0.646910170548051,2996,COMPLETE
63,0.7875256666666667,2021-08-08 15:01:31.043425,2021-08-08 15:01:37.246561,0 days 00:00:06.203136,1.773771379071205e-06,0.29769958895868953,0.5890951496318829,0.0012160502138196681,0.004501408689791902,lossguide,0.6830972409711851,8,0.3686889417209558,0.5794553178934356,128,COMPLETE
64,0.8120046666666667,2021-08-08 15:01:37.246995,2021-08-08 15:02:27.233514,0 days 00:00:49.986519,1.116049363532436e-07,0.9713539978289087,0.6394338925124653,0.00835247279128857,0.047244897112987086,lossguide,0.12366919670851627,9,1.5370273086327846,0.6157750231031207,1010,COMPLETE
65,0.8120693333333334,2021-08-08 15:02:27.233950,2021-08-08 15:03:46.730522,0 days 00:01:19.496572,1.4517854850402093e-07,0.9672675205397029,0.7897821737561522,0.005111564890913706,0.09521791896471728,lossguide,0.0942125469784114,9,1.9530256001634136,0.6250823806258002,1606,COMPLETE
66,0.8118763333333333,2021-08-08 15:03:46.730967,2021-08-08 15:12:10.947195,0 days 00:08:24.216228,1.5026138654766374e-08,0.9618309398900434,0.8228459993347667,0.0006796584867046323,0.12329962945500167,lossguide,0.00022744688516876523,9,2.186814579939913,0.6706008321758751,10000,COMPLETE
67,0.7922593333333333,2021-08-08 15:12:10.947671,2021-08-08 15:12:23.156015,0 days 00:00:12.208344,1.1616545719554728e-07,0.9612150435691975,0.8778588351892918,0.0002133332825339996,0.038885573184684934,lossguide,0.028352738800193455,9,1.6105817642515319,0.6274657603073142,117,COMPLETE
68,0.8125673333333333,2021-08-08 15:12:23.156451,2021-08-08 15:13:26.611945,0 days 00:01:03.455494,4.297481169836082e-08,0.6633655281077969,0.8016694691880376,0.005660420558665867,0.4311734758945923,lossguide,0.09686789690769286,9,2.8984795488679973,0.7102673607957363,1562,COMPLETE
69,0.8122386666666667,2021-08-08 15:13:26.612394,2021-08-08 15:17:01.428776,0 days 00:03:34.816382,2.7569195252098452e-08,0.6379832193884465,0.9488600968556066,0.0016535367342347131,0.8918574592059549,depthwise,0.08590157088695065,9,2.5342158792165157,0.7092767866548455,5267,COMPLETE
70,0.8121566666666666,2021-08-08 15:17:01.429234,2021-08-08 15:20:42.899576,0 days 00:03:41.470342,3.827518727671193e-08,0.6696422345011058,0.9692957437818582,0.001646350037413619,0.8619555768127775,depthwise,1.2608534023785752e-08,9,2.787664553048694,0.7467431258234134,5316,COMPLETE
71,0.8122780000000001,2021-08-08 15:20:42.900045,2021-08-08 15:25:22.992506,0 days 00:04:40.092461,3.792447918813257e-08,0.6686955455454817,0.9957682798516746,0.0013055046696931315,0.8714877745366251,depthwise,2.2235605245564954e-08,9,3.46084161947248,0.759070321724248,6796,COMPLETE
72,0.8122516666666666,2021-08-08 15:25:22.992983,2021-08-08 15:27:26.746448,0 days 00:02:03.753465,3.197642122738842e-08,0.657532133928538,0.9914127935422535,0.0029658689961177213,0.4700769537873875,depthwise,1.4867151974818803e-08,9,3.2271726889365877,0.752624733999263,2906,COMPLETE
73,0.8110493333333334,2021-08-08 15:27:26.746900,2021-08-08 15:35:14.838215,0 days 00:07:48.091315,3.817746984373333e-08,0.6513357229839168,0.9886681955421847,0.000519575081768888,0.5037789551630617,depthwise,1.609159934981522e-08,9,3.3868335090897177,0.749329663535815,10000,COMPLETE
