number,value,datetime_start,datetime_complete,duration,params_alpha,params_colsample_bylevel,params_colsample_bytree,params_eta,params_gamma,params_grow_policy,params_lambda,params_max_depth,params_min_child_weight,params_subsample,user_attrs_n_estimators,state
75,0.8089766666666667,2021-08-08 17:29:28.581857,2021-08-08 17:29:46.458546,0 days 00:00:17.876689,0.0005550823675462503,0.26158699678474107,0.41306783261684865,0.02236682646198253,0.02100219707566208,depthwise,0.0001597572519476257,7,2.3724864648860056,0.5605435815949751,1055,COMPLETE
76,0.8101833333333334,2021-08-08 17:29:46.458994,2021-08-08 17:30:29.908235,0 days 00:00:43.449241,4.769869238576087e-05,0.27915465713644005,0.3775411290814533,0.01103010358581492,0.28165720575857583,depthwise,4.997559730868524e-05,6,14.0996980432311,0.4696631320094476,3838,COMPLETE
77,0.8094753333333333,2021-08-08 17:30:29.908694,2021-08-08 17:31:04.694328,0 days 00:00:34.785634,8.697987989823527e-06,0.281999573718437,0.34124909845940216,0.011692524780838874,0.2818234288751155,depthwise,0.0003440630091567205,6,19.92979789583298,0.38649726300563647,3149,COMPLETE
78,0.8056606666666667,2021-08-08 17:31:04.694780,2021-08-08 17:31:07.821024,0 days 00:00:03.126244,3.550666736581663e-05,0.2756893830589476,0.39507928996280745,0.15706659647820576,0.08402723087168602,depthwise,4.5943255075576245e-05,7,4.976326719760422,0.4698755947303875,117,COMPLETE
79,0.8081010000000001,2021-08-08 17:31:07.821464,2021-08-08 17:31:14.574833,0 days 00:00:06.753369,5.605871560788585e-05,0.22343730669694323,0.37473822668352536,0.10242219116345755,0.029131924848061645,depthwise,0.0007440213599867811,7,13.313060562601036,0.4379446352547309,432,COMPLETE
80,0.802984,2021-08-08 17:31:14.575271,2021-08-08 17:31:17.042286,0 days 00:00:02.467015,2.0305105027781844e-05,0.25629349484413394,0.30303140997056566,0.2800488923603636,0.9968677440850702,depthwise,7.957379820424007e-06,6,5.238858190583276,0.5356512242625844,106,COMPLETE
81,0.8100433333333333,2021-08-08 17:31:17.042734,2021-08-08 17:32:04.237213,0 days 00:00:47.194479,1.5274043593467052e-05,0.2852691560486845,0.33694422317552547,0.010867740116805571,0.2536173290950846,depthwise,0.0003943897809742678,6,12.633373282164303,0.3593231331353739,4309,COMPLETE
82,0.809953,2021-08-08 17:32:04.237676,2021-08-08 17:32:25.725109,0 days 00:00:21.487433,0.001002605744840901,0.31695664939255175,0.37676043117988617,0.02003116914824643,0.543506577940451,depthwise,4.0514578131367995e-06,6,12.780952991246346,0.568555461233931,1798,COMPLETE
83,0.7707419999999999,2021-08-08 17:32:25.725566,2021-08-08 17:32:28.580356,0 days 00:00:02.854790,0.0011532034601944205,0.3226026477424399,0.3800215169435519,2.663256733128996e-06,0.5862785621162,depthwise,8.334868165652766e-07,7,13.23153288219426,0.3534821179450212,78,COMPLETE
84,0.8098786666666666,2021-08-08 17:32:28.580890,2021-08-08 17:32:56.285670,0 days 00:00:27.704780,0.0004262128179708582,0.2905250979634118,0.4508357845214382,0.014716545430449585,0.06132572515621331,depthwise,4.656952889725079e-06,6,8.232486525629032,0.5838399203217156,2253,COMPLETE
85,0.809538,2021-08-08 17:32:56.286134,2021-08-08 17:33:30.928069,0 days 00:00:34.641935,0.00040893786576866293,0.2882737381750274,0.33215560092496543,0.013217653073117844,0.09601973060272646,depthwise,6.871451832401992e-06,6,8.850335114577963,0.34481983546691447,3046,COMPLETE
86,0.809573,2021-08-08 17:33:30.928521,2021-08-08 17:34:33.710165,0 days 00:01:02.781644,0.004619956088697106,0.3482116424517585,0.2684079825362925,0.008488190408065375,0.06386308715825895,depthwise,1.2964247229037438e-05,5,16.089731191850863,0.586207477380202,6404,COMPLETE
87,0.8090233333333333,2021-08-08 17:34:33.710627,2021-08-08 17:34:41.867652,0 days 00:00:08.157025,1.04818657505749e-05,0.30625382985828337,0.3633975763129535,0.05804679094604154,0.004339986424518669,depthwise,4.842094331148961e-06,6,6.000183175873006,0.5752889407822769,580,COMPLETE
88,0.7953756666666667,2021-08-08 17:34:41.868106,2021-08-08 17:34:43.885519,0 days 00:00:02.017413,4.379599332569612e-06,0.2657167738019862,0.3087174804961906,0.7311953824128531,0.29420315353377463,depthwise,2.1953724514049915e-05,5,12.231338069537092,0.6070475444531703,74,COMPLETE
89,0.8100056666666666,2021-08-08 17:34:43.885958,2021-08-08 17:36:00.225211,0 days 00:01:16.339253,0.001386217587593169,0.340010367927612,0.45649942100647367,0.004464008592081175,0.04318068824045873,depthwise,6.255878852323391e-05,6,8.451148021598124,0.48017361767204353,6416,COMPLETE
