number,value,datetime_start,datetime_complete,duration,params_alpha,params_colsample_bylevel,params_colsample_bytree,params_eta,params_gamma,params_grow_policy,params_lambda,params_max_depth,params_min_child_weight,params_subsample,user_attrs_n_estimators,state
75,0.8115649999999999,2021-08-08 06:59:17.874960,2021-08-08 06:59:46.665721,0 days 00:00:28.790761,0.007072092012213304,0.22827678322634223,0.6448806029520259,0.013065398554701192,1.0059211303780808e-08,lossguide,6.999387346238529e-07,8,9.276902419511574,0.7618394689743084,1457,COMPLETE
76,0.8120726666666668,2021-08-08 06:59:46.666166,2021-08-08 07:03:40.569898,0 days 00:03:53.903732,0.07639359612101362,0.3977762253872179,0.5851073340043871,0.0013544627364684874,4.327113748527039e-08,lossguide,1.002952044114881e-07,9,14.415790386952297,0.7294982040138227,10000,COMPLETE
