number,value,datetime_start,datetime_complete,duration,params_alpha,params_colsample_bylevel,params_colsample_bytree,params_eta,params_gamma,params_grow_policy,params_lambda,params_max_depth,params_min_child_weight,params_subsample,user_attrs_n_estimators,state
75,0.6409929999999999,2021-08-08 18:10:33.615925,2021-08-08 18:10:36.259902,0 days 00:00:02.643977,0.00010907689145830298,0.5438530251921407,0.7345495150072932,0.0007179918546364993,6.668102650629171e-08,lossguide,1.8227258491231635e-07,1,7.432627942484281,0.5037043849943826,310,COMPLETE
76,0.8119216666666667,2021-08-08 18:10:36.260335,2021-08-08 18:12:58.793810,0 days 00:02:22.533475,0.18230027467559345,0.3053662327366097,0.618750153783497,0.002415501628251755,9.411597733574289e-08,lossguide,6.391180689425921e-06,9,11.405022912343435,0.573098781104775,6562,COMPLETE
77,0.811813,2021-08-08 18:12:58.794260,2021-08-08 18:15:55.000956,0 days 00:02:56.206696,0.1580239060251319,0.2927434100493554,0.6168608045881114,0.0018141886887694178,1.4988214188029407e-08,lossguide,6.8382892638205834e-06,9,11.56366042461499,0.5390041672838122,8237,COMPLETE
