number,value,datetime_start,datetime_complete,duration,params_alpha,params_colsample_bylevel,params_colsample_bytree,params_eta,params_gamma,params_grow_policy,params_lambda,params_max_depth,params_min_child_weight,params_subsample,user_attrs_n_estimators,state
75,0.8121156666666667,2021-08-08 11:04:21.922963,2021-08-08 11:05:22.263237,0 days 00:01:00.340274,5.787733633830613e-05,0.3702050608835097,0.6742047596977094,0.005859386533207673,0.11626265814215424,depthwise,2.2819933140325904e-08,9,8.16178467696392,0.8003013476598126,2313,COMPLETE
