number,value,datetime_start,datetime_complete,duration,params_alpha,params_colsample_bylevel,params_colsample_bytree,params_eta,params_gamma,params_grow_policy,params_lambda,params_max_depth,params_min_child_weight,params_subsample,user_attrs_n_estimators,state
75,0.8136823333333334,2021-08-08 14:24:35.612013,2021-08-08 14:29:48.567774,0 days 00:05:12.955761,1.667965685984764e-08,0.9942748147171603,0.5984126726779619,0.0008501685705066728,0.06902164584303329,depthwise,4.81230262841547e-07,9,11.441783812619235,0.5600825696684184,10000,COMPLETE
