number,value,datetime_start,datetime_complete,duration,params_alpha,params_colsample_bylevel,params_colsample_bytree,params_eta,params_gamma,params_grow_policy,params_lambda,params_max_depth,params_min_child_weight,params_subsample,user_attrs_n_estimators,state
0,0.781403,2021-08-08 10:17:02.057531,2021-08-08 10:17:05.127985,0 days 00:00:03.070454,3.3049265172746454e-05,0.503376840751028,0.40419478433818734,0.5968664088064628,0.2187331272945329,depthwise,0.001128760642717674,9,0.3035595539539793,0.6062568099063552,10,COMPLETE
1,0.7772386666666667,2021-08-08 10:17:05.128457,2021-08-08 10:17:08.014257,0 days 00:00:02.885800,0.00021993541327249976,0.7592708088170597,0.7316415652278792,0.0002013155209516969,0.030651829077437458,depthwise,0.10281667998408933,6,0.0460014479473458,0.607185089190484,75,COMPLETE
2,0.7485753333333333,2021-08-08 10:17:08.014703,2021-08-08 10:17:09.872996,0 days 00:00:01.858293,0.024128214442884315,0.8770579781015453,0.786382958600335,0.0003167129620502737,0.06636138111236906,depthwise,0.6508900446592872,3,0.8474969429971441,0.4153392981943673,73,COMPLETE
3,0.8128043333333334,2021-08-08 10:17:09.873445,2021-08-08 10:23:29.070069,0 days 00:06:19.196624,0.34679721753730197,0.8995069687181276,0.9796737305134882,0.0006136345832281474,0.0009875836635910998,lossguide,3.588612150442733e-05,9,5.665559159858386,0.32648416193219393,10000,COMPLETE
4,0.7799353333333334,2021-08-08 10:23:29.070522,2021-08-08 10:23:38.667020,0 days 00:00:09.596498,3.463646828921644e-08,0.7544049125902041,0.25745297791693766,3.7068850970785596e-05,0.043346091699517336,lossguide,7.360450345655997e-08,9,0.031015593377705736,0.39284759272053765,153,COMPLETE
5,0.8136376666666667,2021-08-08 10:23:38.667452,2021-08-08 10:24:00.769631,0 days 00:00:22.102179,4.766209135718816e-06,0.4972443898115464,0.6741667711874559,0.01797707797130924,0.0023441165341614085,depthwise,5.601177008108536e-05,9,9.201521783700114,0.39238603204917655,820,COMPLETE
6,0.7696523333333333,2021-08-08 10:24:00.770034,2021-08-08 10:24:03.304776,0 days 00:00:02.534742,0.007178268163920902,0.9847340247031866,0.79998104411821,0.0001049905097509026,0.5633845632286298,lossguide,0.537013994848692,5,0.7739155785965723,0.24114739690111842,96,COMPLETE
7,0.8089270000000001,2021-08-08 10:24:03.305176,2021-08-08 10:26:53.965291,0 days 00:02:50.660115,0.6942086165595671,0.9868754967114086,0.7314344786712017,0.0008471251380264575,2.7658664045650945e-08,depthwise,1.0008897231238934e-05,6,0.03073839251973107,0.978758948408019,10000,COMPLETE
8,0.7318413333333335,2021-08-08 10:26:53.965727,2021-08-08 10:26:55.824571,0 days 00:00:01.858844,0.0038868424687187636,0.6889517756608494,0.238262299725592,1.4246688633989046e-06,0.01973980533246156,depthwise,1.371008446177381e-06,2,0.5123772605644643,0.34683907894443633,109,COMPLETE
9,0.6787296666666668,2021-08-08 10:26:55.825071,2021-08-08 10:26:57.483980,0 days 00:00:01.658909,0.008868588043273342,0.24974344713424135,0.44830472837691726,1.0375236662197134e-08,1.159184620424097e-06,lossguide,0.49999810750742435,1,0.41154426821165463,0.7048329649931624,101,COMPLETE
10,0.8099703333333333,2021-08-08 10:26:57.484383,2021-08-08 10:26:59.998700,0 days 00:00:02.514317,5.273094005387904e-07,0.4765619609790275,0.5588499701994923,0.3190209051781366,2.663200422788909e-05,depthwise,0.0026485688940699934,7,19.07067694079358,0.9344275252456141,75,COMPLETE
11,0.813514,2021-08-08 10:26:59.999136,2021-08-08 10:27:45.708038,0 days 00:00:45.708902,4.146658683438129e-06,0.3195421293932848,0.9718114012593616,0.007094780662478213,0.0005181651183322977,lossguide,6.86724076140323e-05,8,18.10460705992603,0.20566743808002985,2788,COMPLETE
12,0.8133900000000001,2021-08-08 10:27:45.708465,2021-08-08 10:28:04.617888,0 days 00:00:18.909423,3.73717117893304e-06,0.24896761805310363,0.962451350241236,0.021176027587113296,0.0009047416098080415,lossguide,0.0007510065366700994,8,16.81166707739219,0.21199897077246185,1197,COMPLETE
13,0.8129606666666667,2021-08-08 10:28:04.618303,2021-08-08 10:28:25.435415,0 days 00:00:20.817112,3.996074543190639e-07,0.3813549541133465,0.8876125241476135,0.015537804491902856,3.8142124400483026e-05,lossguide,1.7641169399661674e-06,7,3.5786969115710363,0.4977710818057296,1065,COMPLETE
14,0.811438,2021-08-08 10:28:25.435834,2021-08-08 10:28:55.167629,0 days 00:00:29.731795,5.2136679977019925e-05,0.43320182617628905,0.6336871918056328,0.014622252278038966,0.0008189766804334603,lossguide,0.00015992574212454958,4,3.926527565175926,0.5024351719964719,3362,COMPLETE
15,0.8095656666666667,2021-08-08 10:28:55.168057,2021-08-08 10:29:00.419552,0 days 00:00:05.251495,1.65951540794208e-08,0.5750126265337117,0.5562677683803485,0.08250206885845408,2.197847481684829e-06,depthwise,0.01979872853883039,8,7.54844952276901,0.2624190160301198,192,COMPLETE
16,0.7892156666666666,2021-08-08 10:29:00.419965,2021-08-08 10:29:06.229662,0 days 00:00:05.809697,3.937113453955501e-06,0.3404919765768173,0.867627511264359,3.994602726547154e-06,0.0018812424281153186,depthwise,4.218081016644842e-08,8,1.7621998550282614,0.47526864324349555,112,COMPLETE
17,0.8116923333333333,2021-08-08 10:29:06.230094,2021-08-08 10:31:01.632380,0 days 00:01:55.402286,0.0003248607914044357,0.5889631321491033,0.6504717525501469,0.0027920308130691433,5.595761663497292e-06,lossguide,2.452471051926507e-06,7,0.14608294563562,0.832871320026107,5144,COMPLETE
18,0.810083,2021-08-08 10:31:01.632924,2021-08-08 10:32:39.050401,0 days 00:01:37.417477,3.3426456363008415e-06,0.2911270154777074,0.39333166387940466,0.002363879127656476,0.00014181259854081433,lossguide,8.595792654503384e-05,5,11.499498674928658,0.3113459977154721,10000,COMPLETE
19,0.7939306666666667,2021-08-08 10:32:39.050850,2021-08-08 10:32:55.780348,0 days 00:00:16.729498,1.7904882498973084e-07,0.382676770138964,0.8994278986233629,1.0281066199601797e-05,0.0045345113276523815,depthwise,2.1246466117138894e-07,9,0.010312562864225374,0.20885541755709303,297,COMPLETE
20,0.765803,2021-08-08 10:32:55.780765,2021-08-08 10:32:57.791290,0 days 00:00:02.010525,1.8669587794256638e-05,0.2113937939030321,0.4918329858494159,1.1843878299693234e-07,1.539675099679149e-07,depthwise,0.005011009537841849,6,2.7636299826030837,0.6856379500030777,39,COMPLETE
21,0.8118023333333334,2021-08-08 10:32:57.791738,2021-08-08 10:33:07.178933,0 days 00:00:09.387195,4.202436296912051e-06,0.33550989556283234,0.9805130652761355,0.04392682267541767,0.0003839302138266315,lossguide,0.00038579975438447826,8,19.253168553248553,0.20391643448890515,505,COMPLETE
22,0.8138883333333333,2021-08-08 10:33:07.179347,2021-08-08 10:33:44.525387,0 days 00:00:37.346040,9.400345042480739e-07,0.2105842794148097,0.9961287014897648,0.008251018679730746,0.00693108346426663,lossguide,2.2523121405375158e-05,8,9.855035946396638,0.29122229470491884,2140,COMPLETE
23,0.8138326666666668,2021-08-08 10:33:44.525815,2021-08-08 10:34:56.093434,0 days 00:01:11.567619,1.2640565468766215e-07,0.5126442682994555,0.8124873092484467,0.004144724802314351,0.008520593464844002,lossguide,1.0188828185522174e-05,7,7.500188279994855,0.41915594291231884,4159,COMPLETE
24,0.8063333333333332,2021-08-08 10:34:56.093873,2021-08-08 10:34:59.091134,0 days 00:00:02.997261,1.2273884695770786e-07,0.5204615347077012,0.7295273762387263,0.143676075053115,0.012149129300400656,lossguide,9.916741540765268e-06,7,1.4531696579337376,0.4282665888683624,60,COMPLETE
25,0.814063,2021-08-08 10:34:59.091557,2021-08-08 10:37:17.533006,0 days 00:02:18.441449,6.212105411930989e-07,0.6718734051623829,0.7831192866893006,0.002572332027268396,0.0052969164746657985,lossguide,1.7490627044931268e-05,9,8.222422348834739,0.5653449245282453,4501,COMPLETE
26,0.8132446666666667,2021-08-08 10:37:17.533482,2021-08-08 10:39:05.483394,0 days 00:01:47.949912,7.073248394609407e-08,0.6931300859114292,0.8534295318655745,0.0027310733421278977,0.17353670244084682,lossguide,3.508859994026726e-07,6,5.87077153731002,0.5289974203138288,7671,COMPLETE
27,0.7813776666666667,2021-08-08 10:39:05.483840,2021-08-08 10:39:07.952266,0 days 00:00:02.468426,6.745922393420653e-07,0.6855088976865731,0.8086782611348459,5.192956942242336e-05,0.005820088039193413,lossguide,1.3268436676907432e-08,7,2.0446127391271984,0.7196698571598448,19,COMPLETE
28,0.8133716666666667,2021-08-08 10:39:07.952784,2021-08-08 10:43:29.646634,0 days 00:04:21.693850,2.0545787373180686e-08,0.6322694809105264,0.9412518649148877,0.001031673843189845,0.0001348486328390965,lossguide,5.463864803094216e-06,8,5.143671744316157,0.550900470759532,10000,COMPLETE
29,0.7967656666666666,2021-08-08 10:43:29.647073,2021-08-08 10:43:34.219459,0 days 00:00:04.572386,9.191332715644058e-07,0.8070007878534422,0.9141808971166339,0.20315739032880256,0.13405857541784108,lossguide,1.8167310039472856e-05,9,0.13476292385424582,0.6346720900500045,23,COMPLETE
30,0.8121503333333333,2021-08-08 10:43:34.219892,2021-08-08 10:44:43.506982,0 days 00:01:09.287090,1.7789004273417905e-05,0.5525703700508178,0.834000902646433,0.00615098557738053,0.5780048846813052,lossguide,0.00028573294123126114,4,11.117437852281563,0.45453323277180935,7820,COMPLETE
31,0.785141,2021-08-08 10:44:43.507428,2021-08-08 10:44:45.445351,0 days 00:00:01.937923,1.698791720039915e-06,0.4713926742215752,0.6839286681101886,0.8434031981807617,0.004232936133224413,lossguide,2.8812227225215777e-05,9,8.975644558240377,0.3729372958588302,5,COMPLETE
32,0.8140223333333333,2021-08-08 10:44:45.445861,2021-08-08 10:45:37.045224,0 days 00:00:51.599363,1.4768267040052944e-07,0.6548577444597773,0.7503774934844712,0.006454128910327166,0.011706297422516377,depthwise,4.555883634305464e-06,9,9.817286593455718,0.28020780493173436,2124,COMPLETE
33,0.8035359999999999,2021-08-08 10:45:37.045657,2021-08-08 10:50:43.898950,0 days 00:05:06.853293,1.8259490693354104e-07,0.6367648610932709,0.7560155667690593,0.0001989564423503631,0.015132439521375718,depthwise,4.414153314542907e-07,8,3.4112479095468253,0.29381566106349605,10000,COMPLETE
34,0.7933479999999999,2021-08-08 10:50:43.899415,2021-08-08 10:50:49.850977,0 days 00:00:05.951562,6.003689859418204e-08,0.7797534779478774,0.7709728745848765,0.0004675863996594668,0.06552336429123724,lossguide,3.738751481239248e-06,9,6.536887031117027,0.5717691278437718,42,COMPLETE
35,0.8078313333333332,2021-08-08 10:50:49.851400,2021-08-08 10:50:57.017400,0 days 00:00:07.166000,1.1991238665505948e-08,0.7292979119649227,0.7157482668137073,0.0554627939637831,0.041114025797448175,lossguide,9.238512678407355e-07,9,1.3136741240004417,0.29790808972383237,120,COMPLETE
36,0.813923,2021-08-08 10:50:57.017840,2021-08-08 10:51:50.960731,0 days 00:00:53.942891,0.00031111397130063,0.8255951012121419,0.5930355337696963,0.0057075119931150504,0.013467834392907246,depthwise,2.1408488706598138e-05,8,12.701908043922668,0.33529862618716644,2746,COMPLETE
37,0.8140723333333333,2021-08-08 10:51:50.961171,2021-08-08 10:56:49.305015,0 days 00:04:58.343844,0.00044256476682597533,0.8440716882547958,0.6023921941499608,0.001216869464934443,0.13202269979220416,depthwise,2.804205025564863e-05,9,10.839605859142909,0.79590523865011,10000,COMPLETE
38,0.8141806666666667,2021-08-08 10:56:49.305466,2021-08-08 11:01:17.377682,0 days 00:04:28.072216,0.00048685788504092807,0.8588642862590093,0.6039612019709816,0.0013147013406210534,0.9008712809379861,depthwise,0.00015025534666066373,9,13.219706327569254,0.8209024919433252,9644,COMPLETE
39,0.7875073333333334,2021-08-08 11:01:17.378127,2021-08-08 11:01:27.128793,0 days 00:00:09.750666,0.000940026346322986,0.9147882506913452,0.3639371753168633,0.00019723323367758908,0.6781743782875109,depthwise,0.00255665703687048,9,4.911219334087524,0.8043029203325678,138,COMPLETE
40,0.8116296666666667,2021-08-08 11:01:27.129219,2021-08-08 11:08:06.153785,0 days 00:06:39.024566,0.0016654092073574572,0.8769415349529831,0.5117846534524031,0.0008861361710049204,0.21712985601532195,depthwise,0.000425880527593999,9,0.8546578252676993,0.8107445049056317,8480,COMPLETE
41,0.814016,2021-08-08 11:08:06.154242,2021-08-08 11:12:39.637968,0 days 00:04:33.483726,0.000150030148928151,0.9308825356040681,0.5939888656955384,0.0013753227756833106,0.09887447963541215,depthwise,0.0001415055227034003,9,13.514167778868126,0.8813554025823023,9274,COMPLETE
42,0.813832,2021-08-08 11:12:39.638427,2021-08-08 11:16:50.065798,0 days 00:04:10.427371,0.08193085018768455,0.9467771770242933,0.6233022557779089,0.0013641153411472781,0.10162534748695108,depthwise,9.74969777028868e-05,9,13.199167611804246,0.8742985082373063,8069,COMPLETE
43,0.7936946666666667,2021-08-08 11:16:50.066270,2021-08-08 11:16:59.270778,0 days 00:00:09.204508,0.00010893192280928803,0.8653649576377026,0.5885021976031427,8.812119524095394e-05,0.37861314859268824,depthwise,0.00017441954984510314,9,2.4390778255775625,0.9198509967326964,97,COMPLETE
44,0.8099586666666667,2021-08-08 11:16:59.271206,2021-08-08 11:23:49.408867,0 days 00:06:50.137661,0.0009189442598879163,0.9377140131864079,0.676128160031846,0.0003942590670709548,0.037801644366832796,depthwise,0.0009312875598833875,9,14.653476624973168,0.7443463613007295,10000,COMPLETE
