number,value,datetime_start,datetime_complete,duration,params_alpha,params_colsample_bylevel,params_colsample_bytree,params_eta,params_gamma,params_grow_policy,params_lambda,params_max_depth,params_min_child_weight,params_subsample,user_attrs_n_estimators,state
0,0.8091616666666667,2021-08-08 15:35:16.009820,2021-08-08 15:35:27.579425,0 days 00:00:11.569605,0.004286693697258464,0.5843347676927422,0.6031692318069763,0.022098980424800747,0.04074282701289914,depthwise,3.560759665507877e-08,5,0.49357836422040396,0.2840065402006947,926,COMPLETE
1,0.7886646666666666,2021-08-08 15:35:27.579936,2021-08-08 15:35:37.972553,0 days 00:00:10.392617,0.004701060419745529,0.48127579739252146,0.6539064642367198,1.108577443109616e-08,0.0001434307314365029,depthwise,0.5657558238309911,8,6.4341937458149046,0.4407701264568787,266,COMPLETE
2,0.7451583333333334,2021-08-08 15:35:37.973069,2021-08-08 15:35:39.998091,0 days 00:00:02.025022,0.00028901420613410873,0.4947225392070908,0.404090437080971,0.0019191643132982282,3.600057160460549e-07,depthwise,0.00012142347463236511,3,0.029426378101208222,0.7848157039325259,99,COMPLETE
3,0.789714,2021-08-08 15:35:39.998540,2021-08-08 15:35:42.624940,0 days 00:00:02.626400,0.004021223186159189,0.3529990391942371,0.9958143438253828,0.6775733833900744,0.07150550382725195,lossguide,1.7202095346309023e-05,1,18.970367943641328,0.7116866150268584,234,COMPLETE
4,0.8077696666666666,2021-08-08 15:35:42.625377,2021-08-08 15:35:50.854191,0 days 00:00:08.228814,4.7173757730131615e-07,0.20811149991789402,0.5354601691134777,0.07311052550002331,6.393076643444183e-07,lossguide,1.2379465697207199e-06,9,0.015607395407702972,0.7357890035284622,124,COMPLETE
5,0.7748626666666668,2021-08-08 15:35:50.854621,2021-08-08 15:35:52.739198,0 days 00:00:01.884577,1.867166755131553e-05,0.4588316540468729,0.5409069150688498,0.0005794074056185525,0.001649254228752293,lossguide,0.23029259706429403,6,2.912316858961584,0.5191984382364216,19,COMPLETE
6,0.8086686666666667,2021-08-08 15:35:52.739650,2021-08-08 15:36:06.960762,0 days 00:00:14.221112,6.965787860798039e-07,0.9935094030460969,0.34670537657310235,0.02837640802327095,1.394681539992987e-06,lossguide,1.013336800641153e-05,8,0.02459821766958634,0.4024337580165307,354,COMPLETE
7,0.7419669999999999,2021-08-08 15:36:06.961189,2021-08-08 15:36:10.649865,0 days 00:00:03.688676,0.005881268126525473,0.23232104405812218,0.3478328239207056,3.141728547442288e-07,1.3344802330113033e-05,lossguide,1.1794954962403168e-07,2,0.22693127510575647,0.8251702748397214,356,COMPLETE
8,0.775562,2021-08-08 15:36:10.650313,2021-08-08 15:36:17.067388,0 days 00:00:06.417075,0.0002094961850700042,0.7771782153749409,0.23330619297776176,6.421527865597676e-05,9.289534276889335e-07,depthwise,0.042717381807248225,8,0.7794567900501103,0.3688384834363693,142,COMPLETE
9,0.78608,2021-08-08 15:36:17.067833,2021-08-08 15:37:27.011728,0 days 00:01:09.943895,1.0217001563988349e-07,0.23940529202789662,0.9500590360888437,0.0007668538515822058,0.08846350012028426,lossguide,0.10206900187384874,2,0.013051536126867101,0.4595238507850059,10000,COMPLETE
10,0.7713586666666666,2021-08-08 15:37:27.012173,2021-08-08 15:37:32.163876,0 days 00:00:05.151703,0.46636348343223505,0.6885247958819984,0.7648351031633361,5.19199317210089e-05,0.824550215617929,depthwise,1.0114834015138143e-08,5,0.19287464272346394,0.22499349301481114,320,COMPLETE
11,0.8073133333333334,2021-08-08 15:37:32.164318,2021-08-08 15:37:39.374407,0 days 00:00:07.210089,2.9462037515585805e-06,0.917090952361464,0.7557880924336048,0.03522265704783905,2.3080515638971848e-08,depthwise,0.0007926967111618209,5,0.07204385462252592,0.24786968585547378,506,COMPLETE
12,0.810709,2021-08-08 15:37:39.374873,2021-08-08 15:37:53.564840,0 days 00:00:14.189967,1.5467246872989853e-08,0.9648380810649348,0.42793487837353567,0.021427982226226727,0.0004955811495520378,lossguide,2.2703787686541415e-06,6,0.8451582628211448,0.3423040724064146,877,COMPLETE
13,0.7940459999999999,2021-08-08 15:37:53.565288,2021-08-08 15:37:55.283663,0 days 00:00:01.718375,0.597907893282362,0.6424181141208127,0.47316635324949663,0.6671857222125539,0.0017399413587972333,depthwise,1.5916113423713774e-07,6,1.079595278721922,0.5899839886278337,14,COMPLETE
14,0.7586046666666667,2021-08-08 15:37:55.284110,2021-08-08 15:37:57.493626,0 days 00:00:02.209516,1.369078794728767e-08,0.8318613087124794,0.6267556864810251,4.601114514888301e-06,0.004693134967105389,depthwise,1.1817268474559526e-08,4,1.8242642159411726,0.3251061020182574,95,COMPLETE
15,0.8108753333333333,2021-08-08 15:37:57.494087,2021-08-08 15:38:38.885816,0 days 00:00:41.391729,0.01936183178240241,0.7760027396785667,0.6984705171810222,0.007152488962550356,0.015259014508293004,lossguide,9.426713764061758e-07,6,0.3766152279378195,0.9952464545510165,2608,COMPLETE
16,0.8110753333333333,2021-08-08 15:38:38.886263,2021-08-08 15:40:56.764102,0 days 00:02:17.877839,0.06349424402049925,0.8338849652971573,0.794943342996689,0.0021070726854525625,0.00011389802207379058,lossguide,1.3502232313161183e-06,7,0.2097790254526182,0.923486753793656,5618,COMPLETE
17,0.8102203333333332,2021-08-08 15:40:56.764556,2021-08-08 15:43:15.547582,0 days 00:02:18.783026,0.026279579793230198,0.7907914336472099,0.8527081559634446,0.002085121896665138,2.946737064972163e-05,lossguide,0.00047589232521127626,7,0.1552420119158492,0.9942267183775721,5611,COMPLETE
18,0.7825729999999999,2021-08-08 15:43:15.548029,2021-08-08 15:43:19.320285,0 days 00:00:03.772256,0.04096492739871949,0.8707237317715275,0.7402305448056671,3.14496743111599e-06,0.009798264650195284,lossguide,7.03802707137272e-07,7,0.06202315515577684,0.9782316456525657,58,COMPLETE
19,0.791848,2021-08-08 15:43:19.320719,2021-08-08 15:43:32.286072,0 days 00:00:12.965353,0.08697681789782713,0.6935746691610215,0.8436701940821296,0.00020758801720764035,1.0710832679657187e-05,lossguide,0.009552301834537093,9,0.3430578302317017,0.8897866417005657,139,COMPLETE
20,0.8100293333333334,2021-08-08 15:43:32.286510,2021-08-08 15:44:39.633381,0 days 00:01:07.346871,0.0006754609770752104,0.7572815951738946,0.8507335490789719,0.005106287196166426,0.5563895291873145,lossguide,1.3098415259130952e-05,4,0.11449923540499406,0.9054649043126315,7033,COMPLETE
21,0.8062696666666667,2021-08-08 15:44:39.633854,2021-08-08 15:44:42.441286,0 days 00:00:02.807432,1.1982935074376263e-05,0.9781528113357467,0.6857759027321737,0.15086950887355777,0.00029753681248873357,lossguide,1.6672946646962018e-06,6,0.5047314143009937,0.6341353213810981,73,COMPLETE
22,0.8117943333333333,2021-08-08 15:44:42.441748,2021-08-08 15:45:09.449175,0 days 00:00:27.007427,0.1577248101891758,0.8786642373532585,0.24819686582548056,0.014213267108258584,0.0004538630842947436,lossguide,3.0903903097927724e-06,7,1.5028722833813852,0.8807083570317061,1368,COMPLETE
23,0.812353,2021-08-08 15:45:09.449632,2021-08-08 15:45:47.455951,0 days 00:00:38.006319,0.16085718157701193,0.8908439216287947,0.259102265070709,0.009951169155115408,4.5590930240402444e-05,lossguide,3.235989097039144e-07,7,2.528505277771382,0.9309360454542684,2009,COMPLETE
24,0.8089606666666667,2021-08-08 15:45:47.456390,2021-08-08 15:45:50.928680,0 days 00:00:03.472290,0.15014320254829858,0.8889868438877573,0.2016113373359481,0.20322340064965339,4.95939860667828e-05,lossguide,2.0239987544317768e-07,7,4.723851694547304,0.8863356099195356,110,COMPLETE
25,0.8133873333333334,2021-08-08 15:45:50.929120,2021-08-08 15:46:49.804974,0 days 00:00:58.875854,0.20888830102543487,0.9240114988636269,0.2730653028828888,0.0064173185638999606,0.0012483700839562655,lossguide,5.25487051290462e-05,7,9.24984412281895,0.8336358948213889,3509,COMPLETE
26,0.8135183333333332,2021-08-08 15:46:49.805425,2021-08-08 15:47:45.286289,0 days 00:00:55.480864,0.30155471069752493,0.9258696818648167,0.28143244883042606,0.007420177948697157,0.0009061637071825748,lossguide,5.772264831141643e-05,8,13.459614720356818,0.8061262799771505,2702,COMPLETE
27,0.7828953333333333,2021-08-08 15:47:45.286739,2021-08-08 15:47:50.211183,0 days 00:00:04.924444,0.9503538172818121,0.950358590554527,0.3212066883651938,1.3764545873494807e-05,5.1898866155065125e-06,lossguide,0.002458075942187349,9,19.708060281927075,0.8055412609649961,76,COMPLETE
28,0.7766443333333334,2021-08-08 15:47:50.211622,2021-08-08 15:47:53.586675,0 days 00:00:03.375053,0.0012736101978603914,0.7086578627767463,0.290842165949576,0.00029663607435653544,0.0016360860077662893,lossguide,8.010013790321308e-05,8,10.591680743281911,0.6852247887194018,37,COMPLETE
29,0.8135633333333333,2021-08-08 15:47:53.587210,2021-08-08 15:49:08.338722,0 days 00:01:14.751512,0.28314171960211776,0.5626622796868013,0.27900973943187213,0.005417871121903826,0.02266452486346989,lossguide,5.3109905638161864e-05,8,8.500654053828647,0.8345888305139981,3715,COMPLETE
30,0.8126486666666667,2021-08-08 15:49:08.339175,2021-08-08 15:49:15.322381,0 days 00:00:06.983206,0.010121591321127886,0.5748781417526228,0.41099471853033254,0.07566995452263879,0.02931014893601096,lossguide,8.336018713356193e-05,9,10.35293200141843,0.759423932188091,200,COMPLETE
31,0.811375,2021-08-08 15:49:15.322837,2021-08-08 15:49:20.757140,0 days 00:00:05.434303,0.013161739767526607,0.5970615827182779,0.36985853652735035,0.10872426313085998,0.16440540437704687,lossguide,5.71445626789494e-05,9,9.034627633124604,0.7615058682216778,139,COMPLETE
32,0.8133896666666667,2021-08-08 15:49:20.757588,2021-08-08 15:50:50.702458,0 days 00:01:29.944870,0.34663857855764296,0.5433707722707827,0.29876249654498016,0.004272198240092795,0.03155537039911651,lossguide,0.00018141255605337274,8,4.457823942570748,0.8401491268311148,4002,COMPLETE
33,0.813383,2021-08-08 15:50:50.702919,2021-08-08 15:52:26.453515,0 days 00:01:35.750596,0.3306381279686996,0.5260941914383936,0.2874489107975105,0.003810876842673659,0.2180934525731528,lossguide,0.0002835320268347606,8,5.71464965241117,0.8360804774565995,4525,COMPLETE
34,0.8122890000000001,2021-08-08 15:52:26.453964,2021-08-08 15:56:46.944913,0 days 00:04:20.490949,0.0016723394587734336,0.4065272941609277,0.5014460976668418,0.000858882263584968,0.008095961033088319,lossguide,0.0018933863539858317,8,3.1001583281742926,0.8439456498681163,10000,COMPLETE
35,0.7669086666666667,2021-08-08 15:56:46.945382,2021-08-08 15:56:51.828640,0 days 00:00:04.883258,0.8985204171598161,0.5232976932049637,0.20887047814948473,2.128145694180312e-08,0.003831510196427147,lossguide,2.708205329515974e-05,8,8.046065804247709,0.6634840069414544,133,COMPLETE
36,0.7768536666666667,2021-08-08 15:56:51.829092,2021-08-08 15:56:54.346743,0 days 00:00:02.517651,0.2789035452273998,0.33623103155353556,0.28967601655957026,0.0010861663114569296,0.029604116443525553,lossguide,0.00018090182039990472,9,13.366831472977651,0.5722122798189995,15,COMPLETE
37,0.7863370000000001,2021-08-08 15:56:54.347159,2021-08-08 15:57:04.315247,0 days 00:00:09.968088,6.348570793759153e-05,0.6351779267249991,0.4313036557544661,0.0001886669234015193,0.0009922357572181434,lossguide,5.411903172859682e-06,8,3.7632316342635175,0.7098213719458784,228,COMPLETE
38,0.8095656666666667,2021-08-08 15:57:04.315664,2021-08-08 15:57:07.046533,0 days 00:00:02.730869,0.054467662859822207,0.4475605389589203,0.37879351673752526,0.26978287407091933,0.06754211893656621,depthwise,3.2914262507519435e-05,7,15.136184318042737,0.7959328900198394,89,COMPLETE
39,0.8127086666666666,2021-08-08 15:57:07.046955,2021-08-08 15:57:18.155548,0 days 00:00:11.108593,0.00420627725095635,0.5302376186564312,0.5640334577078125,0.033467633621783885,0.01699694744543669,lossguide,0.0011683929619483635,8,6.241995089673683,0.9511393055831985,407,COMPLETE
40,0.8102713333333332,2021-08-08 15:57:18.155997,2021-08-08 15:58:46.344193,0 days 00:01:28.188196,0.10922128454242801,0.577660836801796,0.31630515833831996,0.003552940898726394,0.003120645656691684,lossguide,0.007268243490884526,4,4.254746998510489,0.8557963996163748,10000,COMPLETE
41,0.8134833333333334,2021-08-08 15:58:46.344642,2021-08-08 16:00:02.793735,0 days 00:01:16.449093,0.2601185416037823,0.5397890567126169,0.2752164112640245,0.005317321571441338,0.21880790895251764,lossguide,0.0002353085785494818,8,5.964325994469721,0.8388244681622647,3721,COMPLETE
42,0.8132263333333333,2021-08-08 16:00:02.794175,2021-08-08 16:00:47.315869,0 days 00:00:44.521694,0.3079396291641483,0.42093075991391027,0.258171750193633,0.009794613183587063,0.36919224038113746,lossguide,0.00022042425165742392,8,6.658602976849107,0.7678012739819651,2374,COMPLETE
43,0.7847419999999999,2021-08-08 16:00:47.316307,2021-08-08 16:01:00.896991,0 days 00:00:13.580684,0.0326568712099679,0.4874500220660338,0.3289567565088397,0.0005760699548936965,0.10206763166611693,lossguide,8.704522318905724e-06,9,2.281708142791573,0.7338207286831189,241,COMPLETE
44,0.8132766666666668,2021-08-08 16:01:00.897427,2021-08-08 16:01:14.840100,0 days 00:00:13.942673,0.310573593569877,0.636200177711406,0.3694600608038282,0.03156106574745103,0.040273125980719936,lossguide,3.962797660028333e-05,8,12.192592132873235,0.8158441628099925,626,COMPLETE
45,0.7737426666666667,2021-08-08 16:01:14.840530,2021-08-08 16:01:17.851487,0 days 00:00:03.010957,0.008483531813882646,0.5566837676156182,0.23957763183716013,0.0017826042579847006,0.00021752676422698685,lossguide,0.0005291507428086103,7,16.722348250584204,0.8544076544186872,67,COMPLETE
46,0.7858186666666667,2021-08-08 16:01:17.851905,2021-08-08 16:01:21.811852,0 days 00:00:03.959947,0.7572753708471506,0.3374715635319555,0.4690399854384867,2.7590262629872543e-05,0.2402554914758693,depthwise,0.00013705896861457975,9,6.845307621561815,0.7306622569512736,46,COMPLETE
47,0.7894726666666667,2021-08-08 16:01:21.812378,2021-08-08 16:01:36.883555,0 days 00:00:15.071177,0.08907517182733223,0.3771096339686038,0.2871663679695443,0.05014479773776232,0.0008034953317955525,lossguide,1.951237702295545e-05,1,4.793757882825509,0.4986941537363478,2287,COMPLETE
48,0.8121296666666667,2021-08-08 16:01:36.883995,2021-08-08 16:01:57.447020,0 days 00:00:20.563025,0.26068918649378797,0.7343862397634937,0.34435141905719246,0.01578361184013294,3.880470752584551e-08,depthwise,6.020823336817484e-06,6,1.4005303545284593,0.950566167875732,1426,COMPLETE
49,0.7843003333333334,2021-08-08 16:01:57.447455,2021-08-08 16:02:00.155216,0 days 00:00:02.707761,0.02264181718946106,0.4666204179026772,0.3823179009917682,0.00036668009350414825,0.006819550626834835,lossguide,0.0032025999011954295,8,3.1147478546482756,0.7956308399695201,10,COMPLETE
50,0.7579583333333334,2021-08-08 16:02:00.155642,2021-08-08 16:02:01.964373,0 days 00:00:01.808731,0.5148909455006723,0.6595114511390265,0.22300931522217687,8.302050892070839e-05,0.0748693405120094,lossguide,0.00028228777619654344,5,9.031806947304279,0.6472839050864819,44,COMPLETE
51,0.8133156666666665,2021-08-08 16:02:01.964824,2021-08-08 16:03:41.466596,0 days 00:01:39.501772,0.47557038856638956,0.529384362936655,0.2784916775386332,0.0039014573965336654,0.2597972668824894,lossguide,0.0006126150395798441,8,5.464078047859715,0.8328379047537482,4808,COMPLETE
52,0.8139833333333334,2021-08-08 16:03:41.467036,2021-08-08 16:05:10.350464,0 days 00:01:28.883428,0.05193946923616045,0.6083275166314308,0.3024749712002333,0.004428690832820831,0.7510997361671722,lossguide,0.00029516321821732136,8,19.9177438446432,0.8527888260151852,5221,COMPLETE
53,0.813559,2021-08-08 16:05:10.350915,2021-08-08 16:07:50.541579,0 days 00:02:40.190664,0.043894064532932736,0.9293046785893312,0.3284204052542877,0.0020034185265150987,0.7882478144819897,lossguide,0.0011550656299062244,7,14.07497651108289,0.8674324998320089,10000,COMPLETE
54,0.8129636666666666,2021-08-08 16:07:50.542088,2021-08-08 16:10:47.657013,0 days 00:02:57.114925,0.04592479981401219,0.26999413369417136,0.3236850933767115,0.0015556331881375312,0.8556986026007589,lossguide,0.0010358122407044769,9,19.88158297438837,0.8699696691018779,10000,COMPLETE
55,0.8139433333333334,2021-08-08 16:10:47.657479,2021-08-08 16:13:09.983637,0 days 00:02:22.326158,0.07508203912310368,0.6089030634749466,0.40726680207742494,0.002526283409403279,0.590649288543126,lossguide,0.027762937309520636,8,14.373404288680169,0.9127883150612043,7298,COMPLETE
56,0.8088303333333333,2021-08-08 16:13:09.984095,2021-08-08 16:16:41.651982,0 days 00:03:31.667887,0.08255683929716245,0.8326787149314792,0.43908795318822536,0.0005355208009361869,0.5906800836675095,lossguide,0.047708724468844395,7,13.712807141645163,0.9268658282969948,10000,COMPLETE
57,0.8129243333333335,2021-08-08 16:16:41.652438,2021-08-08 16:17:07.686182,0 days 00:00:26.033744,0.002533786892991164,0.6049838949151574,0.3575253568196457,0.012426966592204979,0.8849856406030259,depthwise,0.2502578847320695,6,12.081019165497462,0.9632778271551012,2111,COMPLETE
58,0.778128,2021-08-08 16:17:07.686625,2021-08-08 16:17:12.343339,0 days 00:00:04.656714,0.0004781009152927988,0.8016101616020362,0.3954982856067809,0.0001690936863628848,0.1186470989662584,lossguide,0.007613294233274358,7,16.045310953899058,0.8997880079921721,120,COMPLETE
59,0.8134063333333333,2021-08-08 16:17:12.343777,2021-08-08 16:20:20.969285,0 days 00:03:08.625508,2.913008429648515e-07,0.6622171661531462,0.23321546532431775,0.0021169103037504368,0.43552729360494596,lossguide,0.7622968081010962,8,7.914407195194791,0.9149223632887082,9533,COMPLETE
60,0.8135293333333333,2021-08-08 16:20:20.969749,2021-08-08 16:20:41.710396,0 days 00:00:20.740647,0.016036557383258015,0.6145684221311327,0.3407025629029061,0.020493212688807987,0.37646323822822625,lossguide,0.027687980488458178,9,11.851103817238204,0.789648622820973,801,COMPLETE
61,0.8134103333333332,2021-08-08 16:20:41.710827,2021-08-08 16:21:06.486315,0 days 00:00:24.775488,0.013416077151990733,0.9990040858485213,0.34330959946602646,0.01729589252694181,0.3769570874948213,lossguide,0.021011503869346033,9,12.267338994332555,0.7810298365827127,795,COMPLETE
62,0.8139086666666667,2021-08-08 16:21:06.486755,2021-08-08 16:22:02.097621,0 days 00:00:55.610866,0.023094181730488873,0.4952456351909156,0.3089789709427982,0.007788985663413162,0.15987911562469634,lossguide,0.14293127687065407,8,14.377748397476784,0.8707454293899748,3002,COMPLETE
63,0.8091160000000001,2021-08-08 16:22:02.098064,2021-08-08 16:22:04.987496,0 days 00:00:02.889432,0.030664349391523894,0.6122129957792518,0.46182318136760214,0.28948374034627894,0.06945247797897156,lossguide,0.19951553158390856,9,19.81114441006991,0.8758937200875723,49,COMPLETE
64,0.8129273333333332,2021-08-08 16:22:04.987998,2021-08-08 16:22:14.110428,0 days 00:00:09.122430,0.005471563140560232,0.9326507543530934,0.31096398115968227,0.050131742790984785,0.9418286225966871,lossguide,0.08578748118031931,9,15.322346864221146,0.8095236472462646,321,COMPLETE
65,0.8135276666666665,2021-08-08 16:22:14.110861,2021-08-08 16:22:32.052904,0 days 00:00:17.942043,0.11894562236227396,0.4994365517235994,0.3984551237429565,0.024811710736095168,0.014624306608446512,lossguide,0.021553444822491035,7,10.153553966892192,0.9388642392511986,1057,COMPLETE
66,0.80123,2021-08-08 16:22:32.053421,2021-08-08 16:22:33.917983,0 days 00:00:01.864562,0.015470877710734295,0.5003084741308574,0.5148789171032586,0.606299664721643,0.12749365559462333,lossguide,0.014716253115787706,7,10.35142983155421,0.9670531306323766,24,COMPLETE
67,0.8121726666666667,2021-08-08 16:22:33.918422,2021-08-08 16:22:40.216410,0 days 00:00:06.297988,0.11547620982967625,0.49581227966210434,0.41420278906519575,0.07996378996606918,0.02071580660522741,lossguide,0.02493598653062889,7,8.177527758345724,0.9342738355620673,302,COMPLETE
68,0.8112556666666667,2021-08-08 16:22:40.216859,2021-08-08 16:22:53.141128,0 days 00:00:12.924269,0.03499893538972075,0.4386873009548046,0.5638508181287802,0.023232179058234576,0.39940311767676223,lossguide,0.04608083245416886,6,0.02207251082683667,0.8890408315399015,814,COMPLETE
69,0.813536,2021-08-08 16:22:53.141674,2021-08-08 16:25:24.031308,0 days 00:02:30.889634,0.007755627241966887,0.5701878648539077,0.4500612255704909,0.0022769634843054624,0.0493967680085517,lossguide,0.35312464344388206,7,10.801273482774647,0.9951177911682454,9233,COMPLETE
70,0.7858343333333333,2021-08-08 16:25:24.031775,2021-08-08 16:25:27.330570,0 days 00:00:03.298795,0.0024815028148740983,0.5708261472101451,0.4516537088004639,0.0010733202051488708,0.14844149495046283,depthwise,0.45564705607695116,8,16.099166273253385,0.9953793870736181,39,COMPLETE
71,0.7851689999999999,2021-08-08 16:25:27.331105,2021-08-08 16:25:29.898958,0 days 00:00:02.567853,0.05830196110103174,0.6172415992347107,0.4947546214555129,0.002553218275120919,0.0470007717754102,lossguide,0.1818142408742673,7,11.460144042428652,0.9069651652358057,34,COMPLETE
72,0.8133466666666668,2021-08-08 16:25:29.899399,2021-08-08 16:26:14.284446,0 days 00:00:44.385047,0.007450819109393001,0.6725026330300028,0.4176485386317357,0.008064480150247393,0.05633594297918158,lossguide,0.09585160536990225,7,7.7946428219401325,0.9801049337161716,2572,COMPLETE
73,0.8129816666666666,2021-08-08 16:26:14.284918,2021-08-08 16:26:34.415130,0 days 00:00:20.130212,0.022814899993374663,0.7053059735821823,0.3945333230288446,0.020414076172470416,0.01368058170122551,lossguide,0.4114865991858529,6,10.01835002592511,0.9423910374021954,1483,COMPLETE
74,0.7803243333333333,2021-08-08 16:26:34.415587,2021-08-08 16:26:39.657990,0 days 00:00:05.242403,0.15028414185065614,0.5065204127615689,0.3501797495415427,0.0014314661162963972,0.5474544840346567,lossguide,0.004467249364562483,8,16.88119025454751,0.8641834861710759,120,COMPLETE
75,0.8125796666666667,2021-08-08 16:26:39.658453,2021-08-08 16:28:32.577144,0 days 00:01:52.918691,0.060357272259820204,0.5643399785225338,0.33279498709344785,0.002828198607900434,0.277144882964387,lossguide,0.969948190543997,7,0.04305246082240847,0.9136979391238685,5752,COMPLETE
