number,value,datetime_start,datetime_complete,duration,params_alpha,params_colsample_bylevel,params_colsample_bytree,params_eta,params_gamma,params_grow_policy,params_lambda,params_max_depth,params_min_child_weight,params_subsample,user_attrs_n_estimators,state
0,0.7562346666666667,2021-08-08 04:00:15.927882,2021-08-08 04:00:18.733040,0 days 00:00:02.805158,0.0006417436522828534,0.6037532884387137,0.8698235401247567,1.3465333509520782e-06,0.00973620360965841,depthwise,0.00030700012169397205,4,0.01576454179799566,0.5970057545586964,124,COMPLETE
1,0.8091306666666668,2021-08-08 04:00:18.733652,2021-08-08 04:00:32.216364,0 days 00:00:13.482712,5.8325202440069185e-05,0.5436968924845078,0.8376707899121181,0.024759228227025167,4.574473298534116e-07,lossguide,1.1243796788352763e-06,8,0.011360089516102121,0.3607364360374832,330,COMPLETE
2,0.7822056666666667,2021-08-08 04:00:32.216960,2021-08-08 04:00:37.258558,0 days 00:00:05.041598,1.060432617808114e-08,0.5984442850328906,0.42736639827151973,0.00021922905626629987,0.0452965648418786,lossguide,0.01950761997553548,7,2.257278389999872,0.28157612655093694,152,COMPLETE
3,0.7243836666666666,2021-08-08 04:00:37.258988,2021-08-08 04:00:38.833208,0 days 00:00:01.574220,2.397469272044543e-07,0.9827960203695054,0.8928052904547155,1.1349839954652324e-08,2.1896503723572927e-08,depthwise,6.782012918467686e-08,3,4.290046919093046,0.41942192543627166,42,COMPLETE
4,0.7647166666666667,2021-08-08 04:00:38.833645,2021-08-08 04:00:42.258923,0 days 00:00:03.425278,1.976012865748e-05,0.25721591227186924,0.28804633495717974,1.669958011067942e-06,0.052447572343885036,depthwise,3.3809965458950755e-08,7,0.027899765463572257,0.23851937522224287,90,COMPLETE
5,0.8117280000000001,2021-08-08 04:00:42.259357,2021-08-08 04:01:34.002137,0 days 00:00:51.742780,0.0009261838681094465,0.28475711503474876,0.5086061863676905,0.007003216178527783,0.0023607913953997764,depthwise,9.041406218070735e-05,5,1.5683199512221968,0.3312573081429673,5081,COMPLETE
6,0.6412823333333333,2021-08-08 04:01:34.002567,2021-08-08 04:01:36.078538,0 days 00:00:02.075971,0.00027290020521042983,0.7327697575659626,0.4708521198050716,4.429827441490982e-08,2.0422591569661287e-05,lossguide,1.2639944554658647e-08,1,0.08519304652536872,0.5321879437474895,152,COMPLETE
7,0.7640443333333332,2021-08-08 04:01:36.078982,2021-08-08 04:01:38.307437,0 days 00:00:02.228455,0.09690242939558305,0.2174619082877948,0.8073569352900765,0.0011794077046124785,0.05855724025530241,lossguide,0.004720194722065418,5,5.115070082552457,0.7862497619637301,71,COMPLETE
8,0.812847,2021-08-08 04:01:38.307871,2021-08-08 04:03:14.710946,0 days 00:01:36.403075,8.272493225672902e-05,0.22596059520749823,0.341920501693817,0.00423478205560947,0.000216541130787045,lossguide,3.198922502356813e-05,7,0.7809428105525824,0.9304952030572666,5421,COMPLETE
9,0.641503,2021-08-08 04:03:14.711387,2021-08-08 04:03:17.121618,0 days 00:00:02.410231,0.0001593189894883475,0.7145227274246215,0.47928386687756536,5.4755689353823345e-08,0.004936304475494569,depthwise,0.009060953957644733,1,6.4555894252677515,0.5103347336653453,207,COMPLETE
10,0.7816756666666667,2021-08-08 04:03:17.122045,2021-08-08 04:03:19.907694,0 days 00:00:02.785649,0.228506517294102,0.40014680077432196,0.21136671111929087,0.831486666623296,3.5031858992022434e-05,lossguide,8.086707911933853e-06,9,0.38737242328658317,0.9777600040922597,10,COMPLETE
11,0.8127256666666667,2021-08-08 04:03:19.908133,2021-08-08 04:03:58.970907,0 days 00:00:39.062774,0.004354938380931716,0.3723832089049766,0.6568714180761661,0.008190166761700698,0.0011842662682552915,depthwise,0.9593031633395963,6,0.7553338652350705,0.7902716823032913,2833,COMPLETE
12,0.8059503333333332,2021-08-08 04:03:58.971344,2021-08-08 04:04:01.749377,0 days 00:00:02.778033,0.012758194098799004,0.3986154574228475,0.6760751431448007,0.23471947153197134,0.00035520309373678446,lossguide,0.20315894069501228,7,0.49925359615503767,0.795913066619854,53,COMPLETE
13,0.775743,2021-08-08 04:04:01.749792,2021-08-08 04:04:04.077282,0 days 00:00:02.327490,0.006574252529525786,0.394538419057622,0.6679990613292868,5.522721394844111e-05,3.682906446232364e-06,depthwise,7.934728960621506e-05,6,0.44351358910045435,0.9875523710144476,47,COMPLETE
14,0.812571,2021-08-08 04:04:04.077709,2021-08-08 04:04:21.613232,0 days 00:00:17.535523,4.247666093253391e-06,0.3388668106650898,0.33052630555911167,0.02744891594726631,0.7832178781779267,lossguide,0.7525622486908898,9,0.14621117340214224,0.7983574593029776,461,COMPLETE
15,0.798698,2021-08-08 04:04:21.613667,2021-08-08 04:05:41.578859,0 days 00:01:19.965192,2.959691392908442e-06,0.48647797497143747,0.6028808592826299,0.0009719624208665217,0.0002972392114691768,depthwise,1.9808210710582776e-06,3,14.964881464413972,0.8829444586994925,10000,COMPLETE
16,0.775602,2021-08-08 04:05:41.579358,2021-08-08 04:05:44.000574,0 days 00:00:02.421216,0.005875177194850535,0.23160671811829953,0.9920807151919578,3.0492770630816205e-05,3.616301862449673e-06,depthwise,0.0010165157701688533,6,1.1738911820891484,0.7099185340416344,57,COMPLETE
17,0.811601,2021-08-08 04:05:44.001047,2021-08-08 04:06:51.367694,0 days 00:01:07.366647,0.01679251129063938,0.480161586566453,0.7344196549373253,0.005202420193757936,0.0007184593023966045,lossguide,1.4249975625512743e-05,8,0.1450205475029776,0.6863315624851904,2008,COMPLETE
18,0.8115100000000001,2021-08-08 04:06:51.368131,2021-08-08 04:06:57.011067,0 days 00:00:05.642936,0.915875059538665,0.9978074905877958,0.5781102342399935,0.06660737060250173,6.4460257850334e-05,depthwise,0.07176374817631084,6,0.9513147161315356,0.8865425399584387,270,COMPLETE
19,0.7512849999999999,2021-08-08 04:06:57.011500,2021-08-08 04:06:58.649726,0 days 00:00:01.638226,1.0270623223872095e-06,0.3350472214265762,0.3701782292777768,0.000440305969031347,0.5832820752948162,lossguide,0.0008912881803840197,4,0.0697003936981904,0.9027368368462257,35,COMPLETE
20,0.7777476666666666,2021-08-08 04:06:58.650174,2021-08-08 04:07:02.387716,0 days 00:00:03.737542,0.001658387595151005,0.8643358296985513,0.20051235597825412,0.007310554324581144,2.710965988074495e-07,depthwise,9.194867135333736e-07,8,0.2924227582385105,0.6877810989766705,46,COMPLETE
21,0.810685,2021-08-08 04:07:02.388148,2021-08-08 04:07:12.200987,0 days 00:00:09.812839,2.7967755268173135e-05,0.3233198757524753,0.34223810976719277,0.05758423427097264,0.26220479714984213,lossguide,0.5896497266872022,9,0.19212938560946927,0.8001165100823788,196,COMPLETE
22,0.7841926666666668,2021-08-08 04:07:12.201459,2021-08-08 04:07:17.605331,0 days 00:00:05.403872,7.211583559415797e-06,0.3461735952895611,0.3103989803217421,0.003697649622519843,0.0009645910445876184,lossguide,0.6270153192259444,9,0.7603666952612057,0.8380209031439221,59,COMPLETE
23,0.8030176666666667,2021-08-08 04:07:17.605837,2021-08-08 04:07:20.714474,0 days 00:00:03.108637,1.9037157360077389e-07,0.46952329696761896,0.5723388050219277,0.2769570340855604,0.012072827071955524,lossguide,0.07944361551958523,8,0.08517599483536967,0.9441384950210637,34,COMPLETE
24,0.8114336666666665,2021-08-08 04:07:20.714924,2021-08-08 04:07:35.444768,0 days 00:00:14.729844,7.718984345049555e-07,0.28673289908397664,0.4137888476124607,0.026059143418570224,1.0607010189145692e-05,lossguide,0.031580765074291334,7,0.03864688091403927,0.7456008529732725,707,COMPLETE
25,0.7568,2021-08-08 04:07:35.445203,2021-08-08 04:07:37.430054,0 days 00:00:01.984851,8.189024549939154e-06,0.4287956113408631,0.2874249515778653,1.4072222897142679e-05,0.0001510830923589609,lossguide,0.8356105792116592,5,2.6258526557005535,0.6411880456716669,53,COMPLETE
26,0.8120630000000001,2021-08-08 04:07:37.430495,2021-08-08 04:09:46.682508,0 days 00:02:09.252013,0.0001261737404727096,0.2174883829758386,0.7572366415339724,0.0022460723104019502,0.0015330585462352642,lossguide,0.004076360447058543,6,0.16184164291304873,0.8416575497328552,9296,COMPLETE
27,0.811956,2021-08-08 04:09:46.682959,2021-08-08 04:10:11.452348,0 days 00:00:24.769389,2.624284248169846e-08,0.3350283701090828,0.5254140757496593,0.015422318235596871,0.983100489595978,lossguide,2.1015392943360418e-05,9,0.6410126935752111,0.9396326972149568,616,COMPLETE
28,0.8086739999999999,2021-08-08 04:10:11.452872,2021-08-08 04:10:15.531510,0 days 00:00:04.078638,0.05428348843640194,0.5715273673242551,0.396443244898427,0.12102515184551048,0.16064064340642242,depthwise,0.1850714170433192,8,0.2894642906750381,0.7496060185510796,76,COMPLETE
29,0.7901883333333334,2021-08-08 04:10:15.531949,2021-08-08 04:10:16.952424,0 days 00:00:01.420475,0.000605269471577595,0.6503025556816997,0.24682045228000893,0.923238513568268,0.011800355884517992,depthwise,0.0004893806415501774,4,0.2517101547326465,0.5970142132066527,20,COMPLETE
30,0.777143,2021-08-08 04:10:16.952957,2021-08-08 04:10:20.262952,0 days 00:00:03.309995,0.002820750558213795,0.2026177460402405,0.6382873150017179,0.00019996106071728097,0.0048224107776027696,lossguide,2.1877523550476772e-07,7,1.6569143060858942,0.5495488494746945,72,COMPLETE
31,0.8120483333333334,2021-08-08 04:10:20.263400,2021-08-08 04:12:18.040561,0 days 00:01:57.777161,6.286915118710983e-05,0.25173752546006345,0.7327574792007728,0.0024318155245886836,0.001564808937120864,lossguide,0.004559967467414392,6,0.16225071322167234,0.8460979683178252,8406,COMPLETE
32,0.8080196666666667,2021-08-08 04:12:18.041112,2021-08-08 04:14:07.240561,0 days 00:01:49.199449,0.0002962572013753001,0.2007086884716813,0.7501669485125941,0.0011501177859195048,0.00016219099723887293,lossguide,0.17426428968391705,5,0.12413362363929531,0.840062312969865,10000,COMPLETE
33,0.8113253333333335,2021-08-08 04:14:07.241036,2021-08-08 04:14:23.053071,0 days 00:00:15.812035,9.024968070527548e-05,0.3065331404000927,0.8737961262987909,0.018960390263863088,0.02249213777470783,lossguide,0.00023482268494507335,6,0.04124384574568234,0.9238027083014662,1020,COMPLETE
34,0.803585,2021-08-08 04:14:23.053504,2021-08-08 04:18:04.169605,0 days 00:03:41.116101,2.5966494001153723e-05,0.37585392983041654,0.7967319637056426,0.0003030340964960272,2.9324002878300567e-07,lossguide,0.0017353656658569388,7,0.01737383169453657,0.7541372464019322,10000,COMPLETE
35,0.8124043333333333,2021-08-08 04:18:04.170065,2021-08-08 04:18:16.124639,0 days 00:00:11.954574,2.931144599303237e-06,0.26662809755865713,0.9211385114129935,0.029556282604354465,0.0034834867667269185,lossguide,0.016841549612709037,8,2.593605242814079,0.8598731093864017,407,COMPLETE
36,0.8116600000000002,2021-08-08 04:18:16.125063,2021-08-08 04:18:23.787571,0 days 00:00:07.662508,1.6448964593178191e-06,0.28381352341432076,0.9663844235893744,0.04373268086287813,0.12209422865735721,lossguide,0.013618610208574458,8,2.8565024108228796,0.43803107472516567,256,COMPLETE
37,0.8138513333333334,2021-08-08 04:18:23.787989,2021-08-08 04:18:51.757582,0 days 00:00:27.969593,1.8308844038093442e-07,0.44043712737277485,0.9116421685294717,0.01418324103468068,0.0036518928880740586,depthwise,0.043094157156524815,9,7.504507049025166,0.6369645357354178,874,COMPLETE
38,0.8146620000000001,2021-08-08 04:18:51.758050,2021-08-08 04:19:28.134385,0 days 00:00:36.376335,1.0693024114107862e-07,0.5236951376291329,0.4516174797820872,0.010052177994490138,2.3811795489298636e-08,depthwise,0.05415596767221708,9,10.64033674553531,0.6359313227214635,1454,COMPLETE
39,0.7880656666666668,2021-08-08 04:19:28.134821,2021-08-08 04:19:32.440849,0 days 00:00:04.306028,3.9927435370592214e-08,0.5301900216518577,0.4839320718690323,1.2386382563802297e-05,1.6097466086684943e-08,depthwise,0.03882581190584399,9,17.92969738756128,0.6596357700517341,50,COMPLETE
40,0.8140573333333334,2021-08-08 04:19:32.441272,2021-08-08 04:20:16.973860,0 days 00:00:44.532588,8.296328458360353e-08,0.518630796540536,0.4387122584323,0.007458715087362245,6.467306315315588e-08,depthwise,0.00020601262401289042,7,9.566006371413119,0.6307140849844005,2821,COMPLETE
41,0.8141219999999999,2021-08-08 04:20:16.974294,2021-08-08 04:21:15.292809,0 days 00:00:58.318515,2.2420749135116387e-07,0.6234708648540701,0.4412199891003121,0.006071798353546647,8.639161968312559e-08,depthwise,4.185575546973966e-05,7,9.403642885066976,0.6266489680350936,3706,COMPLETE
42,0.8142003333333334,2021-08-08 04:21:15.293245,2021-08-08 04:21:53.476084,0 days 00:00:38.182839,1.828232193904883e-07,0.6210328665802387,0.5297756394829797,0.00950025360970869,4.958014886179369e-08,depthwise,3.5138106447971946e-05,8,8.835675893377315,0.4900186691034877,1766,COMPLETE
43,0.8096386666666667,2021-08-08 04:21:53.476523,2021-08-08 04:21:56.912569,0 days 00:00:03.436046,1.8472627168923768e-07,0.6394287425020982,0.44679808726520076,0.1341679100864783,6.045566169217813e-08,depthwise,2.990895606575867e-06,8,8.256530771747752,0.4486979752672543,92,COMPLETE
44,0.8146063333333333,2021-08-08 04:21:56.913043,2021-08-08 04:22:29.549818,0 days 00:00:32.636775,4.147023977472797e-08,0.7341566031427825,0.5285912776764429,0.011317846158091434,4.8081142976116227e-08,depthwise,0.00017055413351558474,9,11.257812673325098,0.5577420291635373,1126,COMPLETE
45,0.7921876666666666,2021-08-08 04:22:29.550251,2021-08-08 04:22:35.623460,0 days 00:00:06.073209,1.066717996121785e-08,0.7500785320306471,0.5323764149306415,0.000990191655200055,5.416353616685474e-08,depthwise,6.053051527183172e-05,9,11.282899038982976,0.4872358849651044,74,COMPLETE
46,0.8003936666666668,2021-08-08 04:22:35.623894,2021-08-08 04:22:37.960307,0 days 00:00:02.336413,7.417022650258444e-08,0.783562185245322,0.4457514259742924,0.3806663765176817,7.252331093685861e-08,depthwise,0.00019795455154709705,8,4.1027025024431625,0.5661150602502741,18,COMPLETE
47,0.7849273333333334,2021-08-08 04:22:37.960784,2021-08-08 04:22:40.559044,0 days 00:00:02.598260,4.812439529021704e-07,0.6615109422815686,0.5011948385965824,1.0270568482270957e-06,8.257120368154304e-07,depthwise,4.093582057259324e-05,7,10.92218178671875,0.4964155103785627,34,COMPLETE
48,0.7928063333333334,2021-08-08 04:22:40.559468,2021-08-08 04:22:49.753513,0 days 00:00:09.194045,5.479906206896674e-08,0.5932370999120101,0.5420586819167328,0.0001251276754110382,1.0917094512517456e-08,depthwise,6.872298452924304e-06,9,5.0521020650838055,0.38632367195399864,136,COMPLETE
49,0.814493,2021-08-08 04:22:49.753934,2021-08-08 04:23:29.976303,0 days 00:00:40.222369,1.4546964097796711e-08,0.5377618962757831,0.3776967996821513,0.009263834921233238,1.2080408571025821e-07,depthwise,0.00017222309931976738,8,12.678909966215615,0.5774152393021316,2147,COMPLETE
50,0.8149683333333334,2021-08-08 04:23:29.976772,2021-08-08 04:25:52.717484,0 days 00:02:22.740712,1.0074572556169134e-08,0.6988522884156338,0.39148656741123267,0.002519388990293193,6.728869412617831e-07,depthwise,4.869174016195355e-07,8,19.62671093125556,0.5746521337863859,8193,COMPLETE
51,0.8147650000000001,2021-08-08 04:25:52.717960,2021-08-08 04:28:38.749176,0 days 00:02:46.031216,1.0139956818310839e-08,0.8118603502713551,0.39190833097993916,0.0022130620288537462,2.890029441102288e-08,depthwise,2.953752405789684e-07,8,13.199173588716254,0.5729697384879151,8218,COMPLETE
52,0.8147860000000001,2021-08-08 04:28:38.749639,2021-08-08 04:31:04.762350,0 days 00:02:26.012711,1.0977658343804776e-08,0.6912675308194896,0.377248081801812,0.002433515073807912,2.897679265293072e-08,depthwise,3.877524841254978e-07,8,18.937483337004906,0.574320108619761,8428,COMPLETE
53,0.7282433333333334,2021-08-08 04:31:04.762802,2021-08-08 04:31:06.543138,0 days 00:00:01.780336,1.1018851447192225e-08,0.8745189956478197,0.3525203374207284,0.0006157629253160883,8.226870739740746e-07,depthwise,1.4957516103903397e-07,2,18.989575053761516,0.5730418406645307,92,COMPLETE
54,0.79144,2021-08-08 04:31:06.543555,2021-08-08 04:31:12.266160,0 days 00:00:05.722605,2.4464259404109122e-08,0.7051938748405554,0.38776951777668933,0.0021093285691792503,1.632696152497957e-07,depthwise,1.8749608038554405e-08,9,13.388014950847024,0.5953685675974479,86,COMPLETE
55,0.8137806666666667,2021-08-08 04:31:12.266602,2021-08-08 04:33:21.893330,0 days 00:02:09.626728,1.9271033492278186e-08,0.833017992254862,0.25790928128563056,0.0027908137246372105,2.766859235186782e-08,depthwise,3.134748718838484e-07,8,6.43290194251313,0.5505847121138645,6430,COMPLETE
56,0.790298,2021-08-08 04:33:21.893784,2021-08-08 04:33:25.846865,0 days 00:00:03.953081,9.453145379560362e-08,0.6854213891359935,0.4076812318741299,0.0006668006511663226,1.442880152864168e-07,depthwise,5.768692245273195e-07,9,13.868657691877202,0.527940462958691,38,COMPLETE
57,0.784469,2021-08-08 04:33:25.847334,2021-08-08 04:33:28.788938,0 days 00:00:02.941604,1.0041130177254807e-08,0.7727456503252992,0.3759330403969114,0.0016307293993611167,2.8216063789280672e-08,depthwise,7.173446174261142e-08,8,18.524351633991458,0.46680425221606064,36,COMPLETE
58,0.8103383333333333,2021-08-08 04:33:28.789360,2021-08-08 04:33:33.597563,0 days 00:00:04.808203,2.9682194310789252e-08,0.7961705764157676,0.3134332969526143,0.09789418770443616,6.506252274417125e-07,depthwise,6.661783461818434e-08,8,4.2517944627902695,0.5173498021988293,150,COMPLETE
59,0.7911526666666666,2021-08-08 04:33:33.598004,2021-08-08 04:33:38.600955,0 days 00:00:05.002951,1.613643353473011e-08,0.9004988002052917,0.4648093590858632,6.991031789321173e-05,1.7141116406792896e-06,depthwise,2.3855206555775553e-06,9,6.123789346234913,0.2966559184831413,50,COMPLETE
60,0.813945,2021-08-08 04:33:38.601378,2021-08-08 04:35:09.893080,0 days 00:01:31.291702,4.6944210147916447e-07,0.5609057074107051,0.356433485618625,0.003920797325362064,1.0523267075647932e-08,depthwise,6.088830010520626e-07,9,3.554859312423383,0.6754840358629112,2923,COMPLETE
61,0.8145083333333333,2021-08-08 04:35:09.893604,2021-08-08 04:35:39.599701,0 days 00:00:29.706097,4.770551835456184e-08,0.7146998826450041,0.4940388164218709,0.011796454611346083,3.3556930696802666e-08,depthwise,5.756516888451801e-06,8,13.896945852274603,0.40415965496567824,1485,COMPLETE
62,0.814489,2021-08-08 04:35:39.600145,2021-08-08 04:36:07.547903,0 days 00:00:27.947758,4.2804846073943034e-08,0.7400224374372324,0.4999947616325019,0.014169746576829212,2.789771681621468e-08,depthwise,3.985796948729831e-06,8,12.366958090731982,0.400061522955787,1378,COMPLETE
63,0.813217,2021-08-08 04:36:07.548339,2021-08-08 04:36:15.569843,0 days 00:00:08.021504,8.022585199315102e-08,0.6810204565681882,0.5618604069023324,0.04693816156883093,2.0129943565278738e-07,depthwise,1.2017518980797431e-06,7,13.861877028913193,0.3415958897633748,433,COMPLETE
64,0.8148423333333333,2021-08-08 04:36:15.570275,2021-08-08 04:37:43.337592,0 days 00:01:27.767317,1.669738114919485e-08,0.8161010045500996,0.41886920387666293,0.004309553379485045,4.06615854068196e-07,depthwise,1.0495540554289556e-05,8,19.627147902002942,0.6043521362565175,4529,COMPLETE
65,0.8149766666666668,2021-08-08 04:37:43.338075,2021-08-08 04:39:14.245595,0 days 00:01:30.907520,3.428198184023909e-08,0.8137198135787422,0.4127439256838172,0.004256016769065919,3.694705631456538e-07,depthwise,1.2472542490129027e-06,9,19.273905074957796,0.6032993737052381,3834,COMPLETE
66,0.7906969999999999,2021-08-08 04:39:14.246044,2021-08-08 04:39:18.536223,0 days 00:00:04.290179,2.3007671302791344e-08,0.9423496340532174,0.41298591988791156,0.0004442007455462342,4.2650847752165065e-07,depthwise,1.11179701532393e-06,9,19.836324301169178,0.606246300203267,38,COMPLETE
67,0.8143816666666667,2021-08-08 04:39:18.536837,2021-08-08 04:40:52.694714,0 days 00:01:34.157877,1.143446396335319e-07,0.8242777853105506,0.4666377201323212,0.003947624711714465,1.7024386237727029e-06,depthwise,1.2605635106809317e-05,9,7.096144115398583,0.610333134184168,2954,COMPLETE
68,0.8148873333333334,2021-08-08 04:40:52.695160,2021-08-08 04:44:46.476557,0 days 00:03:53.781397,3.369708990021522e-08,0.8248778549581575,0.32599496338965334,0.0015023629761460962,1.1038752256273447e-05,depthwise,1.2014366096761008e-07,9,16.582870407063496,0.7107771926820773,10000,COMPLETE
69,0.7841056666666667,2021-08-08 04:44:46.477021,2021-08-08 04:44:57.375078,0 days 00:00:10.898057,3.5970819360414137e-07,0.8318469791277345,0.32281147677690775,0.00015440123226301066,1.849001628783157e-05,depthwise,3.4650573705235314e-07,9,16.48325004795704,0.7116938259487192,232,COMPLETE
70,0.742401,2021-08-08 04:44:57.375511,2021-08-08 04:44:58.797198,0 days 00:00:01.421687,1.9783768715239153e-08,0.8981741374270539,0.28823218552707686,0.0014631232681815768,2.4751034456351154e-06,depthwise,1.1530447121046528e-07,3,5.574006705456617,0.7192235635221623,28,COMPLETE
71,0.7905526666666667,2021-08-08 04:44:58.797637,2021-08-08 04:45:04.803434,0 days 00:00:06.005797,3.6945055099730915e-08,0.7607799226785503,0.41932354054952636,0.0007587960382508826,5.22886736193035e-06,depthwise,3.1758864628319256e-08,9,10.113849238872369,0.6636824786840155,67,COMPLETE
72,0.785036,2021-08-08 04:45:04.803938,2021-08-08 04:45:12.222949,0 days 00:00:07.419011,5.7141556785639106e-08,0.8050804566227385,0.34146677939904113,0.0003243672229731972,6.161040228292939e-06,depthwise,1.6469553749083873e-06,9,15.553907183829319,0.5436507306601995,138,COMPLETE
73,0.8145836666666666,2021-08-08 04:45:12.223383,2021-08-08 04:45:29.623619,0 days 00:00:17.400236,1.3057759561526044e-07,0.8608230091599928,0.2915642894830389,0.027489743021911477,3.223326262216172e-07,depthwise,4.1504684393045165e-07,8,19.887463497416142,0.5804590933024072,948,COMPLETE
74,0.8140716666666666,2021-08-08 04:45:29.624060,2021-08-08 04:46:54.335561,0 days 00:01:24.711501,2.9788722064577703e-08,0.7240864316482417,0.23679609858604997,0.00514683092121912,1.7283548430087364e-08,depthwise,1.284825050876479e-07,9,11.236219489167228,0.22020272117384254,4886,COMPLETE
