number,value,datetime_start,datetime_complete,duration,params_alpha,params_colsample_bylevel,params_colsample_bytree,params_eta,params_gamma,params_grow_policy,params_lambda,params_max_depth,params_min_child_weight,params_subsample,user_attrs_n_estimators,state
0,0.7281686666666666,2021-08-09 04:16:52.728574,2021-08-09 04:16:56.322916,0 days 00:00:03.594342,0.009649160131594546,0.6309044533230426,0.7648231862743935,5.8188176671830336e-05,0.8213551618883401,depthwise,0.0015040495865755702,2,4.20556102065926,0.743730578628657,290,COMPLETE
1,0.7725026666666667,2021-08-09 04:16:56.323389,2021-08-09 04:16:59.996450,0 days 00:00:03.673061,5.3642394694682535e-05,0.9311936587670118,0.2566901602789508,8.324263855207259e-08,0.03328108365865132,lossguide,9.043978120025427e-06,7,1.6490444581281234,0.8808794361143211,76,COMPLETE
2,0.7481023333333333,2021-08-09 04:16:59.996861,2021-08-09 04:17:01.516709,0 days 00:00:01.519848,8.969017549786302e-08,0.5632461471616392,0.20424665527842256,0.0003832528472904579,6.56985013889926e-07,lossguide,0.005069336261939076,3,0.032596075821583935,0.5680146375338255,37,COMPLETE
3,0.8100886666666667,2021-08-09 04:17:01.517140,2021-08-09 04:18:33.520314,0 days 00:01:32.003174,0.005570762712968397,0.7049227194442773,0.4218522464999446,0.0026571724640929596,7.227391667908647e-05,lossguide,0.00017755834401194352,4,0.028257285986783266,0.8310393008166916,10000,COMPLETE
4,0.811978,2021-08-09 04:18:33.520758,2021-08-09 04:19:43.978582,0 days 00:01:10.457824,0.016505759591318652,0.5225111074321713,0.762674189114656,0.004377915058138586,0.00018039034016228362,lossguide,0.0025570597249236836,5,0.19915579819635595,0.7471086779855605,5980,COMPLETE
5,0.7439803333333334,2021-08-09 04:19:43.979132,2021-08-09 04:19:45.620361,0 days 00:00:01.641229,0.0005184064186825403,0.3399955704519183,0.6646684518890874,3.560475344048909e-07,0.2293219116486416,lossguide,0.19977959853494914,3,8.442831769033708,0.22403924122798724,54,COMPLETE
6,0.7632296666666667,2021-08-09 04:19:45.620787,2021-08-09 04:19:48.775725,0 days 00:00:03.154938,0.00026165568195910113,0.20907807842999981,0.37930009410964916,3.822577916688668e-06,1.2751571391545643e-05,depthwise,9.96419753924115e-07,6,0.1837621579300069,0.548678083549458,111,COMPLETE
7,0.8112940000000001,2021-08-09 04:19:48.776151,2021-08-09 04:20:00.629061,0 days 00:00:11.852910,0.04082057493864926,0.9121304243616668,0.4150332976087155,0.026834969609751905,0.1115845345285381,lossguide,4.203783421200529e-08,7,0.06849193486702997,0.5839487679999193,456,COMPLETE
8,0.7579393333333333,2021-08-09 04:20:00.629505,2021-08-09 04:20:02.177974,0 days 00:00:01.548469,1.4682389378329089e-07,0.48718258510180545,0.7285016712925061,1.5200801232237525e-05,2.1322916891346756e-05,depthwise,0.0006998015459041404,4,0.7932396406479811,0.6755938254712894,25,COMPLETE
9,0.8091636666666666,2021-08-09 04:20:02.178397,2021-08-09 04:20:24.124170,0 days 00:00:21.945773,0.0031149987938456558,0.4549926884227926,0.23894253613624486,0.03321265139628493,3.0541866473844456e-07,depthwise,5.885103482469452e-08,3,0.017302179016548448,0.6259125770895713,2724,COMPLETE
10,0.7848946666666666,2021-08-09 04:20:24.124595,2021-08-09 04:20:27.880817,0 days 00:00:03.756222,0.18001349530650274,0.7894776931101407,0.9420644319941531,0.8685512484321557,0.0024211509386988794,lossguide,0.974860786511708,9,0.22940609251418376,0.9999457195606787,5,COMPLETE
11,0.8119776666666666,2021-08-09 04:20:27.881245,2021-08-09 04:20:44.583525,0 days 00:00:16.702280,0.6163812951547554,0.9913815575479888,0.5469942254539814,0.022330056354153,0.003246964898299392,lossguide,1.0944182925515259e-08,8,0.10278273267837576,0.4401456109939581,435,COMPLETE
12,0.7675986666666667,2021-08-09 04:20:44.583946,2021-08-09 04:20:47.082813,0 days 00:00:02.498867,0.44171877450659297,0.9964370359629208,0.8660826338003353,0.6912838193545688,0.0019860173693443716,lossguide,0.03040135830678297,9,0.10666809148669328,0.41358288030756585,4,COMPLETE
13,0.8128943333333334,2021-08-09 04:20:47.083244,2021-08-09 04:21:55.576368,0 days 00:01:08.493124,0.6810073777875691,0.8209756426356503,0.5430220225440093,0.004214786349914508,0.001284984580753881,lossguide,8.957394646556802e-06,6,0.5331373112451191,0.4115746979405803,4422,COMPLETE
14,0.8093826666666667,2021-08-09 04:21:55.576807,2021-08-09 04:23:50.806619,0 days 00:01:55.229812,4.520041123928207e-06,0.7904697043811264,0.5779547164443039,0.0011489104972613358,0.00032401700625194206,lossguide,1.2198030633221714e-05,5,0.690158264793287,0.3102540821189297,10000,COMPLETE
15,0.8127706666666666,2021-08-09 04:23:50.807065,2021-08-09 04:25:01.310096,0 days 00:01:10.503031,0.06188551168845892,0.7678031557009659,0.8041879938554426,0.0042081230836880645,6.392652590379021e-06,lossguide,2.333597265215224e-05,6,1.3957324181714643,0.44370852150148776,4433,COMPLETE
16,0.7952066666666666,2021-08-09 04:25:01.310527,2021-08-09 04:28:00.791083,0 days 00:02:59.480556,0.9870341156294148,0.8062177538889519,0.8794969284089482,0.0001923763897415803,1.1245602583013733e-08,lossguide,1.293013329307808e-05,6,2.194119661187534,0.44532818157637044,10000,COMPLETE
17,0.789699,2021-08-09 04:28:00.791587,2021-08-09 04:28:05.809764,0 days 00:00:05.018177,9.203159465613203e-06,0.6493156094424951,0.5320420584291851,0.10735673825793211,1.9963831301635854e-06,lossguide,1.163041951585914e-06,1,1.4806057493631946,0.20254258847489526,640,COMPLETE
18,0.7853956666666667,2021-08-09 04:28:05.810207,2021-08-09 04:28:12.762758,0 days 00:00:06.952551,0.06217695934454865,0.7208966289641822,0.6847277894631645,2.715062988608767e-06,1.4047087272787833e-07,depthwise,1.1832404799410673e-06,7,9.593833724424703,0.3296642012359036,222,COMPLETE
19,0.8143133333333333,2021-08-09 04:28:12.763189,2021-08-09 04:29:18.794180,0 days 00:01:06.030991,0.0014398609299645932,0.8583151689398335,0.8383307266598753,0.005088748792080243,6.152495198884535e-06,lossguide,8.138775402834506e-05,6,19.432336678285015,0.48831208382221253,4642,COMPLETE
20,0.7856213333333333,2021-08-09 04:29:18.794619,2021-08-09 04:29:38.707764,0 days 00:00:19.913145,1.1580042691204857e-06,0.8542779118539153,0.9723132522741085,1.7132068650764044e-08,4.811656274070255e-08,lossguide,0.00014424928355221791,8,4.632500728641673,0.4949512957291395,400,COMPLETE
21,0.8145413333333332,2021-08-09 04:29:38.708189,2021-08-09 04:31:00.868127,0 days 00:01:22.159938,0.07845841687952804,0.8672826935403937,0.8318488292845798,0.00431124227254717,5.258401072131559e-06,lossguide,4.152567616258735e-05,6,18.122339113009534,0.35910137797080965,5938,COMPLETE
22,0.809692,2021-08-09 04:31:00.868566,2021-08-09 04:33:23.482158,0 days 00:02:22.613592,1.0754132193398998e-08,0.8860439055183656,0.6360436335906723,0.0007408514981249553,3.209496285178461e-06,lossguide,0.00010261082246602486,6,17.300608135959322,0.34413605309376905,10000,COMPLETE
23,0.8090416666666668,2021-08-09 04:33:23.482610,2021-08-09 04:33:27.437692,0 days 00:00:03.955082,0.001436710776523357,0.8734663258231613,0.4879717137540621,0.15883267302596948,4.867147790467492e-05,lossguide,3.496075437491847e-06,5,16.855637957874485,0.28696608692121023,253,COMPLETE
24,0.789761,2021-08-09 04:33:27.438130,2021-08-09 04:33:37.714972,0 days 00:00:10.276842,0.1271470594478115,0.7013829826320905,0.8525414512079069,6.220863587379912e-05,0.00026570418203222514,lossguide,2.3568167615498516e-07,8,4.899996890852648,0.38938101671237396,197,COMPLETE
25,0.813349,2021-08-09 04:33:37.715414,2021-08-09 04:34:01.036849,0 days 00:00:23.321435,5.971484885159413e-05,0.9435753807840183,0.909964952518247,0.01660520009880198,0.0007436872704694781,lossguide,6.798917881282036e-05,5,9.985385073254529,0.4823437504765732,1900,COMPLETE
26,0.8126696666666667,2021-08-09 04:34:01.037279,2021-08-09 04:34:36.683753,0 days 00:00:35.646474,6.398507409886075e-05,0.9471915910432481,0.9958379101515704,0.013346316282527804,0.011803326915511203,depthwise,0.0006371725634321533,4,9.633865076933406,0.5123114806869843,3635,COMPLETE
27,0.8118253333333333,2021-08-09 04:34:36.684195,2021-08-09 04:34:42.053786,0 days 00:00:05.369591,0.0009530433478634363,0.9493677167325033,0.9305977851075732,0.1093439660194273,1.0091928880487595e-06,lossguide,3.8014860657664825e-05,5,18.62787809120296,0.644893617004957,343,COMPLETE
28,0.8127906666666668,2021-08-09 04:34:42.054222,2021-08-09 04:38:27.443217,0 days 00:03:45.388995,2.098854066738399e-05,0.8635604340358803,0.8307189464337581,0.000941960466793469,2.6679212993694334e-05,lossguide,0.016246674347403227,7,3.0266090777371306,0.491522840908188,10000,COMPLETE
29,0.7569886666666665,2021-08-09 04:38:27.443687,2021-08-09 04:38:29.435526,0 days 00:00:01.991839,0.00018600748880255716,0.5904809875679191,0.9119847215740621,1.7902144326749498e-05,0.0005528091935528132,depthwise,0.00042770621690088693,4,7.54261354681923,0.7059967995835966,69,COMPLETE
30,0.806736,2021-08-09 04:38:29.436010,2021-08-09 04:39:39.015311,0 days 00:01:09.579301,0.010746981390749923,0.6315322662162921,0.7840895473750755,0.009245735978841964,4.65875940906576e-06,lossguide,5.3540474910141695e-05,2,6.097932380055625,0.37025289028673414,10000,COMPLETE
31,0.7793863333333334,2021-08-09 04:39:39.015745,2021-08-09 04:39:44.435870,0 days 00:00:05.420125,0.022722227010637613,0.8315359183385573,0.7122329317741003,0.00014131395516780407,0.0011067194597201692,lossguide,4.21306879984224e-06,6,13.400630169615791,0.2615689450063148,230,COMPLETE
32,0.812875,2021-08-09 04:39:44.436291,2021-08-09 04:41:17.497501,0 days 00:01:33.061210,0.18876292232826736,0.9210608578170061,0.6176838784840358,0.003387836425240364,7.229297320478865e-05,lossguide,0.0002620668968435424,5,3.1835136310998653,0.5309338273314017,8107,COMPLETE
33,0.8096466666666666,2021-08-09 04:41:17.497933,2021-08-09 04:41:22.042461,0 days 00:00:04.544528,0.005365342370728825,0.7439232760580506,0.7493618736532592,0.07654076837632745,0.000710311841225117,lossguide,3.955779853667535e-06,6,0.41943096467200636,0.47735801873051353,193,COMPLETE
34,0.7782173333333334,2021-08-09 04:41:22.042887,2021-08-09 04:41:24.382052,0 days 00:00:02.339165,2.7526237519312155e-05,0.8244191380130794,0.3301608937408535,0.00037628128605424497,0.009265508718083874,lossguide,4.555627211026338e-05,7,11.951205066253394,0.39090337725759194,25,COMPLETE
35,0.8119473333333334,2021-08-09 04:41:24.382503,2021-08-09 04:43:22.251802,0 days 00:01:57.869299,0.002176150245812021,0.6728220186402264,0.8951267566634525,0.001921656237718376,0.011848025584108742,lossguide,0.0012223464488220635,5,3.2289672950904365,0.5881529690402771,10000,COMPLETE
36,0.8139906666666666,2021-08-09 04:43:22.252235,2021-08-09 04:43:59.314614,0 days 00:00:37.062379,0.00042631587357987426,0.9593210357021968,0.8162373024314965,0.008701493769616797,0.0001581808120219457,lossguide,0.002704851251830744,7,6.400997034226258,0.279496433632819,1882,COMPLETE
37,0.8006943333333334,2021-08-09 04:43:59.315043,2021-08-09 04:44:01.481204,0 days 00:00:02.166161,0.00012080341855675661,0.9842918430693629,0.8223936871181167,0.3229796431877806,0.0001312060194037108,lossguide,0.004067574032818675,7,6.858527577329829,0.24529735513600287,26,COMPLETE
38,0.8137690000000001,2021-08-09 04:44:01.481626,2021-08-09 04:44:11.938222,0 days 00:00:10.456596,0.00041013089451291587,0.8978211014596552,0.7937821312990352,0.03839983894890171,8.172315081232414e-06,lossguide,0.01513362015552925,8,19.927522829950057,0.28151649786202354,459,COMPLETE
39,0.8136166666666665,2021-08-09 04:44:11.938648,2021-08-09 04:44:21.667373,0 days 00:00:09.728725,0.00070517515722675,0.903363266142686,0.756561006406463,0.04473438985236387,1.3388929551705858e-05,depthwise,0.014914029247065306,8,18.511432903996845,0.27802117356646205,423,COMPLETE
40,0.8139989999999999,2021-08-09 04:44:21.667798,2021-08-09 04:45:08.292838,0 days 00:00:46.625040,0.0046444993841974844,0.8906193552697047,0.6746376006255604,0.007953637943759698,9.917620387744963e-07,lossguide,0.06415132432866705,9,4.83175476637414,0.34846634388297715,1351,COMPLETE
41,0.8147453333333333,2021-08-09 04:45:08.293277,2021-08-09 04:45:44.986632,0 days 00:00:36.693355,0.0003941697478566776,0.8998717849206241,0.6999301033317645,0.01113960739102536,9.167259357362698e-07,lossguide,0.08858127774376666,9,12.387008701449027,0.3356036160764533,1301,COMPLETE
42,0.8150623333333332,2021-08-09 04:45:44.987072,2021-08-09 04:46:23.586128,0 days 00:00:38.599056,0.005518230869565364,0.39104016783472406,0.6793586845529833,0.008411364131071564,5.299252868499382e-07,lossguide,0.06589472029554141,9,12.315514360664594,0.33749121695332107,1727,COMPLETE
43,0.7884113333333334,2021-08-09 04:46:23.586592,2021-08-09 04:46:27.986259,0 days 00:00:04.399667,0.004981303164331842,0.23467732566700367,0.6675924641402131,0.00031140673587376223,4.1004191759317347e-07,lossguide,0.15879409306279413,9,12.171751537970142,0.3556290684391871,67,COMPLETE
44,0.8152823333333333,2021-08-09 04:46:27.986693,2021-08-09 04:49:30.655544,0 days 00:03:02.668851,0.014230773434441908,0.31951024342363865,0.7065276819005876,0.0016524178442847643,1.1110231820938072e-07,lossguide,0.09031317584733214,9,12.790146750670788,0.319211812701366,8844,COMPLETE
45,0.8150716666666667,2021-08-09 04:49:30.656000,2021-08-09 04:52:44.032995,0 days 00:03:13.376995,0.021961376244096734,0.36718339056685906,0.7204058488017666,0.0014336090608001442,1.2754650464886083e-07,lossguide,0.3179819295794481,9,12.848166342185355,0.23067426981100736,10000,COMPLETE
46,0.8142556666666666,2021-08-09 04:52:44.033469,2021-08-09 04:55:47.944147,0 days 00:03:03.910678,0.0193351411932237,0.4026915117710167,0.7118924637965983,0.0017521646269598615,8.371490454623557e-08,lossguide,0.8557954568342129,9,2.2603043460893133,0.2344268712097584,6410,COMPLETE
47,0.8129143333333334,2021-08-09 04:55:47.944593,2021-08-09 05:01:05.563083,0 days 00:05:17.618490,0.033162778187815746,0.30564114516234,0.5930178478511035,0.0006261184627476668,1.527631536902481e-08,depthwise,0.2639110446898823,9,8.047248531554631,0.8759535660042732,10000,COMPLETE
48,0.8154206666666667,2021-08-09 05:01:05.563547,2021-08-09 05:03:24.097669,0 days 00:02:18.534122,0.010490063785268773,0.34277764663335797,0.7298108393033977,0.0024913760720626983,2.0684478896888374e-07,lossguide,0.06778938697162015,9,11.80578298103789,0.32007135336696124,6563,COMPLETE
49,0.7945916666666667,2021-08-09 05:03:24.098111,2021-08-09 05:03:40.482432,0 days 00:00:16.384321,0.01374224270423512,0.3628754226016573,0.7340228771484095,2.0639517161658e-05,1.7582074556394397e-07,lossguide,0.0804739239735676,9,0.037307858116790986,0.20548757980610882,304,COMPLETE
50,0.783591,2021-08-09 05:03:40.482856,2021-08-09 05:03:43.522277,0 days 00:00:03.039421,0.27770924000922137,0.27735730056251906,0.6210164317271201,6.787883272475821e-05,2.9755131636340115e-08,lossguide,0.37314946981157615,8,12.379136423464496,0.3020009427433373,50,COMPLETE
51,0.8152396666666667,2021-08-09 05:03:43.522702,2021-08-09 05:06:41.162020,0 days 00:02:57.639318,0.08069290052871772,0.4442593407395188,0.7015278772371408,0.0016879567994022126,2.958833549525477e-07,lossguide,0.0949878682463327,9,14.294486555609918,0.33248734219228565,7780,COMPLETE
52,0.815354,2021-08-09 05:06:41.162480,2021-08-09 05:09:45.020231,0 days 00:03:03.857751,0.01098775317946774,0.4336217361632427,0.6508264986748367,0.0017566654052557928,3.2670851724511557e-07,lossguide,0.03923561701323976,9,12.842673171429926,0.31770972811609594,8696,COMPLETE
53,0.8148073333333334,2021-08-09 05:09:45.020678,2021-08-09 05:13:01.753671,0 days 00:03:16.732993,0.007772420536074153,0.424452647306117,0.6483874665945907,0.0015956473009321966,2.8471581388175916e-07,lossguide,0.03632898543971357,8,6.11782893755799,0.30662861865038815,10000,COMPLETE
54,0.7925193333333334,2021-08-09 05:13:01.754130,2021-08-09 05:13:17.333359,0 days 00:00:15.579229,0.0332454143045058,0.4867120253412837,0.5734690358882145,0.000239436527719803,7.636736251772274e-08,lossguide,0.6774244593180073,9,9.018388414096092,0.23894977667236006,431,COMPLETE
55,0.7925806666666667,2021-08-09 05:13:17.333798,2021-08-09 05:13:23.299251,0 days 00:00:05.965453,0.09831421176391662,0.3594432315427927,0.774167052052632,0.0004690024032147705,2.855160889125365e-08,lossguide,0.007173666426210221,9,13.95514974868605,0.4148551711572749,95,COMPLETE
56,0.8126143333333333,2021-08-09 05:13:23.299670,2021-08-09 05:15:35.300881,0 days 00:02:12.001211,0.3434818922595802,0.3962831817662922,0.6621258715571958,0.002187747852087828,4.850757106448629e-07,lossguide,0.13827062834359724,8,0.011802034789574915,0.31608443009127724,4851,COMPLETE
57,0.813146,2021-08-09 05:15:35.301333,2021-08-09 05:22:55.112627,0 days 00:07:19.811294,0.002977454297696733,0.5521678126566325,0.7211748301721033,0.0007610207037644618,1.730573072776822e-06,lossguide,0.39131397433179016,9,3.7877871855595027,0.9746510660810852,10000,COMPLETE
