number,value,datetime_start,datetime_complete,duration,params_alpha,params_colsample_bylevel,params_colsample_bytree,params_eta,params_gamma,params_grow_policy,params_lambda,params_max_depth,params_min_child_weight,params_subsample,user_attrs_n_estimators,state
75,0.8141476666666666,2021-08-08 12:04:38.004500,2021-08-08 12:05:13.404118,0 days 00:00:35.399618,0.00010241675426465374,0.4080441382101664,0.7483844970035846,0.008874126806699694,0.10031872168349244,depthwise,0.0027792580083248145,8,16.129078726076195,0.3140724863643492,2114,COMPLETE
76,0.8144426666666668,2021-08-08 12:05:13.404566,2021-08-08 12:06:55.653476,0 days 00:01:42.248910,1.9024000137314852e-05,0.4902303914597141,0.6957739579691254,0.0030756167839313857,0.11666912796145987,depthwise,0.0017957812754048235,8,14.447782758338315,0.3226570732796861,5659,COMPLETE
77,0.8142970000000002,2021-08-08 12:06:55.653932,2021-08-08 12:08:36.920570,0 days 00:01:41.266638,4.592035802025671e-06,0.425651787488059,0.743823506016595,0.002952313156424062,0.13884816160442862,depthwise,0.007206712356699305,8,15.478535136937637,0.3288092239729006,5698,COMPLETE
78,0.8142073333333334,2021-08-08 12:08:36.921040,2021-08-08 12:11:33.897060,0 days 00:02:56.976020,9.016002235595213e-06,0.5085196847828118,0.6451170857302349,0.00163102323391675,0.14715288739617421,depthwise,0.0095930340555992,8,15.138159547322097,0.3187676606197568,10000,COMPLETE
79,0.8144293333333333,2021-08-08 12:11:33.897543,2021-08-08 12:14:25.281436,0 days 00:02:51.383893,3.948160443749358e-06,0.49192651432100887,0.6190865618571638,0.0016984641545555344,0.16054818308022137,depthwise,0.06896386752943132,8,11.957304377965746,0.33393909230600943,10000,COMPLETE
80,0.8143206666666667,2021-08-08 12:14:25.282013,2021-08-08 12:16:07.121376,0 days 00:01:41.839363,3.3902329872484933e-06,0.4918230809563061,0.6202184832129611,0.0030187375987295534,0.373299192627395,depthwise,0.07621071612621362,8,11.475415711084791,0.257921255615175,6220,COMPLETE
81,0.814148,2021-08-08 12:16:07.121840,2021-08-08 12:17:47.559929,0 days 00:01:40.438089,3.0735862636533296e-06,0.5551050124229944,0.612523845076968,0.003208991829517156,0.4897951885016802,depthwise,0.08119662523825515,8,12.76080626370487,0.2568532686067951,5795,COMPLETE
82,0.8115969999999999,2021-08-08 12:17:47.560394,2021-08-08 12:20:42.518433,0 days 00:02:54.958039,3.6515620322547386e-06,0.4775166816763507,0.5516012441548587,0.000804552392452183,0.16051491382016328,depthwise,0.24041346385691173,8,11.331178144291993,0.23303621264725172,10000,COMPLETE
83,0.8073696666666667,2021-08-08 12:20:42.518927,2021-08-08 12:24:43.425181,0 days 00:04:00.906254,5.920507264067456e-07,0.44922104969640736,0.7453302401302698,0.00034346924161020114,0.43788064693219814,depthwise,0.056787061379699806,8,8.956849107108175,0.29420286621978226,10000,COMPLETE
