number,value,datetime_start,datetime_complete,duration,params_alpha,params_colsample_bylevel,params_colsample_bytree,params_eta,params_gamma,params_grow_policy,params_lambda,params_max_depth,params_min_child_weight,params_subsample,user_attrs_n_estimators,state
75,0.8105833333333333,2021-08-08 16:56:09.875845,2021-08-08 16:56:31.106782,0 days 00:00:21.230937,0.0008743269003722,0.8721550092223236,0.3304011351309397,0.01453080558043,0.028419387284593443,depthwise,4.7115865019113464e-07,8,6.058961708615528,0.805415264111054,901,COMPLETE
76,0.81139,2021-08-08 16:56:31.107220,2021-08-08 16:57:38.513470,0 days 00:01:07.406250,1.4869313384919862e-07,0.9993594545127964,0.5391260022938749,0.004850573853361523,0.004142609751966403,depthwise,2.6304746709745673e-08,9,8.325202606363856,0.3655304998709745,2412,COMPLETE
77,0.8113256666666667,2021-08-08 16:57:38.513933,2021-08-08 16:58:51.353661,0 days 00:01:12.839728,9.782242608750463e-08,0.9425912922229853,0.5264028666257662,0.004784798423939608,0.004069470495075996,depthwise,4.049860888449252e-08,9,8.865886956895089,0.38949815746776595,2677,COMPLETE
78,0.8117219999999999,2021-08-08 16:58:51.354111,2021-08-08 17:00:21.900754,0 days 00:01:30.546643,1.2897601894021265e-07,0.2015182238112223,0.5335198110789796,0.004181480262695386,0.002343697037058068,depthwise,1.1496421171034505e-08,9,8.621905176554561,0.35308362217797534,4837,COMPLETE
79,0.8106836666666667,2021-08-08 17:00:21.901220,2021-08-08 17:01:29.962309,0 days 00:01:08.061089,1.4750746519045805e-07,0.9723414350973297,0.5038662777072237,0.004856251522976051,0.002590590553481935,depthwise,1.084548371256783e-08,9,4.0588584240930885,0.38662352905517483,2023,COMPLETE
80,0.7932813333333333,2021-08-08 17:01:29.962767,2021-08-08 17:01:35.889759,0 days 00:00:05.926992,1.1210733299629861e-07,0.9959146581687003,0.5299864962912838,0.00040580036857731233,0.0008514361883567767,depthwise,3.186001539503283e-08,9,2.4780712389873503,0.3346765002425145,52,COMPLETE
81,0.810347,2021-08-08 17:01:35.890224,2021-08-08 17:05:05.400681,0 days 00:03:29.510457,6.397211886482827e-08,0.2051906224734917,0.5361492588663467,0.0010615716159459564,0.00040966361038307383,depthwise,4.783499113598785e-08,9,8.70473918149341,0.43682578671245664,10000,COMPLETE
82,0.810434,2021-08-08 17:05:05.401152,2021-08-08 17:05:42.874170,0 days 00:00:37.473018,5.239134132397489e-07,0.22657286369233845,0.552971780834702,0.009346076072927237,0.003958479270386408,depthwise,1.1503705745512214e-08,9,3.220119281657716,0.3426790594457001,1523,COMPLETE
83,0.8099219999999999,2021-08-08 17:05:42.874622,2021-08-08 17:07:33.399465,0 days 00:01:50.524843,2.3646435600836864e-08,0.2639773082625521,0.5866800040329164,0.002587099766345263,2.6646179004762516e-05,depthwise,6.052055847688298e-08,9,1.6655020896490373,0.40213260243141913,3616,COMPLETE
84,0.8109403333333334,2021-08-08 17:07:33.399928,2021-08-08 17:07:46.770833,0 days 00:00:13.370905,2.9340904128281985e-07,0.28588356427586603,0.47072109215712954,0.027305779144187116,0.007953233637356148,depthwise,2.6297103684304323e-08,9,12.27111142514722,0.35415678658089306,663,COMPLETE
85,0.7924803333333333,2021-08-08 17:07:46.771285,2021-08-08 17:08:04.117394,0 days 00:00:17.346109,1.0536419349179493e-06,0.9558976087954352,0.608515200485894,1.6265553700573998e-07,0.0007769316459779258,depthwise,8.9380228559216e-08,9,7.294906979264663,0.273727098312007,345,COMPLETE
86,0.8088236666666667,2021-08-08 17:08:04.117842,2021-08-08 17:08:58.156243,0 days 00:00:54.038401,3.915953677005023e-08,0.23516395189853465,0.5656856732104306,0.005164685925722189,0.17406655668183726,depthwise,3.453014724898139e-08,8,0.7042744847579587,0.44305413161214724,2328,COMPLETE
87,0.808196,2021-08-08 17:08:58.156709,2021-08-08 17:09:04.514767,0 days 00:00:06.358058,2.7779118634163927e-07,0.9620974685913984,0.5210824202217753,0.07012283054561128,0.00014829183207389277,lossguide,1.3807421888294976e-07,9,9.232009534142517,0.2868598195250047,180,COMPLETE
88,0.7855366666666667,2021-08-08 17:09:04.515218,2021-08-08 17:09:08.088715,0 days 00:00:03.573497,8.94263724695781e-08,0.5140555074681877,0.43236523023375895,0.00011823054067723695,0.01346476215116751,depthwise,1.001242838771975e-08,9,12.552654210490534,0.38042501160017494,41,COMPLETE
89,0.8054763333333333,2021-08-08 17:09:08.089189,2021-08-08 17:10:30.946462,0 days 00:01:22.857273,2.467954903893339e-06,0.9436396441112994,0.6294069474873119,0.0016817382469254487,0.0012180397329919698,depthwise,0.03639058978404576,4,5.566883652185961,0.2440394991961834,10000,COMPLETE
90,0.8075013333333333,2021-08-08 17:10:30.946930,2021-08-08 17:11:35.299247,0 days 00:01:04.352317,2.7138716578540987e-08,0.2927717639179366,0.6633424379081314,0.0038706595393920165,0.0021973449103813926,depthwise,2.1786882311147821e-07,8,0.16426824219703415,0.3212032576840783,2370,COMPLETE
91,0.8112750000000001,2021-08-08 17:11:35.299713,2021-08-08 17:13:30.061074,0 days 00:01:54.761361,1.922790831425333e-08,0.4661107766793241,0.5481679447036435,0.0022302486517850814,0.005598496948084862,depthwise,1.2282919591143396e-06,8,19.77489649728117,0.3577156444370897,7527,COMPLETE
