number,value,datetime_start,datetime_complete,duration,params_alpha,params_colsample_bylevel,params_colsample_bytree,params_eta,params_gamma,params_grow_policy,params_lambda,params_max_depth,params_min_child_weight,params_subsample,user_attrs_n_estimators,state
75,0.8130446666666667,2021-08-09 07:09:55.704341,2021-08-09 07:13:59.853892,0 days 00:04:04.149551,0.0036530605169525976,0.41478359776094087,0.6616499211402948,0.0007577605474625639,0.00038237746164301195,lossguide,2.4611773180482736e-06,9,11.397535356787758,0.3147774452807955,10000,COMPLETE
76,0.8143163333333333,2021-08-09 07:13:59.854374,2021-08-09 07:15:27.150896,0 days 00:01:27.296522,0.0084962662595224,0.4362247716571504,0.573654562000054,0.004002023555401343,3.527082289068865e-05,lossguide,1.2108072682716196e-06,9,7.334142249029249,0.38901227288338325,3429,COMPLETE
77,0.8136593333333333,2021-08-09 07:15:27.151358,2021-08-09 07:15:45.187966,0 days 00:00:18.036608,0.002251640681225777,0.5949156713202004,0.526972560239869,0.02156955186132293,0.00014717779904602958,lossguide,0.6318556904170503,8,9.080631454367335,0.44863566261269705,770,COMPLETE
78,0.7894199999999999,2021-08-09 07:15:45.188429,2021-08-09 07:16:48.067412,0 days 00:01:02.878983,0.01957785376128782,0.5126533154106739,0.6191625180054572,0.006940327877897851,0.02291769685644063,lossguide,1.1731006127829184e-05,1,12.699553037543042,0.4279432210964808,10000,COMPLETE
79,0.8117206666666666,2021-08-09 07:16:48.067900,2021-08-09 07:19:14.105049,0 days 00:02:26.037149,0.008129328199651906,0.45701966567529556,0.5673532228445011,0.0022669116543084364,1.762183100626334e-05,lossguide,5.09498563296084e-07,9,0.6255973233298208,0.34522855903851707,3636,COMPLETE
80,0.7565663333333333,2021-08-09 07:19:14.105527,2021-08-09 07:19:16.322060,0 days 00:00:02.216533,0.04321489118682317,0.5441548456528796,0.5377152852794997,0.000974482835852482,7.079892564243321e-05,lossguide,2.437545286436107e-06,4,0.034845150869670403,0.9820358532057318,109,COMPLETE
81,0.8145073333333334,2021-08-09 07:19:16.322511,2021-08-09 07:21:32.677293,0 days 00:02:16.354782,0.004622659694210484,0.47655339352047893,0.49167496356427126,0.0026006031878988713,0.00023285936729154733,lossguide,5.364156740959839e-06,9,17.765160675244523,0.3649120597552116,6901,COMPLETE
82,0.8146346666666666,2021-08-09 07:21:32.677762,2021-08-09 07:23:36.542797,0 days 00:02:03.865035,0.11328231876922341,0.5032767094384093,0.4976328455276343,0.0030581090900857495,0.0006367455309277465,lossguide,1.1503208918681683e-05,9,19.967170630731857,0.37640134255624264,6444,COMPLETE
