number,value,datetime_start,datetime_complete,duration,params_alpha,params_colsample_bylevel,params_colsample_bytree,params_eta,params_gamma,params_grow_policy,params_lambda,params_max_depth,params_min_child_weight,params_subsample,user_attrs_n_estimators,state
75,0.8113566666666667,2021-08-08 13:54:43.780784,2021-08-08 13:55:40.426677,0 days 00:00:56.645893,0.0008089081748729655,0.6327232894229151,0.4452094449556517,0.006777308688671008,0.10053361749191078,depthwise,3.8502936782199335e-08,9,19.98578193499961,0.9292988049418383,2502,COMPLETE
76,0.8064953333333333,2021-08-08 13:55:40.427124,2021-08-08 13:55:57.311932,0 days 00:00:16.884808,0.0007741324849508634,0.6299486026398697,0.44818306992480783,0.12428175115613094,0.1223101367436849,depthwise,3.3373072456734876e-08,2,19.92319190767234,0.9721260099779765,2462,COMPLETE
77,0.8102640000000001,2021-08-08 13:55:57.312384,2021-08-08 13:56:06.744821,0 days 00:00:09.432437,7.107026360848145e-05,0.6930135733335219,0.37499166532859063,0.045149514644369546,0.4755394682740229,depthwise,1.0605746969834301e-07,8,13.976750020344108,0.882286118739798,439,COMPLETE
78,0.8108456666666667,2021-08-08 13:56:06.745272,2021-08-08 13:56:22.362558,0 days 00:00:15.617286,0.0002838529866733609,0.6097918424799896,0.34268177814143985,0.026039452499853285,0.18004716563393539,depthwise,2.1439057313172118e-08,8,10.76615477090174,0.9993926309407948,736,COMPLETE
79,0.8111666666666667,2021-08-08 13:56:22.363114,2021-08-08 13:57:03.579401,0 days 00:00:41.216287,0.0012064853950965143,0.63958527039085,0.41306088536749114,0.008483246035834405,0.4277300561934417,depthwise,3.5719154727351137e-07,9,15.697262471890935,0.9259158812263751,1709,COMPLETE
80,0.8110003333333333,2021-08-08 13:57:03.579853,2021-08-08 13:57:38.978591,0 days 00:00:35.398738,0.0014051535269552424,0.8463678041094396,0.39782878207332634,0.010628315740924817,0.5014263871969403,depthwise,9.212764837616828e-07,9,16.005847939006777,0.9247592359479936,1412,COMPLETE
81,0.8110710000000001,2021-08-08 13:57:38.979065,2021-08-08 13:58:15.671778,0 days 00:00:36.692713,0.0013591520711112091,0.8335580955829784,0.4095572496914706,0.010303887788501446,0.511039573616774,depthwise,1.242477055261334e-06,9,16.12951922540907,0.9274314004519153,1483,COMPLETE
82,0.8110763333333333,2021-08-08 13:58:15.672225,2021-08-08 13:58:53.263669,0 days 00:00:37.591444,0.0015253009724891884,0.8241633890122904,0.4100216099783499,0.010144433808775888,0.5192196886223623,depthwise,9.0505710588088e-07,9,16.16493310702988,0.929084868141825,1525,COMPLETE
83,0.8108856666666666,2021-08-08 13:58:53.264127,2021-08-08 13:59:25.572040,0 days 00:00:32.307913,0.0014942396789552712,0.8419179558648702,0.3952601986239679,0.010462914033871167,0.5995295535051995,depthwise,1.2226022185807558e-06,8,15.104379041190382,0.9264488359260221,1625,COMPLETE
84,0.810896,2021-08-08 13:59:25.572495,2021-08-08 14:00:59.786441,0 days 00:01:34.213946,0.002076892874257815,0.9530971081653823,0.41674896217476615,0.003590460219921893,0.9479361501879943,depthwise,3.619347267608827e-06,9,7.281033786130356,0.8556714772489561,3138,COMPLETE
85,0.8101773333333333,2021-08-08 14:00:59.786907,2021-08-08 14:01:07.603178,0 days 00:00:07.816271,0.0005818811033885518,0.8525644017109708,0.3543047290801804,0.05523888224640069,0.44073708767284614,depthwise,9.160024139327673e-07,9,12.215915787898775,0.8609360424561895,243,COMPLETE
86,0.8109959999999999,2021-08-08 14:01:07.603619,2021-08-08 14:01:56.675819,0 days 00:00:49.072200,0.006968603877005309,0.7654724064369918,0.4567263686721533,0.00702901006804496,0.10412202593493038,depthwise,1.967781976854611e-07,8,15.31477094939219,0.9716763473287572,2442,COMPLETE
87,0.8077253333333333,2021-08-08 14:01:56.676274,2021-08-08 14:02:01.474875,0 days 00:00:04.798601,0.0012627479670468693,0.919853374211107,0.38771313932928875,0.10790616727011305,0.542995433461515,depthwise,1.378253086784341e-06,9,4.84768246281861,0.9067023022959237,90,COMPLETE
88,0.8110276666666666,2021-08-08 14:02:01.475327,2021-08-08 14:03:30.221961,0 days 00:01:28.746634,0.00296475917999985,0.7344860442989956,0.42333713386446525,0.0034764660096240243,0.9418856164359714,depthwise,4.5740907225423433e-07,8,12.65295296235395,0.9294783796981988,4649,COMPLETE
89,0.810607,2021-08-08 14:03:30.222438,2021-08-08 14:04:16.510613,0 days 00:00:46.288175,0.002818612345457482,0.714874765877423,0.4867416604132524,0.006371202563856451,0.9645203349040333,depthwise,4.548993190230937e-07,8,7.593270827313848,0.9626704559385406,2114,COMPLETE
90,0.8110116666666668,2021-08-08 14:04:16.511079,2021-08-08 14:05:49.287540,0 days 00:01:32.776461,0.00019275197285584272,0.7767990257344675,0.424804320860616,0.0035601893804506506,0.06245610284008502,depthwise,1.3459559925652117e-07,8,11.647928291027608,0.9374747275526644,4495,COMPLETE
91,0.8110010000000001,2021-08-08 14:05:49.288008,2021-08-08 14:07:13.792335,0 days 00:01:24.504327,0.0002142013637493837,0.7681360511212495,0.4228551179650905,0.0040160708943337425,0.0599667807430296,depthwise,1.2387448732136134e-07,8,12.736913891586665,0.9353925749223031,4180,COMPLETE
92,0.8107843333333333,2021-08-08 14:07:13.792812,2021-08-08 14:07:37.389705,0 days 00:00:23.596893,0.0006124470642851776,0.7787940045124971,0.3126899928849265,0.017338195591839464,0.14908953339539932,depthwise,5.318125356170539e-08,9,12.050099473138328,0.8930584899378635,896,COMPLETE
