number,value,datetime_start,datetime_complete,duration,params_alpha,params_colsample_bylevel,params_colsample_bytree,params_eta,params_gamma,params_grow_policy,params_lambda,params_max_depth,params_min_child_weight,params_subsample,user_attrs_n_estimators,state
0,0.7766320000000001,2021-08-09 11:05:35.946793,2021-08-09 11:05:38.836845,0 days 00:00:02.890052,6.368820410313915e-06,0.488385985596001,0.5403758959772881,0.8207569979864698,1.3598522432816645e-08,lossguide,4.1337961478960544e-08,9,1.0206322240060293,0.5804671573836432,6,COMPLETE
1,0.8096890000000001,2021-08-09 11:05:38.837331,2021-08-09 11:05:42.297057,0 days 00:00:03.459726,0.00019337122751046602,0.6436545891100534,0.9530731221552327,0.17565259064189842,0.00019741731250948346,lossguide,0.07372496995751494,4,2.7839717237593855,0.8676158799188141,258,COMPLETE
2,0.7843706666666667,2021-08-09 11:05:42.297557,2021-08-09 11:05:47.191505,0 days 00:00:04.893948,7.054060731780936e-05,0.9466733332885631,0.3086560395512856,2.817363604064541e-07,0.035067087398206485,depthwise,0.01788394470484141,9,1.7619852243502139,0.907688145139768,28,COMPLETE
3,0.7269073333333332,2021-08-09 11:05:47.191939,2021-08-09 11:05:49.433479,0 days 00:00:02.241540,1.7581120362808833e-07,0.21435619837539477,0.3114830970515101,6.582726058347801e-06,0.028156596455726386,depthwise,0.008177842331908523,1,0.1228660587247911,0.7034357970280121,199,COMPLETE
4,0.773642,2021-08-09 11:05:49.433922,2021-08-09 11:05:51.721039,0 days 00:00:02.287117,0.00010278962782693555,0.8847413969949329,0.35688288665168966,2.888124049971878e-07,1.923654477217917e-08,lossguide,7.349478282410752e-06,6,0.2762794378445521,0.5008694742910268,49,COMPLETE
5,0.8107526666666667,2021-08-09 11:05:51.721485,2021-08-09 11:05:56.401221,0 days 00:00:04.679736,3.9338122809996564e-06,0.3219064187435999,0.786242560876828,0.08178985190432778,0.0044507692177696385,lossguide,6.38571949258397e-06,5,2.2945933775952287,0.5289725839012493,345,COMPLETE
6,0.7288093333333334,2021-08-09 11:05:56.401739,2021-08-09 11:05:59.405258,0 days 00:00:03.003519,0.007539736643538115,0.6927904440298656,0.771011964726646,1.017522204391672e-05,1.7808297676971418e-06,depthwise,0.00342445688621422,2,0.9072266738553681,0.6507133603072616,280,COMPLETE
7,0.7411106666666667,2021-08-09 11:05:59.405698,2021-08-09 11:06:01.202269,0 days 00:00:01.796571,1.884339319331651e-05,0.7268541886155107,0.3922441694562321,0.0002624876704663233,5.568004504749724e-07,depthwise,0.004558123357022459,3,7.817974233268746,0.38885480543925066,84,COMPLETE
8,0.7802226666666666,2021-08-09 11:06:01.202709,2021-08-09 11:06:04.900443,0 days 00:00:03.697734,1.6697140878674524e-06,0.652669897237678,0.9351831204476253,3.6809391667727255e-06,0.00011892056453990376,depthwise,0.0015762341129142287,7,0.09442201938901165,0.7871121376038535,69,COMPLETE
9,0.7798296666666666,2021-08-09 11:06:04.900883,2021-08-09 11:06:10.680630,0 days 00:00:05.779747,1.787179740593499e-06,0.9260744002649537,0.3700387673792671,2.372759154320326e-08,6.2942276630861575e-06,lossguide,7.069199568599388e-05,7,0.19180103244617908,0.8436494151535645,175,COMPLETE
10,0.8109766666666666,2021-08-09 11:06:10.681073,2021-08-09 11:06:56.227030,0 days 00:00:45.545957,0.2983668130914805,0.2778643249945202,0.6800079597554837,0.005854741482910713,0.8390203656787973,lossguide,5.026621581427889e-07,5,0.011847711030490433,0.22870335552591942,4591,COMPLETE
11,0.8110106666666667,2021-08-09 11:06:56.227470,2021-08-09 11:07:47.748316,0 days 00:00:51.520846,0.6910850775412791,0.23382882978231856,0.7087360870410323,0.007204767578694823,0.87040899436025,lossguide,7.193506433713993e-07,4,0.010220139163530394,0.21173583644491836,6328,COMPLETE
12,0.809506,2021-08-09 11:07:47.748755,2021-08-09 11:09:08.964517,0 days 00:01:21.215762,0.9524367553840972,0.3859970915304908,0.6421844359120354,0.0024414484242088154,0.06146134676753886,lossguide,3.47113378448026e-08,4,0.011041485174783094,0.2014057730616357,10000,COMPLETE
13,0.8113440000000001,2021-08-09 11:09:08.965081,2021-08-09 11:10:31.698507,0 days 00:01:22.733426,0.4262713784894341,0.20214789932775729,0.596655481991204,0.004113926789645418,0.962509170085919,lossguide,4.850869802951532e-07,5,0.011837106144745953,0.21386531972678402,8540,COMPLETE
14,0.8092003333333334,2021-08-09 11:10:31.698949,2021-08-09 11:11:41.781849,0 days 00:01:10.082900,0.01581520435968855,0.4641934089349844,0.5061865912232347,0.0063507740850649716,0.8577693239998618,lossguide,7.441932570090274e-07,3,0.03665307825395605,0.3430465468641946,10000,COMPLETE
15,0.7747153333333333,2021-08-09 11:11:41.782291,2021-08-09 11:11:45.377969,0 days 00:00:03.595678,0.034994884456459534,0.21961619153694245,0.7769775232862681,0.00032643899410667694,0.0013151736188205842,lossguide,1.1085717735069123e-08,6,0.037059027059360976,0.33894780743567055,147,COMPLETE
16,0.8100586666666666,2021-08-09 11:11:45.378404,2021-08-09 11:11:57.039413,0 days 00:00:11.661009,0.0014613300106483997,0.521707182358275,0.5211896703639388,0.0266391781563086,0.220892787404792,lossguide,4.57312440568899e-07,4,0.03273921077033064,0.4138350978646795,1291,COMPLETE
17,0.811477,2021-08-09 11:11:57.039870,2021-08-09 11:14:33.519437,0 days 00:02:36.479567,0.1294366366974295,0.3841677437674248,0.8585052793631995,0.0013281716057277945,0.0035548886456153324,lossguide,0.00013282928471408426,7,0.021579725724337598,0.2801296524038176,8411,COMPLETE
18,0.7895206666666666,2021-08-09 11:14:33.519888,2021-08-09 11:14:38.789143,0 days 00:00:05.269255,0.08123494028680643,0.3577090869276326,0.8703306707944771,5.0544466869287787e-05,0.002372642444711092,lossguide,0.8559931614879271,8,0.061460726229624556,0.2918526227034717,92,COMPLETE
19,0.8103733333333333,2021-08-09 11:14:38.789646,2021-08-09 11:17:59.148593,0 days 00:03:20.358947,0.0009284091506583889,0.40580530497077616,0.5891549873184746,0.0006883392414159724,1.916375279145541e-05,lossguide,0.0003013715784047746,7,0.028145772499102488,0.46082028040646605,10000,COMPLETE
20,0.7727923333333333,2021-08-09 11:17:59.149030,2021-08-09 11:18:03.077832,0 days 00:00:03.928802,1.5658542112400674e-08,0.5535566443381703,0.4577728251488783,4.3530290029101875e-05,0.00063496541060825,lossguide,4.2337551940176504e-05,6,0.34350486066045505,0.9934092536633653,160,COMPLETE
21,0.8109896666666666,2021-08-09 11:18:03.078241,2021-08-09 11:18:27.215277,0 days 00:00:24.137036,0.8944261796713028,0.27521278932404153,0.21160167385286233,0.02295130425197036,0.009790134091548695,lossguide,3.136833522702903e-06,5,0.010006676052803393,0.2793111135253738,2419,COMPLETE
22,0.8034509999999999,2021-08-09 11:18:27.215741,2021-08-09 11:19:37.490328,0 days 00:01:10.274587,0.1541987412183103,0.29489701552277225,0.6838728666733749,0.0017295546272250429,0.2332105083041234,lossguide,0.0004028750440749926,3,0.019914994504451593,0.24487705294812173,10000,COMPLETE
23,0.809757,2021-08-09 11:19:37.490780,2021-08-09 11:19:50.951128,0 days 00:00:13.460348,0.005056553999344059,0.20124632360343414,0.8567889766393998,0.018617536576716345,0.14768441292361523,lossguide,2.2005956031378497e-05,8,0.018211985244845682,0.3168452249037528,439,COMPLETE
24,0.7702503333333334,2021-08-09 11:19:50.951567,2021-08-09 11:19:53.191026,0 days 00:00:02.239459,0.056670890080665774,0.42310916949093624,0.733459447565717,0.001474741476891582,0.013072425495093342,lossguide,1.765911044163216e-07,5,0.06178203762565653,0.3801853050520804,85,COMPLETE
25,0.811753,2021-08-09 11:19:53.191460,2021-08-09 11:20:42.973160,0 days 00:00:49.781700,0.24487514393654913,0.33627669526591153,0.8641015890348299,0.0054556761097612014,0.5287212405294484,lossguide,2.370198379505995e-06,6,0.019367396146018553,0.2639775607690606,3765,COMPLETE
26,0.7890046666666666,2021-08-09 11:20:42.973665,2021-08-09 11:20:52.183880,0 days 00:00:09.210215,0.19095877691952262,0.3330623847070912,0.9847255362453964,0.00016694631048079774,0.08218937622924383,depthwise,2.726728411376986e-06,8,0.06128900588166363,0.4398028151035897,213,COMPLETE
27,0.788729,2021-08-09 11:20:52.184323,2021-08-09 11:20:53.782230,0 days 00:00:01.597907,0.0015100261059280914,0.4478283555540777,0.8578709813665567,0.3405689902903281,0.0005400234832382849,lossguide,0.00019770983710000996,6,0.020853371761983906,0.27022901663978904,17,COMPLETE
28,0.8090933333333333,2021-08-09 11:20:53.782669,2021-08-09 11:21:00.035457,0 days 00:00:06.252788,0.03416229380545576,0.7720273832463613,0.606937004306398,0.04604791853204331,0.005524274139931149,lossguide,2.2522227316796522e-05,7,0.12116107325855052,0.3542676449431771,208,COMPLETE
29,0.785467,2021-08-09 11:21:00.035909,2021-08-09 11:21:03.216263,0 days 00:00:03.180354,0.005532796558887168,0.5744790603908483,0.9055376755238354,0.48171697217845877,0.24982698772029072,lossguide,9.71043453093306e-08,9,0.765493236499793,0.5736836393750625,8,COMPLETE
30,0.8100343333333333,2021-08-09 11:21:03.216775,2021-08-09 11:23:12.969718,0 days 00:02:09.752943,0.2543319141552668,0.3540394867433643,0.8140087041925063,0.000824603237404889,0.020514217339292255,lossguide,9.50703015335702e-06,6,7.700431492994946,0.4869463653622389,10000,COMPLETE
31,0.8111793333333334,2021-08-09 11:23:12.970171,2021-08-09 11:24:10.485124,0 days 00:00:57.514953,0.8234439953128927,0.24108179815684133,0.7108651012965678,0.006515890414065418,0.7091025843973436,lossguide,1.8482907561446009e-06,4,0.01588958594936863,0.21048895768983822,7089,COMPLETE
32,0.8027603333333334,2021-08-09 11:24:10.485596,2021-08-09 11:24:13.072003,0 days 00:00:02.586407,0.0920303778525148,0.2564375611272354,0.5889952981740048,0.12110279778483869,0.40533560840096605,lossguide,1.8889593899785475e-06,4,0.017003112208263386,0.2649083459938598,177,COMPLETE
33,0.81122,2021-08-09 11:24:13.072438,2021-08-09 11:25:04.850029,0 days 00:00:51.777591,0.36437845453963313,0.4987230993880084,0.7371959993884344,0.0046312933616493605,0.07085441219809575,lossguide,2.523669112592204e-08,5,0.047660883786079106,0.20575023133153889,5054,COMPLETE
34,0.8110163333333333,2021-08-09 11:25:04.850475,2021-08-09 11:26:11.292647,0 days 00:01:06.442172,0.01949926526145824,0.4818614313714954,0.8211448905363076,0.003552798265869208,0.05761178993704886,lossguide,1.2831211317086731e-08,5,0.05794146528739739,0.29875048988355357,6451,COMPLETE
35,0.80877,2021-08-09 11:26:11.293085,2021-08-09 11:29:45.365589,0 days 00:03:34.072504,0.29289497554363675,0.5127181027804203,0.9983918402002061,0.00048025765438715134,0.030302337557649824,depthwise,2.2315694503849315e-07,7,0.02927021373160198,0.2978929141949412,10000,COMPLETE
36,0.7782276666666667,2021-08-09 11:29:45.366036,2021-08-09 11:29:47.903834,0 days 00:00:02.537798,0.0004342929207459775,0.37319717602312086,0.906544640091728,8.34711270214031e-05,0.09158694876904457,lossguide,3.0086994382502365e-08,6,0.20614147503475796,0.24704383611312486,72,COMPLETE
37,0.8108293333333334,2021-08-09 11:29:47.904254,2021-08-09 11:30:03.306339,0 days 00:00:15.402085,0.011063041580401662,0.610236559340513,0.6582614274612437,0.017450533288112607,0.012554620641471207,lossguide,5.818874552776617e-08,5,0.04537034831493385,0.3748268979521135,1396,COMPLETE
38,0.8131003333333333,2021-08-09 11:30:03.306767,2021-08-09 11:30:09.651817,0 days 00:00:06.345050,0.08824024639200052,0.30026693051071834,0.7528454316451554,0.08868249175098257,1.1606107604758828e-07,depthwise,0.048424369628841106,6,16.258462797868944,0.701679982769071,442,COMPLETE
39,0.8098960000000001,2021-08-09 11:30:09.652292,2021-08-09 11:30:13.010970,0 days 00:00:03.358678,0.07346024455794817,0.31410398777112875,0.9440091537342794,0.17200436946915737,5.8406934812740455e-08,depthwise,0.028714226157158733,8,5.755868880955056,0.7308286467606552,76,COMPLETE
40,0.790094,2021-08-09 11:30:13.011428,2021-08-09 11:30:14.807932,0 days 00:00:01.796504,0.003452631751151626,0.30908871059387166,0.818699918402497,0.826300680095429,2.6167835410228376e-05,depthwise,0.19763088994418582,7,1.9207519839306346,0.6999514401292848,10,COMPLETE
41,0.8119773333333332,2021-08-09 11:30:14.808368,2021-08-09 11:30:20.749485,0 days 00:00:05.941117,0.28745254165325235,0.4360661864336964,0.7458825846183966,0.06252576593393194,1.0936290157799835e-07,depthwise,0.0013160080871365335,6,3.4866254948127415,0.6057191439344527,360,COMPLETE
42,0.813622,2021-08-09 11:30:20.749912,2021-08-09 11:30:27.994945,0 days 00:00:07.245033,0.028784481924690217,0.42807747638971,0.7587533734526546,0.04978709508073727,1.7647257287346488e-07,depthwise,0.0012646212272907408,6,19.58324479881752,0.5791750352280873,517,COMPLETE
43,0.8135033333333334,2021-08-09 11:30:27.995407,2021-08-09 11:30:33.783831,0 days 00:00:05.788424,0.029153001718361656,0.42465468785324734,0.7547897838742769,0.07335318003872814,1.4443309273787332e-07,depthwise,0.001214532479263905,6,19.67437090725041,0.6101306847896204,391,COMPLETE
44,0.8130166666666666,2021-08-09 11:30:33.784299,2021-08-09 11:30:39.276525,0 days 00:00:05.492226,6.655179712646998e-05,0.421883751788372,0.752621535262841,0.0892288983189073,2.321530708257655e-07,depthwise,0.0011288541645297885,6,19.585452918778262,0.6414239231904407,364,COMPLETE
45,0.8136346666666667,2021-08-09 11:30:39.276994,2021-08-09 11:30:46.791030,0 days 00:00:07.514036,3.840117438770246e-05,0.42678866775817664,0.7518486867923779,0.05683890233801718,1.7743424739445694e-07,depthwise,0.0012894366067604393,6,18.769654768669625,0.6253165950305775,538,COMPLETE
46,0.8117643333333334,2021-08-09 11:30:46.791474,2021-08-09 11:30:50.332096,0 days 00:00:03.540622,4.7740401216405375e-05,0.5457852491839927,0.7726664041254473,0.14817896801240188,3.9701306344099455e-07,depthwise,0.009343372424122535,6,19.759344930379914,0.647788706763168,186,COMPLETE
47,0.8085983333333333,2021-08-09 11:30:50.332557,2021-08-09 11:30:52.709795,0 days 00:00:02.377238,1.4851810265027405e-05,0.41255597157031765,0.6290044475123829,0.27245571161809456,1.2481779337872552e-08,depthwise,0.0008053144562600162,7,19.08949990822307,0.5631388595053346,67,COMPLETE
48,0.813543,2021-08-09 11:30:52.710223,2021-08-09 11:31:01.137718,0 days 00:00:08.427495,0.000313683074363551,0.4672200334560255,0.8021745016542304,0.04970385242771956,4.797488362721567e-07,depthwise,0.0032395570781951423,6,12.891194247170287,0.6294875893991062,597,COMPLETE
49,0.7967243333333333,2021-08-09 11:31:01.138138,2021-08-09 11:31:02.727034,0 days 00:00:01.588896,0.0002612124022925934,0.6176334505670514,0.7919709510855211,0.8999658746599825,1.262070351971248e-06,depthwise,0.003454224422585052,5,13.234911685983175,0.7580424894787723,27,COMPLETE
50,0.7837500000000001,2021-08-09 11:31:02.727487,2021-08-09 11:31:07.557980,0 days 00:00:04.830493,9.94446801519276e-07,0.4668212661876876,0.6970429099351376,8.684895620044611e-07,3.699761153517742e-08,depthwise,0.07214578507093586,7,12.02885699057151,0.5267334415095587,153,COMPLETE
51,0.8135686666666665,2021-08-09 11:31:07.558446,2021-08-09 11:31:15.384518,0 days 00:00:07.826072,3.372357226132519e-05,0.4477480078104069,0.7414603417036245,0.05123131233352131,1.9495680983995616e-07,depthwise,0.009728723215137697,6,12.739605033799286,0.6290860885182601,549,COMPLETE
52,0.8140179999999999,2021-08-09 11:31:15.384980,2021-08-09 11:31:26.425277,0 days 00:00:11.040297,2.1777794916016158e-05,0.39114796385884887,0.7954388756711955,0.03699561142800265,1.211155564907497e-06,depthwise,0.013333669537589198,6,11.7748924040835,0.6043414164391346,825,COMPLETE
53,0.8141496666666667,2021-08-09 11:31:26.425741,2021-08-09 11:31:52.067822,0 days 00:00:25.642081,1.021950330843444e-05,0.3917158174277412,0.8026830854193309,0.01270471424166921,2.0232924582548173e-06,depthwise,0.00583461088776421,6,8.766615728363801,0.6043655523162278,2033,COMPLETE
54,0.814304,2021-08-09 11:31:52.068236,2021-08-09 11:32:19.129764,0 days 00:00:27.061528,7.385853903283141e-06,0.39547035887299503,0.8033621138361972,0.01331750741165299,2.5022644442235336e-06,depthwise,0.010360356099266693,6,9.290311809140698,0.6749470046057007,2149,COMPLETE
55,0.7901856666666668,2021-08-09 11:32:19.130228,2021-08-09 11:33:08.648750,0 days 00:00:49.518522,6.683557400468327e-06,0.38917497618630176,0.8371891442653787,0.013423087401777915,3.109332074253412e-06,depthwise,0.013773590564291734,1,4.7070076067938125,0.6717210705761876,8345,COMPLETE
56,0.8136033333333333,2021-08-09 11:33:08.649233,2021-08-09 11:33:45.711539,0 days 00:00:37.062306,3.0832688958211525e-05,0.36437064498467475,0.914755269953123,0.010279749782991926,1.1710861767749603e-06,depthwise,0.16448102985032037,5,9.809055558837352,0.5392699144465546,3751,COMPLETE
57,0.813431,2021-08-09 11:33:45.712006,2021-08-09 11:34:20.411615,0 days 00:00:34.699609,0.00012347318353057767,0.35607470343794867,0.8934570055538796,0.010341320637863837,9.83592610850285e-07,depthwise,0.3874571232558757,5,8.746105969401821,0.5429758350532232,3501,COMPLETE
58,0.8130413333333334,2021-08-09 11:34:20.412088,2021-08-09 11:34:33.541844,0 days 00:00:13.129756,5.112518138200568e-07,0.3912436843300553,0.9286965490237014,0.029244740269032152,5.61575710118204e-06,depthwise,0.15195397820953777,5,8.481381522875436,0.497487270754967,1239,COMPLETE
59,0.8122743333333333,2021-08-09 11:34:33.542316,2021-08-09 11:34:45.762683,0 days 00:00:12.220367,5.888683405143606e-06,0.5366600671656756,0.9637874006052739,0.030501737441837547,2.501033608893048e-05,depthwise,0.02637916069260082,5,3.315225113007947,0.6771341934041981,1041,COMPLETE
60,0.8122783333333334,2021-08-09 11:34:45.763155,2021-08-09 11:35:24.896538,0 days 00:00:39.133383,1.9364421681652236e-05,0.6893214510337624,0.8413197127052482,0.011049799572475306,2.4650656539669446e-06,depthwise,0.00045053458084767697,4,5.9851440453848,0.8100488429598749,4452,COMPLETE
61,0.8141470000000001,2021-08-09 11:35:24.897014,2021-08-09 11:37:14.238876,0 days 00:01:49.341862,3.626021086494824e-05,0.4466882487847721,0.7821198938612767,0.00254751169434661,9.620048503806243e-06,depthwise,0.007361852900909273,6,10.044630418383539,0.5850205905393768,9014,COMPLETE
62,0.8146070000000001,2021-08-09 11:37:14.239358,2021-08-09 11:37:46.815891,0 days 00:00:32.576533,1.1342769129542128e-05,0.49271158455391684,0.7849406285095121,0.009070827504808298,6.849231165857795e-06,depthwise,0.021546853058438013,7,10.84707287183197,0.5925126764768968,2029,COMPLETE
63,0.8142776666666668,2021-08-09 11:37:46.816356,2021-08-09 11:39:09.479355,0 days 00:01:22.662999,2.5138358563375147e-06,0.49354989086143847,0.7842725510394255,0.003433680952387472,1.1729438491467182e-05,depthwise,0.004760862634601894,7,6.2167726242147054,0.587156323881271,5020,COMPLETE
64,0.8141593333333333,2021-08-09 11:39:09.479819,2021-08-09 11:40:52.183309,0 days 00:01:42.703490,2.5580725348977438e-06,0.49224020435071747,0.7196055945523374,0.002820864422196602,7.318076232159941e-05,depthwise,0.00547741213681743,7,5.622990317189597,0.6723761022914446,6207,COMPLETE
65,0.8140983333333333,2021-08-09 11:40:52.183793,2021-08-09 11:43:00.436661,0 days 00:02:08.252868,2.4276001679092256e-06,0.581713912785364,0.7868752564768681,0.002379200773015687,6.146671218853328e-05,depthwise,0.0047204141461352125,8,4.517393803694081,0.6761364954457769,4921,COMPLETE
66,0.8139500000000001,2021-08-09 11:43:00.437148,2021-08-09 11:44:26.310574,0 days 00:01:25.873426,2.7318974798924355e-06,0.5927143408363478,0.7090072611764157,0.003152950227370613,1.2380575125426902e-05,depthwise,0.005582971451491954,7,4.970472394592471,0.7403896198048397,4938,COMPLETE
67,0.8131753333333333,2021-08-09 11:44:26.311042,2021-08-09 11:47:17.582088,0 days 00:02:51.271046,1.204075430715568e-07,0.5708235227727971,0.7840251182721312,0.0019266299823371717,6.878317590730574e-05,depthwise,0.0024334551216568844,8,1.3796104968436966,0.6757927318175263,5722,COMPLETE
68,0.8136913333333334,2021-08-09 11:47:17.582613,2021-08-09 11:53:32.405635,0 days 00:06:14.823022,3.382254005522903e-07,0.5033193458301701,0.6668260931991076,0.0007947861607469454,0.00011340713604656709,depthwise,0.005575032676619837,9,2.752659314221064,0.784220196528495,10000,COMPLETE
69,0.7903516666666667,2021-08-09 11:53:32.406097,2021-08-09 11:53:44.597036,0 days 00:00:12.190939,7.843203230845514e-06,0.6571391980656576,0.7179625912963832,0.00021352718881690818,5.1000786136895394e-05,depthwise,0.02741060113058734,8,6.30549118417443,0.6587573882768852,271,COMPLETE
70,0.8141843333333334,2021-08-09 11:53:44.597547,2021-08-09 11:57:45.449337,0 days 00:04:00.851790,1.3380773195233388e-06,0.5249540387429908,0.8822266918763573,0.001266530234335685,7.341535386343269e-06,depthwise,0.07029003992848003,8,4.142264345391405,0.5585017591591752,9461,COMPLETE
71,0.8141203333333333,2021-08-09 11:57:45.449925,2021-08-09 12:01:25.764540,0 days 00:03:40.314615,1.610979394680149e-06,0.4868005260792634,0.8791788643848717,0.0013620683655389888,0.00028584390780466313,depthwise,0.06169583109679208,8,4.123468137567279,0.5909504357525677,8700,COMPLETE
72,0.8140916666666667,2021-08-09 12:01:25.765006,2021-08-09 12:05:22.507546,0 days 00:03:56.742540,1.0852509935958288e-06,0.5239965847312302,0.8887552862542366,0.0013095587114806317,0.0002618526425679643,depthwise,0.04720555188131822,8,3.9658368395442944,0.5858069788196415,9120,COMPLETE
73,0.8122633333333334,2021-08-09 12:05:22.508011,2021-08-09 12:08:29.172280,0 days 00:03:06.664269,1.0468478535756e-05,0.4851748755506323,0.8368223677608486,0.0008312025036332953,8.356511230453777e-06,depthwise,0.09400019768212038,7,2.329558064995693,0.5176019410270044,10000,COMPLETE
