number,value,datetime_start,datetime_complete,duration,params_alpha,params_colsample_bylevel,params_colsample_bytree,params_eta,params_gamma,params_grow_policy,params_lambda,params_max_depth,params_min_child_weight,params_subsample,user_attrs_n_estimators,state
75,0.8132886666666667,2021-08-08 07:45:20.556131,2021-08-08 07:48:16.237344,0 days 00:02:55.681213,0.0080196505018451,0.5767732288347703,0.5643776738459464,0.0012929558400224578,7.731683896422829e-05,depthwise,0.08400585033566561,7,12.570896538523082,0.7873997243251151,10000,COMPLETE
76,0.814622,2021-08-08 07:48:16.237809,2021-08-08 07:49:18.079759,0 days 00:01:01.841950,0.0007904388504141487,0.5418394498146712,0.4926093618435219,0.0058236314794503806,1.3118797429763654e-05,depthwise,0.012494810977528461,7,19.381863785768868,0.7566912545088811,4111,COMPLETE
77,0.814486,2021-08-08 07:49:18.080209,2021-08-08 07:49:56.402061,0 days 00:00:38.321852,0.002325858294944204,0.5340537888965385,0.4990004508499157,0.009239209656696348,1.050864250178866e-05,depthwise,0.011075087388263856,7,16.75013022487524,0.759783076464086,2472,COMPLETE
78,0.780633,2021-08-08 07:49:56.402507,2021-08-08 07:49:58.896807,0 days 00:00:02.494300,0.0009478300736262296,0.5431708461410318,0.5400001709023718,0.00035399871231354404,1.1091165268716304e-05,depthwise,0.012362737673613788,7,18.962845364457795,0.7608281893908045,35,COMPLETE
79,0.814023,2021-08-08 07:49:58.897245,2021-08-08 07:51:29.418557,0 days 00:01:30.521312,0.0035809874457305925,0.4888654914152065,0.49660978477839135,0.0041979647524237424,1.3853653710332426e-06,depthwise,0.0024618531534386996,6,15.197914699649393,0.8586590238242569,7272,COMPLETE
80,0.8140953333333334,2021-08-08 07:51:29.419011,2021-08-08 07:52:57.937160,0 days 00:01:28.518149,0.00275989769869709,0.49391409083572047,0.4990047996276123,0.004564316403170947,1.316768207182959e-06,depthwise,0.001929326851701804,6,15.759069194422754,0.8520994117933536,7138,COMPLETE
81,0.8139786666666667,2021-08-08 07:52:57.937630,2021-08-08 07:54:01.729559,0 days 00:01:03.791929,0.0030703886220628386,0.505211967868475,0.4993592271833954,0.006019789556249897,1.4397941436101305e-06,depthwise,0.002213791750752893,6,15.232418868888283,0.8581508197335741,5091,COMPLETE
82,0.8134579999999999,2021-08-08 07:54:01.730019,2021-08-08 07:56:08.118345,0 days 00:02:06.388326,0.006129567093352604,0.47448018860204344,0.6114347646528168,0.002202625239542116,2.509510845237126e-07,depthwise,0.006744479857716642,6,15.044528921124988,0.887404018043014,10000,COMPLETE
83,0.780963,2021-08-08 07:56:08.118820,2021-08-08 07:56:10.606711,0 days 00:00:02.487891,0.0510166444740778,0.5547775721957561,0.5430260341590646,0.0008735448098820613,4.966200001277397e-07,depthwise,0.0020794132301604333,7,19.950530994618045,0.8123959317517975,35,COMPLETE
84,0.8116563333333332,2021-08-08 07:56:10.607165,2021-08-08 07:57:23.736569,0 days 00:01:13.129404,0.0007878098499547393,0.5314064458328953,0.5782766901852571,0.004115861793610022,3.9022353040479665e-06,depthwise,0.00030546862735848556,5,0.2302132715617082,0.8414572018869745,6772,COMPLETE
85,0.7730693333333334,2021-08-08 07:57:23.737056,2021-08-08 07:57:25.644066,0 days 00:00:01.907010,0.0017535686573430136,0.46759470557187327,0.4938887626250849,0.00017919052872111084,1.428740489265283e-07,depthwise,0.0011454763736962422,6,12.554759550023144,0.7774810261735483,29,COMPLETE
86,0.7818860000000001,2021-08-08 07:57:25.644512,2021-08-08 07:57:27.880301,0 days 00:00:02.235789,0.0002505078038780011,0.6130326426773413,0.47435790809365114,0.0025229568839819933,1.9311913117101166e-06,depthwise,0.012036938783950145,7,15.718277802745387,0.8247858740441705,23,COMPLETE
87,0.7747333333333334,2021-08-08 07:57:27.880747,2021-08-08 07:57:29.926165,0 days 00:00:02.045418,0.0025304094272246692,0.571950538808071,0.5075278160888897,0.0005679166541837906,5.253966488444252e-07,depthwise,0.0441647440043968,6,11.87850200730509,0.9352239598556518,36,COMPLETE
88,0.8133463333333334,2021-08-08 07:57:29.926610,2021-08-08 08:00:19.478157,0 days 00:02:49.551547,0.01700069723765163,0.5249942958015213,0.6307733150116401,0.001276701698580136,4.418908995982112e-06,depthwise,6.393695195290782e-05,7,17.09896635838554,0.7255775363605128,10000,COMPLETE
89,0.8144216666666667,2021-08-08 08:00:19.478632,2021-08-08 08:01:13.870697,0 days 00:00:54.392065,0.004563062970612721,0.4939520442474842,0.5466643694794001,0.006435169122553399,1.5743020027665742e-05,depthwise,0.0032452659280471684,7,13.99584768341603,0.7444237031891701,3505,COMPLETE
90,0.813911,2021-08-08 08:01:13.871165,2021-08-08 08:01:58.190970,0 days 00:00:44.319805,0.0005870563626583466,0.6280221953514615,0.5307875597693024,0.007918152573669113,1.1509563559281031e-05,depthwise,0.01599631237111684,7,9.221491705385084,0.7539499796491211,2505,COMPLETE
91,0.8143406666666667,2021-08-08 08:01:58.191418,2021-08-08 08:03:24.124409,0 days 00:01:25.932991,0.001341471112769743,0.49421042927609676,0.563669383352604,0.003985455768275858,1.727940035771122e-05,depthwise,0.005387843884757537,7,13.835298555907599,0.7995137274636265,5534,COMPLETE
92,0.8142456666666668,2021-08-08 08:03:24.124871,2021-08-08 08:03:47.343849,0 days 00:00:23.218978,0.004719991953590537,0.42102947398069535,0.562108406316212,0.01593113181606552,2.0329091648160406e-05,depthwise,0.006188939452552416,7,11.935275456491743,0.6815205577848273,1455,COMPLETE
93,0.8146169999999998,2021-08-08 08:03:47.344330,2021-08-08 08:04:11.115529,0 days 00:00:23.771199,0.0014149319762766358,0.4344625228060218,0.5867655407849977,0.015738247426820427,1.8055658825790837e-05,depthwise,0.004932488525390788,7,19.97095734827788,0.6805137725187935,1565,COMPLETE
94,0.814222,2021-08-08 08:04:11.116062,2021-08-08 08:04:33.006298,0 days 00:00:21.890236,0.0014459643696193045,0.4099465427423541,0.6338906416678222,0.01640578512668577,2.0496041097990264e-05,depthwise,0.0061481804716889904,8,11.218798997215517,0.6806170996306558,1055,COMPLETE
95,0.814164,2021-08-08 08:04:33.006748,2021-08-08 08:07:05.046137,0 days 00:02:32.039389,0.00487334689330727,0.4455781500792097,0.5863947960560311,0.0017438876026863769,1.4416856741682852e-05,depthwise,0.0033830548636134845,7,19.584601034769598,0.7756852225342409,10000,COMPLETE
