number,value,datetime_start,datetime_complete,duration,params_alpha,params_colsample_bylevel,params_colsample_bytree,params_eta,params_gamma,params_grow_policy,params_lambda,params_max_depth,params_min_child_weight,params_subsample,user_attrs_n_estimators,state
75,0.8143786666666667,2021-08-08 09:56:03.384252,2021-08-08 09:56:26.291959,0 days 00:00:22.907707,0.32302770575699324,0.44129903666226056,0.5249253816826359,0.0179468595776371,4.163426022316056e-07,depthwise,0.027492516460825775,8,16.46962190295262,0.8360871835515529,1191,COMPLETE
76,0.8143373333333334,2021-08-08 09:56:26.292407,2021-08-08 09:56:48.757300,0 days 00:00:22.464893,0.6977696648426722,0.4328247911922376,0.4408846008070346,0.018346510505103334,3.940549775872832e-07,depthwise,0.03638969762954553,8,16.37376104642654,0.6776360865189697,1221,COMPLETE
77,0.8125223333333333,2021-08-08 09:56:48.757753,2021-08-08 09:57:09.336278,0 days 00:00:20.578525,0.683835442160481,0.42894947793257576,0.4808111375041919,0.018501369545334347,1.8751469284794683e-08,depthwise,0.03081575644131692,8,0.6665945889379806,0.6895626048655943,741,COMPLETE
78,0.7893140000000001,2021-08-08 09:57:09.336732,2021-08-08 09:57:12.510231,0 days 00:00:03.173499,0.3828549124181234,0.49352857394869504,0.44057082618714255,1.2429815253595295e-06,4.92773607754879e-07,depthwise,0.05240931216457688,9,9.178695669585121,0.7427400332929457,15,COMPLETE
79,0.8147003333333332,2021-08-08 09:57:12.510676,2021-08-08 09:59:31.719164,0 days 00:02:19.208488,0.15949080891555914,0.4645528255614672,0.52001260519687,0.0025820179122077627,1.6615501794466337e-07,depthwise,0.10145552880319456,8,12.564168819333375,0.6921952129434771,7466,COMPLETE
80,0.8146646666666667,2021-08-08 09:59:31.719647,2021-08-08 10:01:29.596842,0 days 00:01:57.877195,0.08564084742920461,0.4131503391524494,0.608714434159765,0.00301595015558554,1.0502973221999692e-08,depthwise,0.14944007082215127,8,13.173813549687779,0.6972733312546446,6292,COMPLETE
81,0.81465,2021-08-08 10:01:29.597310,2021-08-08 10:03:46.560827,0 days 00:02:16.963517,0.11240941581557273,0.41553536599783636,0.610960755174856,0.0024357194709082345,1.4015346314442929e-08,depthwise,0.12458260428334743,8,12.568991321808307,0.6657038781635558,7287,COMPLETE
82,0.8145993333333333,2021-08-08 10:03:46.561299,2021-08-08 10:06:05.753977,0 days 00:02:19.192678,0.10043184495402498,0.4064930718977938,0.5938202544089941,0.002312428295067946,1.9527594008797864e-08,depthwise,0.08878673518279395,8,12.470957723145974,0.5896477829281204,7530,COMPLETE
83,0.8148043333333334,2021-08-08 10:06:05.754442,2021-08-08 10:08:18.090554,0 days 00:02:12.336112,0.37695293868990254,0.4086257729936362,0.6090006998056801,0.002518413168303246,1.0971318764540001e-08,depthwise,0.11970248223514139,9,12.599426558021316,0.5929421363476545,5820,COMPLETE
84,0.8147463333333334,2021-08-08 10:08:18.091020,2021-08-08 10:10:32.921585,0 days 00:02:14.830565,0.3403844611827924,0.4099726318674993,0.5989306122383259,0.0023916801002171408,1.7459290136304046e-08,depthwise,0.12582534530861933,9,11.781862173325228,0.598085159266656,5790,COMPLETE
85,0.8144299999999999,2021-08-08 10:10:32.922057,2021-08-08 10:13:08.681610,0 days 00:02:35.759553,0.08241920684615031,0.4049187225103175,0.6136886487183634,0.0021489744390971147,1.1552989172955408e-08,depthwise,0.11630646654379573,9,5.915593054758018,0.5981759569550402,5788,COMPLETE
86,0.8139543333333333,2021-08-08 10:13:08.682071,2021-08-08 10:17:00.893708,0 days 00:03:52.211637,0.04501199954703214,0.3218566368504368,0.6024007775025376,0.0010097462344648394,2.7784168011502972e-08,depthwise,0.35345525566305774,9,12.629249698817926,0.5667015372601006,10000,COMPLETE
