number,value,datetime_start,datetime_complete,duration,params_alpha,params_colsample_bylevel,params_colsample_bytree,params_eta,params_gamma,params_grow_policy,params_lambda,params_max_depth,params_min_child_weight,params_subsample,user_attrs_n_estimators,state
75,0.8112466666666666,2021-08-08 04:47:07.098141,2021-08-08 04:47:23.134912,0 days 00:00:16.036771,7.25565959880854e-08,0.9634064169255903,0.3261861505640421,0.025001764334780113,1.114260559042797e-05,lossguide,2.7564896828934408e-05,8,9.1429869737038,0.8386318036307419,675,COMPLETE
76,0.8116476666666667,2021-08-08 04:47:23.135349,2021-08-08 04:47:54.770155,0 days 00:00:31.634806,3.2610328345492846e-07,0.8781419487578155,0.23021434479262992,0.015433596441216162,4.7089667941041815e-07,lossguide,0.00044663250524302713,9,14.109124786308115,0.8757958246134357,1284,COMPLETE
77,0.8107396666666666,2021-08-08 04:47:54.770728,2021-08-08 04:48:01.796258,0 days 00:00:07.025530,5.835170972252948e-07,0.8384339537208951,0.4181176440312438,0.06192456769118508,6.469665830701804e-07,lossguide,0.0006042749026237175,9,15.569535221005637,0.8652022494308991,199,COMPLETE
78,0.8099923333333333,2021-08-08 04:48:01.796708,2021-08-08 04:48:06.646491,0 days 00:00:04.849783,8.606183747966384e-06,0.8801048270619312,0.2767289534252978,0.12550812032266173,2.453713921669567e-07,lossguide,0.0003148382715160602,9,10.831127431275863,0.8879256879919518,118,COMPLETE
79,0.8112693333333333,2021-08-08 04:48:06.646946,2021-08-08 04:48:40.748145,0 days 00:00:34.101199,1.8374027500956444e-06,0.9744902152184435,0.22184620572128583,0.013869076556023235,4.0458059696124833e-07,lossguide,0.00012678277114522928,8,8.635356260488141,0.8194358218609381,1623,COMPLETE
80,0.80536,2021-08-08 04:48:40.748591,2021-08-08 04:48:43.227907,0 days 00:00:02.479316,4.3333897098905856e-05,0.8301056678042454,0.3554147176236534,0.3663099106087764,0.9479344029073803,lossguide,6.7197261000368625e-06,9,14.9886549342775,0.9053309250479913,39,COMPLETE
81,0.8112666666666666,2021-08-08 04:48:43.228341,2021-08-08 04:49:08.258354,0 days 00:00:25.030013,2.548447969724089e-07,0.9202260444976075,0.20081302680018182,0.019765713765417074,0.00016080426339494064,lossguide,9.791199388867604e-05,8,12.42829406855003,0.8493045030905398,1250,COMPLETE
82,0.8107703333333333,2021-08-08 04:49:08.258805,2021-08-08 04:49:18.467397,0 days 00:00:10.208592,4.124625074892658e-07,0.9461732775926336,0.2668311081558784,0.05714362181151261,1.481321418219888e-06,lossguide,4.4965252572194707e-05,9,12.798804969983319,0.9496006686855294,338,COMPLETE
83,0.7730783333333333,2021-08-08 04:49:18.467845,2021-08-08 04:49:23.606419,0 days 00:00:05.138574,1.0408923717276727e-06,0.9122067009759367,0.2251850530827496,1.0171038645668938e-06,7.175886282046083e-06,lossguide,0.001669966026328,8,6.6933562362046795,0.9794023480053967,97,COMPLETE
84,0.8117536666666667,2021-08-08 04:49:23.606860,2021-08-08 04:49:57.458648,0 days 00:00:33.851788,1.0437643949996249e-07,0.8749578972421639,0.31000612080569445,0.013382081912891284,1.1055456728558026e-07,lossguide,2.042669708017117e-05,9,11.358954734804476,0.8855877627421499,1227,COMPLETE
85,0.7870123333333333,2021-08-08 04:49:57.459090,2021-08-08 04:50:01.974541,0 days 00:00:04.515451,2.9565050500043697e-08,0.8783514024903742,0.3131350236293628,0.0030908352998148623,1.165275317537077e-07,lossguide,2.603232195954386e-05,9,3.916500163906128,0.7470919904798843,32,COMPLETE
86,0.8118756666666668,2021-08-08 04:50:01.974990,2021-08-08 04:50:44.372341,0 days 00:00:42.397351,8.959986661656785e-08,0.9825124290485652,0.2848185124181601,0.009729974393082867,0.0071076080254594285,lossguide,3.9157575667236536e-06,9,10.552579947565087,0.8837133898570514,1470,COMPLETE
87,0.8115260000000001,2021-08-08 04:50:44.372794,2021-08-08 04:51:23.636528,0 days 00:00:39.263734,7.266179577174815e-08,0.9873235391621054,0.4041932019027105,0.009879084391972194,0.009388104646586848,lossguide,1.10672636780072e-06,9,10.689469393266567,0.9152876696029868,1274,COMPLETE
88,0.81092,2021-08-08 04:51:23.636983,2021-08-08 04:51:37.956975,0 days 00:00:14.319992,1.0986268912667286e-08,0.8718113291779319,0.2890159807137718,0.03522884395959729,2.1512362714640584e-07,lossguide,4.11768325269521e-06,9,7.903484965030245,0.883915104137036,440,COMPLETE
89,0.8093026666666666,2021-08-08 04:51:37.957416,2021-08-08 04:51:42.441515,0 days 00:00:04.484099,1.6087697195529646e-07,0.9753226841025875,0.34404251077062964,0.10137254217694996,0.032482850764297154,lossguide,1.7823769191611892e-05,8,6.19025865428353,0.8286313453580694,118,COMPLETE
90,0.8114773333333334,2021-08-08 04:51:42.441964,2021-08-08 04:52:25.114565,0 days 00:00:42.672601,1.3214506730742772e-05,0.9056066323972484,0.3702599891486075,0.007922413360900247,0.0019387397660240474,lossguide,8.942990564055938e-06,9,10.117150053515811,0.21094192929869682,2120,COMPLETE
91,0.8116393333333334,2021-08-08 04:52:25.115030,2021-08-08 04:52:58.935044,0 days 00:00:33.820014,8.001596233952409e-08,0.9967011919688913,0.3339416071199774,0.01220556159195205,0.010001251162064129,lossguide,1.0883484226689323e-06,9,11.206570138781974,0.9163257840495583,1148,COMPLETE
92,0.8120733333333333,2021-08-08 04:52:58.935587,2021-08-08 04:53:36.533668,0 days 00:00:37.598081,2.2484124309284513e-08,0.9500802104641338,0.3275074799414502,0.011713594542050449,0.012165437995362283,lossguide,3.813583275554266e-06,9,15.676083943144711,0.9464938058059686,1442,COMPLETE
93,0.786115,2021-08-08 04:53:36.534120,2021-08-08 04:53:40.524227,0 days 00:00:03.990107,2.4452991895997587e-08,0.9953346718445293,0.3144411064785622,0.0034132477489217904,0.007612152361155351,lossguide,1.059143850170671e-06,9,15.989610678048713,0.9498867594998242,32,COMPLETE
94,0.8112360000000001,2021-08-08 04:53:40.524783,2021-08-08 04:57:19.697604,0 days 00:03:39.172821,1.0072953272905198e-07,0.9541790294125867,0.2512490968109373,0.0019183806642805645,0.010297965875520102,lossguide,5.580504549041691e-07,9,7.790650790313226,0.9829210559965049,7390,COMPLETE
95,0.811792,2021-08-08 04:57:19.698071,2021-08-08 04:57:51.475712,0 days 00:00:31.777641,2.747243360691885e-08,0.9317374106130101,0.29087308914213944,0.013579259215704255,0.005143013857050429,lossguide,1.8200906075012937e-07,8,16.942232354640236,0.8935612668046394,1625,COMPLETE
96,0.8117153333333333,2021-08-08 04:57:51.476169,2021-08-08 04:58:21.241990,0 days 00:00:29.765821,3.3219849341648314e-08,0.9756267783889195,0.32912622731839064,0.01206103619896651,0.01772314204557635,lossguide,1.4805124466827905e-07,8,15.247844471949627,0.9313030752313504,1395,COMPLETE
97,0.811888,2021-08-08 04:58:21.242444,2021-08-08 04:58:57.091968,0 days 00:00:35.849524,3.1813077481957376e-08,0.9821224944914454,0.2842830542330268,0.011895611582320048,0.04810772070758043,lossguide,2.8030457088830177e-07,8,16.618901148713057,0.9320007019457057,1809,COMPLETE
98,0.81155,2021-08-08 04:58:57.092418,2021-08-08 04:59:11.619491,0 days 00:00:14.527073,3.898563532417061e-08,0.933476480756293,0.2786043808038084,0.031636746100173245,0.14675358047854328,lossguide,1.3125891832735565e-07,8,16.926831878213793,0.9621073044560458,693,COMPLETE
99,0.811041,2021-08-08 04:59:11.619940,2021-08-08 04:59:20.779772,0 days 00:00:09.159832,1.731522191756896e-08,0.9774072689229396,0.2884657491078989,0.048448232121064555,0.020271111224195018,lossguide,2.655190927459492e-07,8,15.403822344575529,0.9354014095190494,387,COMPLETE
100,0.8115556666666667,2021-08-08 04:59:20.780320,2021-08-08 04:59:50.146297,0 days 00:00:29.365977,4.454629734010762e-08,0.9658975409506916,0.35237076908930093,0.012492178207845832,0.003965022764863595,lossguide,1.78278066200883e-07,8,9.44311472460824,0.8899565726600044,1274,COMPLETE
101,0.8118146666666667,2021-08-08 04:59:50.146802,2021-08-08 05:00:22.502337,0 days 00:00:32.355535,1.8532155323722688e-08,0.9411985705360973,0.32433918388547095,0.011507998084202073,0.07256824691057144,lossguide,3.4104748239216654e-07,8,14.170104021533053,0.8958694530142133,1545,COMPLETE
