number,value,datetime_start,datetime_complete,duration,params_alpha,params_colsample_bylevel,params_colsample_bytree,params_eta,params_gamma,params_grow_policy,params_lambda,params_max_depth,params_min_child_weight,params_subsample,user_attrs_n_estimators,state
75,0.8141293333333333,2021-08-09 12:50:27.878247,2021-08-09 12:50:48.965502,0 days 00:00:21.087255,6.642288757386491e-08,0.5214787584461651,0.2713567189773373,0.02559418767598556,0.1465285094617206,lossguide,0.004917370131299635,9,19.963536093841054,0.9468811610185965,945,COMPLETE
76,0.813793,2021-08-09 12:50:48.965945,2021-08-09 12:51:08.236460,0 days 00:00:19.270515,6.477301169782723e-08,0.5097155872167576,0.27855854319534107,0.026685941444706318,0.18070332094355282,lossguide,0.013072659763007576,9,9.066359215322287,0.9962297010686302,706,COMPLETE
77,0.813402,2021-08-09 12:51:08.236893,2021-08-09 12:51:23.353672,0 days 00:00:15.116779,1.4581697160228298e-08,0.5122981046457542,0.27307313415145557,0.03303704463443806,0.13758637269901075,lossguide,0.05822194027306976,9,8.351969617317135,0.9940048274068634,517,COMPLETE
78,0.814009,2021-08-09 12:51:23.354108,2021-08-09 12:51:50.328224,0 days 00:00:26.974116,4.4037555751751105e-08,0.4534150851760825,0.2747437947219932,0.019877850284508943,0.022865761450026216,lossguide,0.017140954459119086,9,11.484732802081682,0.9367792713364856,1100,COMPLETE
79,0.8141716666666667,2021-08-09 12:51:50.328676,2021-08-09 12:52:13.727865,0 days 00:00:23.399189,2.5875411277197908e-08,0.48034638576669314,0.30035510126311504,0.02022245021315315,0.03485459339321139,depthwise,0.012655477612937595,9,11.207045633544267,0.9994888190443377,900,COMPLETE
80,0.8141313333333334,2021-08-09 12:52:13.728306,2021-08-09 12:52:36.016779,0 days 00:00:22.288473,2.697874774821312e-08,0.4608511833452773,0.3045157127480388,0.02187739358659602,0.029363851809499037,depthwise,0.01258651299340863,9,11.72251899260616,0.928547314381599,887,COMPLETE
81,0.8143483333333332,2021-08-09 12:52:36.017236,2021-08-09 12:53:00.727516,0 days 00:00:24.710280,3.237039976337432e-08,0.47829659768760957,0.2967818139296889,0.019307878927896906,0.03715626861025152,depthwise,0.01389303658800739,9,11.514696804542092,0.9396368977970906,983,COMPLETE
82,0.8140663333333333,2021-08-09 12:53:00.727955,2021-08-09 12:53:40.022688,0 days 00:00:39.294733,3.0017672509042746e-08,0.4438818766223286,0.23697015873266258,0.013643267893564888,0.037463552077798064,depthwise,0.01520662311593038,9,11.857538741440893,0.9370146627459359,1739,COMPLETE
83,0.8142683333333333,2021-08-09 12:53:40.023127,2021-08-09 12:54:21.689260,0 days 00:00:41.666133,2.455821443556363e-08,0.4265527089184644,0.24338569927776263,0.012717329910555252,0.0371070283021371,depthwise,0.014825159860644756,8,12.283259612693499,0.93403344043741,2273,COMPLETE
84,0.8124513333333333,2021-08-09 12:54:21.689729,2021-08-09 12:54:31.520362,0 days 00:00:09.830633,2.8558762079441954e-08,0.42408702716273783,0.2439049350437525,0.054407902585416855,0.00982996067954816,depthwise,0.06743558143014321,8,5.11936410607898,0.9237148025114218,411,COMPLETE
85,0.813951,2021-08-09 12:54:31.520805,2021-08-09 12:55:15.356271,0 days 00:00:43.835466,1.1644243885985044e-08,0.35257710951130905,0.2275037815335281,0.012727845812275724,0.04137118362286134,depthwise,0.009972794184076074,9,12.73351126610466,0.8958281878834589,2146,COMPLETE
86,0.814131,2021-08-09 12:55:15.356718,2021-08-09 12:55:52.497027,0 days 00:00:37.140309,2.3765473174957623e-08,0.35879650901882065,0.29887403870094287,0.01195031323100705,0.050572661110216285,depthwise,0.4190929561541338,8,14.213963180284539,0.8760359957295443,2058,COMPLETE
87,0.8138693333333333,2021-08-09 12:55:52.497483,2021-08-09 12:56:25.835534,0 days 00:00:33.338051,2.4612808788729143e-08,0.36893809929048393,0.3035000617630764,0.012464742994251005,0.04985894828292802,depthwise,0.6585355251107033,8,6.822084419873802,0.9069439382314503,1618,COMPLETE
88,0.7751343333333334,2021-08-09 12:56:25.835998,2021-08-09 12:56:32.224491,0 days 00:00:06.388493,3.719151888754213e-07,0.4874687025027451,0.254734765812776,5.569911026458899e-08,0.0276172587423665,depthwise,0.23868368016337152,8,14.25373349094137,0.8782442251192977,172,COMPLETE
89,0.8016086666666666,2021-08-09 12:56:32.224938,2021-08-09 12:56:34.407309,0 days 00:00:02.182371,1.0654267230937582e-07,0.4338091467730507,0.20210913057838165,0.5951725525662407,0.011788240474223857,depthwise,0.03888870063306711,8,10.217273550148228,0.8597023325968245,39,COMPLETE
90,0.8098783333333333,2021-08-09 12:56:34.407743,2021-08-09 12:56:38.659195,0 days 00:00:04.251452,2.8158194109104413e-08,0.3242158495801552,0.3495228216734399,0.16838720468467908,0.07699162350483557,depthwise,0.21176112546496142,8,4.79672044946617,0.9040115060932743,134,COMPLETE
91,0.8145746666666667,2021-08-09 12:56:38.659629,2021-08-09 12:57:12.839973,0 days 00:00:34.180344,1.870476357029092e-08,0.39907926364549046,0.29174374234354966,0.014895452611798463,0.03739395168345308,depthwise,0.009427198851849087,9,14.808736511043136,0.9340345793381155,1534,COMPLETE
92,0.8136386666666667,2021-08-09 12:57:12.840414,2021-08-09 12:57:23.546974,0 days 00:00:10.706560,1.7463897804867148e-08,0.38768191826022214,0.2980002340351851,0.056189560084205434,0.08390731364091063,depthwise,0.01145913540187107,9,14.604579552571877,0.9359633901003088,438,COMPLETE
93,0.8138326666666668,2021-08-09 12:57:23.547409,2021-08-09 12:57:50.320107,0 days 00:00:26.772698,1.1260677550232275e-08,0.44541028079958245,0.22903054603005193,0.01814792934524567,0.03169160738406152,depthwise,0.04097367349565907,9,11.169311561861903,0.9288033617228226,1127,COMPLETE
94,0.813797,2021-08-09 12:57:50.320550,2021-08-09 12:58:34.066998,0 days 00:00:43.746448,3.900761846208887e-08,0.4906717001687083,0.2524602113299261,0.010632363050411193,0.00384531603739882,depthwise,0.003133652000776325,8,8.115913512830025,0.8723825384563623,2205,COMPLETE
95,0.8145903333333333,2021-08-09 12:58:34.067453,2021-08-09 12:59:53.862832,0 days 00:01:19.795379,3.3139638929757034e-07,0.4031334939215635,0.32217981168826915,0.005503258897169752,0.01600230006895692,depthwise,0.008432318395430922,9,14.613647586918377,0.8353980059329602,3615,COMPLETE
96,0.8136950000000001,2021-08-09 12:59:53.863293,2021-08-09 13:01:18.063602,0 days 00:01:24.200309,3.41790949896216e-07,0.40535477365228734,0.32849105144543705,0.00497127935877702,0.008623189054364277,depthwise,0.00943336024743559,9,3.746611829172627,0.8355910660694881,2846,COMPLETE
97,0.812017,2021-08-09 13:01:18.064067,2021-08-09 13:01:23.028700,0 days 00:00:04.964633,1.113489671105433e-07,0.33322411219435,0.2938864064345682,0.11711150045576785,0.2741241378318907,depthwise,0.020538650984650342,8,15.217403294807823,0.9123454644491429,222,COMPLETE
98,0.8140903333333332,2021-08-09 13:01:23.029131,2021-08-09 13:02:26.531388,0 days 00:01:03.502257,1.6976024785541506e-08,0.46433341304313713,0.3193311372942189,0.0064746562286185465,0.016020465520265457,depthwise,0.0011586812090837375,9,5.922444829346355,0.8798041681044093,2244,COMPLETE
99,0.8134266666666666,2021-08-09 13:02:26.531842,2021-08-09 13:02:36.970221,0 days 00:00:10.438379,3.797556752284486e-08,0.38198924025017106,0.35117799645406755,0.05191038720275113,0.0018241274920147716,depthwise,0.0026989876446458804,8,7.319002114116061,0.9481968134463545,456,COMPLETE
100,0.8142079999999999,2021-08-09 13:02:36.970675,2021-08-09 13:04:34.251930,0 days 00:01:57.281255,2.1324628516411245e-07,0.42261912774777255,0.2592727149234555,0.0039147533650210975,0.0640718710477038,depthwise,0.02708585547523377,9,9.823030835668693,0.8511138192231937,5193,COMPLETE
101,0.8143023333333334,2021-08-09 13:04:34.252397,2021-08-09 13:06:42.808850,0 days 00:02:08.556453,1.0154149496890783e-08,0.4214160935553044,0.2608089584393769,0.003676410945985576,0.061367787652728746,depthwise,0.03068837155555813,9,10.708235575543984,0.8350519407106877,5859,COMPLETE
